"ID","Title","Link","Company","Location","Remote","Experience","EmploymentType","DatePosted","RoleDescription"
2886903,"HRIS Lead (Workday)","https://job-boards.greenhouse.io/thefarmersdog/jobs/7976937002","FarmersDog","New York","No",8,"Full time","2025-09-23T20:25:20.054848Z","Who We Are
The Farmers Dog was born from a mission to change the landscape of pet health, providing dogs and their humans with honest, smart, and simple care. Were starting by radically improving the $90 billion pet food industry, replacing bags of highly-processed pellets with a personalized subscription service that sends complete and balanced, freshly-made dog food directly to customers doors. Our ultimate goal is to create innovative, delightful and personalized experiences across all aspects of pet care, and we believe our direct-to-consumer business model, holistic approach to growth, and dynamic culture uniquely position us to shepherd this backwards industry into the future.To date, The Farmers Dog has delivered over 1 billion meals nationwide and raised over $150M in funding to help us build a company as healthy as the dogs who are eating those meals. Join us as we continue to develop ways of bringing peace of mind to customers, health to their companions, and much-needed change to the way people feed and care for their pets.
#LongLiveDogs
What We Stand For and Where Youll Come In
At The Farmers Dog, we believe great technology should make work easier, not harderand youll be at the center of bringing that to life. As a senior member of our HRIS function, youll lead the hands-on execution of complex Workday administration and enhancements, ensuring the platform remains accurate, efficient, and people-centered as we scale.
In partnership with our HRIS Analyst, youll drive high-impact configuration, shape service delivery practices, and act as a trusted partner across Humans, IT, and Finance. While this role does not have direct people management responsibilities, youll provide mentorship and thought leadership to peers and partnerssharing expertise, elevating practices, and helping to foster a culture of operational excellence.
This role reports to the Director, Humans Systems &amp; Operations and plays a key role in strengthening the scalability, compliance, and impact of our Humans technology ecosystem.
One Team: We dont think of ourselves as Acquisition Marketers, Engineers, Data Analysts, or Product Managers. Beyond denoting skill sets and areas of expertise, we dont think departments matter. Wed rather align ourselves to the goals were working to achieve and make sure we have necessary subject matter expertise to drive meaningful impact. We strive to orient ourselves around customer problems TOGETHER  getting the right people, with the right context, in the right rooms/Zooms to solve problems holistically.
We are skeptical about everything and precious about nothing:  Ideas can and should come from anywhere, and we arent tied to our own. We proactively source input. We talk to our customers and leads regularly and are quick to change course if we know theres a better or more impactful way to solve problems.
We consider the customer journey in all of our decisions:  We know that no interaction exists in a silo and therefore understand how important every single one is.  We ensure our strategy sets prospective and new customers up for success and drives long-term retention.  We answer questions and address problems early and proactively.  We understand the value of different channels, initiatives, and messages and know how to articulate impact and advocate for prioritization holistically.
We Execute For Impact: We dont subscribe to best practices or industry KPIs. Were uninterested in how we compare to benchmarks; instead we orient ourselves around being the best we can possibly be. Similarly, we dont subscribe to rigid or classical expectations of roles  i.e. acquisition is hyper-focused on improving customer retention and experience.
We Are Focused and Work Without Assumption: We are not beholden to ideas. We have goals and believe everything beyond that is a series of hypotheses to validate. To that end, we seek to work in sequence and not in parallel. We constantly ask ourselves, whats the most important hypothesis I should be working on right now? How do I confirm or reject that hypothesis as fast as possible?. We rarely have timelines/deadlines and are constantly taking in new information and adjusting our priorities accordingly. We dont expect to be perfect the first time.
How You'll Make An Impact
Workday Delivery &amp; Mentorship

Lead complex Workday administration, configuration, and system enhancements to meet evolving business and employee needs.
Partner with HRIS Analyst to shape intake priorities, advise on feasibility, and support sprint executionensuring requests are delivered with quality and clarity.
Coordinate with external Workday service partners to deliver aligned, high-quality solutions.
Champion a customer-first mindset by delivering intuitive, responsive support and self-service tools.
Safeguard system trust through data integrity routines, regular audits, and proactive issue resolution.
Identify and implement automation, streamlined workflows, and system enhancements that improve both employee experience and operational efficiency.
Act as a mentor and thought partner to other HRIS Analystssupporting skill development, knowledge sharing, and modeling operational excellence, documentation discipline, and service orientation.
Collaborate with the Director, Humans Systems &amp; Operations to inform priorities, shape sprint work, and provide feedback on process improvements.

Governance, Compliance &amp; System Integrity

Ensure Workday meets security, audit, and compliance requirements by collaborating with IT, Business Systems, Cyber, Finance, and Legal.
Develop and maintain SOPs, job aids, and training materials to promote consistency, data integrity, and audit readiness.
Enable employees, managers, and HR partners to use Workday confidently through clear guidance and resources.

Cross-Functional Partnership &amp; Technology Strategy

Partner with Total Rewards, Talent Acquisition, Payroll, HR Ops, and other stakeholders to optimize employee lifecycle processes and recommend system improvements.
Work closely with People Analytics, IT, and Finance to execute the broader Humans technology roadmap.

We're Excited About You Because

You bring about 68 years of progressive HRIS experience, with at least 34 years focused on Workday administration.
You are highly skilled in Workday configuration across multiple modules and have led complex enhancements from design through delivery.
You thrive in cross-functional environments, building strong partnerships across Humans, IT, Finance, and Legal.
You have experience shaping service delivery practices, advising on ticket prioritization, and contributing to sprint-based improvements.
You have a customer-centric mindset, ensuring technology enhances the employee experience.
Youre energized by the opportunity to deliver operational excellence today while influencing how we scale for tomorrow.
Youre a natural mentor, eager to share expertise and elevate the skills of other HRIS Analysts through knowledge sharing and peer partnership.

Office Guidelines
We are an in-office culture, made of in-office people who thrive on the collaboration and magnetism of working in a shared space. We are seeking individuals who excel in this type of environment, where being present fosters deeper connections and engagement.
Our Belonging Philosophy:
Our companys mission is rooted in deep, genuine care for dogs  and for the people who love them. As an organization we are full of individuals who are unique in many ways, but all united in a mission of providing true peace of mind to dog lovers everywhere. Fixing this industry and improving the lives of pets and their people will be a difficult, decades-long endeavor. We believe the best use of our time, energy, and resources as a collective team is to focus on this mission, and on supporting our team to do their best work and be their best selves. In support of this were committed to supporting a diverse workforce, and investing in internal structures, opportunities, and training that create and sustain an inclusive team. We strive to provide an experience at TFD that will be invested, meaningful and memorable as we progress on the journey to reimagine how we feed and care for our pets.
A Few of Our Best Benefits

Dog-friendly office in Greenwich Village
Market-competitive compensation and equity packages
Comprehensive Healthcare, Dental, and Vision
Company supported mental health benefits
12 week paid parental leave
Competitive 401k plan with company match
Flexible PTO 
Discounted fresh food for your pup
Your pet interrupting video calls (and in-person meetings) is now a feature, not a bug

We commit to building a competitive compensation package and company environment for all individuals to thrive. We believe in competitive base compensation rooted in location specific market data and performance along with equity ownership in the company that allows every team member to build their personal wealth as the company grows, just as much as we believe in fostering a culture that supports our team members personally, professionally, and holistically. For this role the anticipated hiring base compensation range is $128,000 - $145,000 USD Annual and the compensation offered will include a robust market competitive package of base and equity. In addition to your base compensation offer you will also receive equity ownership in the company. More information about the value of this equity will be shared at the time of offer. This range is representative of NYC Market Data if you are applying to this role outside of the NYC area the range may change.
Equal Employment Opportunity Statement
The Farmer's Dog, Inc. is an equal employment opportunity employer and does not discriminate in hiring on the basis of sex, gender identity, sexual orientation, race, color, religion, creed, national origin, physical or mental disability, protected veteran status or any other legally protected characteristic or status. For more information, please visit Know Your Rights.
Reasonable Accommodations
TFD complies with applicable federal, state, and local disability laws and makes reasonable accommodations for applicants and employees with disabilities.  If a reasonable accommodation is needed to participate in the job application or interview process, to perform essential job functions, and/or to receive other benefits and privileges of employment, please contact humansops@thefarmersdog.com."
3502481,"Senior Treasury Analyst","https://job-boards.greenhouse.io/thefarmersdog/jobs/8138634002","FarmersDog","New York","No",3,"Full time","2025-09-23T20:25:20.054871Z","Who We Are
The Farmers Dog was born from a mission to change the landscape of pet health, providing dogs and their humans with honest, smart, and simple care. Were starting by radically improving the $90 billion pet food industry, replacing bags of highly-processed pellets with a personalized subscription service that sends complete and balanced, freshly-made dog food directly to customers doors. Our ultimate goal is to create innovative, delightful and personalized experiences across all aspects of pet care, and we believe our direct-to-consumer business model, holistic approach to growth, and dynamic culture uniquely position us to shepherd this backwards industry into the future.To date, The Farmers Dog has delivered over 1 billion meals nationwide and raised over $150M in funding to help us build a company as healthy as the dogs who are eating those meals. Join us as we continue to develop ways of bringing peace of mind to customers, health to their companions, and much-needed change to the way people feed and care for their pets.
#LongLiveDogs
What We Stand For and Where Youll Come In
We're on the lookout for a talented individual who can drive our internal treasury management function. As the Senior Treasury Analyst, you'll manage cash flow, including the movement of cash between bank accounts and investments and the reconciliation of our accounts, develop short and long term cash forecasting, and manage our credit, including overall strategy of use of credit cards for invoice payments. You will take charge of documenting our treasury processes and ensure we have the appropriate controls in place. This role will partner closely with FP&amp;A, accounting and senior management.
The Senior Treasury Analyst will report to the Accounting Manager, Revenue.
One Team: We dont think of ourselves as Acquisition Marketers, Engineers, Data Analysts, or Product Managers. Beyond denoting skill sets and areas of expertise, we dont think departments matter. Wed rather align ourselves to the goals were working to achieve and make sure we have necessary subject matter expertise to drive meaningful impact. We strive to orient ourselves around customer problems TOGETHER  getting the right people, with the right context, in the right rooms/Zooms to solve problems holistically.
We are skeptical about everything and precious about nothing:  Ideas can and should come from anywhere, and we arent tied to our own. We proactively source input. We talk to our customers and leads regularly and are quick to change course if we know theres a better or more impactful way to solve problems.
We consider the customer journey in all of our decisions:  We know that no interaction exists in a silo and therefore understand how important every single one is.  We ensure our strategy sets prospective and new customers up for success and drives long-term retention.  We answer questions and address problems early and proactively.  We understand the value of different channels, initiatives, and messages and know how to articulate impact and advocate for prioritization holistically.
We Execute For Impact: We dont subscribe to best practices or industry KPIs. Were uninterested in how we compare to benchmarks; instead we orient ourselves around being the best we can possibly be. Similarly, we dont subscribe to rigid or classical expectations of roles  i.e. acquisition is hyper-focused on improving customer retention and experience.
We Are Focused and Work Without Assumption: We are not beholden to ideas. We have goals and believe everything beyond that is a series of hypotheses to validate. To that end, we seek to work in sequence and not in parallel. We constantly ask ourselves, whats the most important hypothesis I should be working on right now? How do I confirm or reject that hypothesis as fast as possible?. We rarely have timelines/deadlines and are constantly taking in new information and adjusting our priorities accordingly. We dont expect to be perfect the first time.
How You'll Make An Impact

Manage daily cash operations, including monitoring bank balances and moving money between accounts so that we are maximizing the efficient use and reporting of our cash and investments and implement automation to manage the movements of our cash and investments
Ensure compliance with debt covenants and compile and report compliance to our banking partners
Coordinate with external banking partners on compliance, system updates, industry trends to ensure optimal treasury operations and regulatory adherence
Review monthly bank reconciliations and perform weekly cash reconciliations by pulling and categorizing data from Netsuite and banks, analyzing for trends, reconciling to expectations, and proactively identifying process improvements
Develop robust short-term and long-term cash forecasting processes and improve cash forecasting accuracy by collaborating internally with Accounting, Tax, Finance and Humans 
Understand, analyze and recommend investment options and suggest new strategies as market dynamics change
Oversee the use of our credit, including credit cards, to ensure the most efficient invoice and bill payment methods are being used
Help define, standardize, evolve, and document procedures and controls around cash management, including proactively sharing knowledge with others, setting exemplary standards, all while seeking and welcoming feedback in the process

We're Excited About You Because

You bring 3+ years of experience in accounting, banking, treasury or related finance functions
You have a strong foundation in accounting principles and financial reporting
You bring a background and knowledge in banking and treasury, as well as ideas around how to automate processes and implement effective controls
You are process-oriented, and are always challenging to improve existing processes and question what and how we are doing things
You thrive in a fast-paced and ambiguous environment, make data-driven decisions, are naturally curious and proactive self-starter, constantly on the lookout for new opportunities and solutions
Youre an owner, have excellent problem-solving skills, are detail-oriented and proactive, and can prioritize tasks effectively
You're a skilled communicator and have the ability to absorb and distill complexity into simple terms to drive decision-making.
You have familiarity with ERPs (Netsuite is a plus) 
You love dogs.

Office Guidelines
We are an in-office culture, made of in-office people who thrive on the collaboration and magnetism of working in a shared space. We are seeking individuals who excel in this type of environment, where being present fosters deeper connections and engagement.
Our Belonging Philosophy:
At TFD, we believe Belonging is a shared commitment to creating a workplace where every person feels respected, valued, and empowered to be themselves. When people feel a true sense of belonging, they do their best work, take smart risks, and bring forward diverse perspectives  leading to stronger decisions and deeper relationships.We anchor this belief in a simple phrase: Everyones welcome at the dog park. No matter your background, identity, or role, theres space for you here. Theres no one way to show up at the dog park just shared space, mutual respect, and the freedom to be yourself. Being included is just the beginning, its about contributing your voice, growing through challenges, and building trust through shared goals. This philosophy guides how we lead, how we hire, how we communicate, and how we grow.                    We continuously evaluate to ensure we are creating a consistent experience that cultivates belonging for all employees, from hiring and performance reviews to talent development. We also believe Belonging happens in everyday moments of connection; lunch with a new teammate, a shared laugh, or a quick story about your weekend. Our structure includes biannual employee surveys, manager training, TFD camps, and support from Humans to ensure were listening and learning from our Team.
Together, these efforts reflect what Belonging means at TFD: a culture where everyone can thrive.
A Few of Our Best Benefits

Dog-friendly office in Greenwich Village
Market-competitive compensation and equity packages
Comprehensive Healthcare, Dental, and Vision
Company supported mental health benefits
12 week paid parental leave
Competitive 401k plan with company match
Flexible PTO 
Discounted fresh food for your pup
Your pet interrupting video calls (and in-person meetings) is now a feature, not a bug

We commit to building a competitive compensation package and company environment for all individuals to thrive. We believe in competitive base compensation rooted in location specific market data and performance along with equity ownership in the company that allows every team member to build their personal wealth as the company grows, just as much as we believe in fostering a culture that supports our team members personally, professionally, and holistically. For this role the anticipated hiring base compensation range is $102,000 - $115,000  USD Annual and the compensation offered will include a robust market competitive package of base and equity. In addition to your base compensation offer you will also receive equity ownership in the company. More information about the value of this equity will be shared at the time of offer. This range is representative of NYC Market Data if you are applying to this role outside of the NYC area the range may change.
Equal Employment Opportunity Statement
The Farmer's Dog, Inc. is an equal employment opportunity employer and does not discriminate in hiring on the basis of sex, gender identity, sexual orientation, race, color, religion, creed, national origin, physical or mental disability, protected veteran status or any other legally protected characteristic or status. For more information, please visit Know Your Rights.
Reasonable Accommodations
TFD complies with applicable federal, state, and local disability laws and makes reasonable accommodations for applicants and employees with disabilities.  If a reasonable accommodation is needed to participate in the job application or interview process, to perform essential job functions, and/or to receive other benefits and privileges of employment, please contact humansops@thefarmersdog.com."
