"ID","Title","Link","Company","Location","Remote","Experience","EmploymentType","DatePosted","RoleDescription"
3428234,"Senior Food Scientist","https://job-boards.greenhouse.io/thefarmersdog/jobs/8118265002","FarmersDog","New York","No",8,"Full time","2025-09-23T20:25:20.055167Z","Who We Are
The Farmers Dog was born from a mission to change the landscape of pet health, providing dogs and their humans with honest, smart, and simple care. Were starting by radically improving the $90 billion pet food industry, replacing bags of highly-processed pellets with a personalized subscription service that sends complete and balanced, freshly-made dog food directly to customers doors. Our ultimate goal is to create innovative, delightful and personalized experiences across all aspects of pet care, and we believe our direct-to-consumer business model, holistic approach to growth, and dynamic culture uniquely position us to shepherd this backwards industry into the future.To date, The Farmers Dog has delivered over 1 billion meals nationwide and raised over $150M in funding to help us build a company as healthy as the dogs who are eating those meals. Join us as we continue to develop ways of bringing peace of mind to customers, health to their companions, and much-needed change to the way people feed and care for their pets.
#LongLiveDogs
What We Stand For and Where Youll Come In
The Senior Food Scientist will report directly to the Director, Food Science. They will be a key player in the product development process and responsible for coordinating research projects across the organization. They will craft new formulations and find opportunities in our current food products and new options. They will serve as a resource to our customer service agents, brand, and veterinary relations groups for physical product and process information. This role will also require travel of up to 40%.
One Team: We dont think of ourselves as Acquisition Marketers, Engineers, Data Analysts, or Product Managers. Beyond denoting skill sets and areas of expertise, we dont think departments matter. Wed rather align ourselves to the goals were working to achieve and make sure we have necessary subject matter expertise to drive meaningful impact. We strive to orient ourselves around customer problems TOGETHER  getting the right people, with the right context, in the right rooms/Zooms to solve problems holistically.
We are skeptical about everything and precious about nothing:  Ideas can and should come from anywhere, and we arent tied to our own. We proactively source input. We talk to our customers and leads regularly and are quick to change course if we know theres a better or more impactful way to solve problems.
We consider the customer journey in all of our decisions:  We know that no interaction exists in a silo and therefore understand how important every single one is.  We ensure our strategy sets prospective and new customers up for success and drives long-term retention.  We answer questions and address problems early and proactively.  We understand the value of different channels, initiatives, and messages and know how to articulate impact and advocate for prioritization holistically.
We Execute For Impact: We dont subscribe to best practices or industry KPIs. Were uninterested in how we compare to benchmarks; instead we orient ourselves around being the best we can possibly be. Similarly, we dont subscribe to rigid or classical expectations of roles  i.e. acquisition is hyper-focused on improving customer retention and experience.
We Are Focused and Work Without Assumption: We are not beholden to ideas. We have goals and believe everything beyond that is a series of hypotheses to validate. To that end, we seek to work in sequence and not in parallel. We constantly ask ourselves, whats the most important hypothesis I should be working on right now? How do I confirm or reject that hypothesis as fast as possible?. We rarely have timelines/deadlines and are constantly taking in new information and adjusting our priorities accordingly. We dont expect to be perfect the first time.
How You'll Make An Impact

Create products based on ingredient functionality, nutritional targets, consumer need, claim substantiation, operational feasibility and financial targets bringing products from bench top through commercialization (i.e. concept to marketplace).
Assist with pilot facility maintenance and management. Daily activities will include equipment maintenance and sanitation as well as ingredient inventory and management.
Package and prepare samples for shipment as needed.
Review and interpret data from plant trials, nutrient analysis, feeding trials, etc and provide conclusions and recommendations.
Development of ingredient and finished product specifications.
Assist in developing and communicating timelines and cost for projects.
Proactively work with cross-functional team members in various departments including Manufacturing, Operations, Product, Veterinary Relations and Customer Experience.
Coordinate academic research.

We're Excited About You Because

8+ years of experience in R&amp;D or Product Development in the food manufacturing industry.
Bachelors Degree (or higher) in Animal Science, Food Science or a related field.
You are a direct, caring, and persuasive communicator and establish rapport easily with people on your cross-functional team and other key collaborators.
You love to dig into the details, but its also easy for you to pull up and look at the big picture.
Flexibility to commit to up to 40% travel, dependent on the annual event calendar and plant trials.
Proficient knowledge of food formulation, food safety and manufacturing.
You are able to thrive in a fast-paced and ambiguous environment, naturally curious and proactive self-starter, constantly on the lookout for new opportunities and solutions.
Youre an owner, have excellent problem-solving skills and can prioritize tasks effectively, with a strong attention to detail.
You are detail-oriented and proactive, you thrive as a self-starter and excel in managing multiple projects simultaneously.
You're a skilled communicator and have the ability to absorb and distill complexity into simple terms to drive decision making.
Capable of lifting/moving 50+lbs.
You love dogs.

Office Guidelines
We are an in-office culture, made of in-office people who thrive on the collaboration and magnetism of working in a shared space. We are seeking individuals who excel in this type of environment, where being present fosters deeper connections and engagement.
Our Belonging Philosophy:
At TFD, we believe Belonging is a shared commitment to creating a workplace where every person feels respected, valued, and empowered to be themselves. When people feel a true sense of belonging, they do their best work, take smart risks, and bring forward diverse perspectives  leading to stronger decisions and deeper relationships.We anchor this belief in a simple phrase: Everyones welcome at the dog park. No matter your background, identity, or role, theres space for you here. Theres no one way to show up at the dog park just shared space, mutual respect, and the freedom to be yourself. Being included is just the beginning, its about contributing your voice, growing through challenges, and building trust through shared goals. This philosophy guides how we lead, how we hire, how we communicate, and how we grow.                    We continuously evaluate to ensure we are creating a consistent experience that cultivates belonging for all employees, from hiring and performance reviews to talent development. We also believe Belonging happens in everyday moments of connection; lunch with a new teammate, a shared laugh, or a quick story about your weekend. Our structure includes biannual employee surveys, manager training, TFD camps, and support from Humans to ensure were listening and learning from our Team.
Together, these efforts reflect what Belonging means at TFD: a culture where everyone can thrive.
A Few of Our Best Benefits

Dog-friendly office in Greenwich Village
Market-competitive compensation and equity packages
Comprehensive Healthcare, Dental, and Vision
Company supported mental health benefits
12 week paid parental leave
Competitive 401k plan with company match
Flexible PTO 
Discounted fresh food for your pup
Your pet interrupting video calls (and in-person meetings) is now a feature, not a bug

We commit to building a competitive compensation package and company environment for all individuals to thrive. We believe in competitive base compensation rooted in location specific market data and performance along with equity ownership in the company that allows every team member to build their personal wealth as the company grows, just as much as we believe in fostering a culture that supports our team members personally, professionally, and holistically. For this role the anticipated hiring base compensation range is $150,000 - $165,000 USD Annual and the compensation offered will include a robust market competitive package of base and equity. In addition to your base compensation offer you will also receive equity ownership in the company. More information about the value of this equity will be shared at the time of offer. This range is representative of NYC Market Data if you are applying to this role outside of the NYC area the range may change.
Equal Employment Opportunity Statement
The Farmer's Dog, Inc. is an equal employment opportunity employer and does not discriminate in hiring on the basis of sex, gender identity, sexual orientation, race, color, religion, creed, national origin, physical or mental disability, protected veteran status or any other legally protected characteristic or status. For more information, please visit Know Your Rights.
Reasonable Accommodations
TFD complies with applicable federal, state, and local disability laws and makes reasonable accommodations for applicants and employees with disabilities.  If a reasonable accommodation is needed to participate in the job application or interview process, to perform essential job functions, and/or to receive other benefits and privileges of employment, please contact humansops@thefarmersdog.com."
3428231,"Senior Growth Manager","https://job-boards.greenhouse.io/thefarmersdog/jobs/8118270002","FarmersDog","New York","No",5,"Full time","2025-09-23T20:25:20.055193Z","Who We Are
The Farmers Dog was born from a mission to change the landscape of pet health, providing dogs and their humans with honest, smart, and simple care. Were starting by radically improving the $90 billion pet food industry, replacing bags of highly-processed pellets with a personalized subscription service that sends complete and balanced, freshly-made dog food directly to customers doors. Our ultimate goal is to create innovative, delightful and personalized experiences across all aspects of pet care, and we believe our direct-to-consumer business model, holistic approach to growth, and dynamic culture uniquely position us to shepherd this backwards industry into the future.To date, The Farmers Dog has delivered over 1 billion meals nationwide and raised over $150M in funding to help us build a company as healthy as the dogs who are eating those meals. Join us as we continue to develop ways of bringing peace of mind to customers, health to their companions, and much-needed change to the way people feed and care for their pets.
#LongLiveDogs
What We Stand For and Where Youll Come In
The Farmers Dog is looking for a customer-obsessed Growth Manager to lead our Treats, Chews, &amp; Add-ons pawd, who can synthesize a wide variety of data (quant and qual) to build seamless experiences that drive awareness, conversion, and retention of treats, chews, and other additions for both new and existing customers. Youll distill these insights into an actionable product roadmap, then scope, build, and ship high-impact features that meaningfully improve the lives of our customers and their four-legged companions. You will be working alongside a small group of stellar engineers, designers and new ventures group to bring experiences to life in quick iteration. 
A day wont pass without you talking to your customers and partners, as thats the true test to ensure we are inventing on our customers behalf and delivering useful and joyful experiences. 
One Team: We dont think of ourselves as Acquisition Marketers, Engineers, Data Analysts, or Product Managers. Beyond denoting skill sets and areas of expertise, we dont think departments matter. Wed rather align ourselves to the goals were working to achieve and make sure we have necessary subject matter expertise to drive meaningful impact. We strive to orient ourselves around customer problems TOGETHER  getting the right people, with the right context, in the right rooms/Zooms to solve problems holistically.
We are skeptical about everything and precious about nothing:  Ideas can and should come from anywhere, and we arent tied to our own. We proactively source input. We talk to our customers and leads regularly and are quick to change course if we know theres a better or more impactful way to solve problems.
We consider the customer journey in all of our decisions:  We know that no interaction exists in a silo and therefore understand how important every single one is.  We ensure our strategy sets prospective and new customers up for success and drives long-term retention.  We answer questions and address problems early and proactively.  We understand the value of different channels, initiatives, and messages and know how to articulate impact and advocate for prioritization holistically.
We Execute For Impact: We dont subscribe to best practices or industry KPIs. Were uninterested in how we compare to benchmarks; instead we orient ourselves around being the best we can possibly be. Similarly, we dont subscribe to rigid or classical expectations of roles  i.e. acquisition is hyper-focused on improving customer retention and experience.
We Are Focused and Work Without Assumption: We are not beholden to ideas. We have goals and believe everything beyond that is a series of hypotheses to validate. To that end, we seek to work in sequence and not in parallel. We constantly ask ourselves, whats the most important hypothesis I should be working on right now? How do I confirm or reject that hypothesis as fast as possible?. We rarely have timelines/deadlines and are constantly taking in new information and adjusting our priorities accordingly. We dont expect to be perfect the first time.
About The Growth Team 
We have five principles that describe our approach:

Holistic thinking: We know that nothing exists in a silo.
Disciplined prioritization: We need to bring perspective, clarity and guidance to the team.
Data-driven decision-making: We use first principles and are skeptical. We establish context.
Proactive collaboration: We build vast common knowledge and encourage synchronous, streamlined work from our colleagues and diversity in problem-solving.
Execute for impact: We are responsible for the growth of the business and the perception of our brand. We are resilient, accountable and relentless.

How You'll Make An Impact

Develop and implement comprehensive growth strategies across owned channels (digital and physical) to drive adoption and retention of new products while maintaining the highest levels of trust in The Farmers Dog brand.
Launch new products, build new digital experiences, craft product positioning, develop business requirements, and define success metrics.
Own initiatives end-to-end across insight generation, strategy development, planning, execution, performance analysis, and reporting.
Deeply understand our products and customers in order to build frictionless and delightful customer journeys (e.g. discovery, onboarding, management) that maximize adoption and retention.
Continuously launch experiments and iterate in order to optimize performance, balancing incremental building and big bets.
Conduct in-depth analyses of quantitative data (e.g. cohort and experiment performance by customer segments) and qualitative data (e.g. customer interviews, CX feedback) to uncover actionable insights to continually improve the experience.
Develop and manage relationships across acquisition, brand, data science, engineering, finance, lifecycle marketing, research, and more.
Achieve cross-functional alignment by proactively sharing insights across the organization, generating buy-in, and setting shared priorities.

We're Excited About You Because

You have 5 years of experience in a mix of growth-focused, strategic, product, and/or analytical roles, making holistic, data-driven, and strategic decisions.
You have a proven track record of launching successful growth initiatives for a consumer business.
You bring knowledge of acquisition and retention strategies across physical and digital customer experiences.
You structure problem-solving with an emphasis on breaking down ambiguous problems into solvable components, leading with curiosity and creativity.
You are skeptical, peek around corners effectively and continuously, and you are right the first time most of the time.
You lead through others and have strong cross-functional collaboration and project management skills. You dont need to be the one to do all the things to have an outsized impact.
You are an excellent communicator, with sharp written and verbal communication skills. You over-communicate, but you are also very efficient and direct.
You thrive in high pressure, high stakes and environments and are comfortable navigating ambiguity and adapting to change.
You have a natural drive for action, take initiative, and work hard. You maintain early stage startup intensity at any scale.
You love dogs.

Office Guidelines
We are an in-office culture, made of in-office people who thrive on the collaboration and magnetism of working in a shared space. We are seeking individuals who excel in this type of environment, where being present fosters deeper connections and engagement.
Our Belonging Philosophy:
At TFD, we believe Belonging is a shared commitment to creating a workplace where every person feels respected, valued, and empowered to be themselves. When people feel a true sense of belonging, they do their best work, take smart risks, and bring forward diverse perspectives  leading to stronger decisions and deeper relationships.We anchor this belief in a simple phrase: Everyones welcome at the dog park. No matter your background, identity, or role, theres space for you here. Theres no one way to show up at the dog park just shared space, mutual respect, and the freedom to be yourself. Being included is just the beginning, its about contributing your voice, growing through challenges, and building trust through shared goals. This philosophy guides how we lead, how we hire, how we communicate, and how we grow.                    We continuously evaluate to ensure we are creating a consistent experience that cultivates belonging for all employees, from hiring and performance reviews to talent development. We also believe Belonging happens in everyday moments of connection; lunch with a new teammate, a shared laugh, or a quick story about your weekend. Our structure includes biannual employee surveys, manager training, TFD camps, and support from Humans to ensure were listening and learning from our Team.
Together, these efforts reflect what Belonging means at TFD: a culture where everyone can thrive.
A Few of Our Best Benefits

Dog-friendly office in Greenwich Village
Market-competitive compensation and equity packages
Comprehensive Healthcare, Dental, and Vision
Company supported mental health benefits
12 week paid parental leave
Competitive 401k plan with company match
Flexible PTO 
Discounted fresh food for your pup
Your pet interrupting video calls (and in-person meetings) is now a feature, not a bug

We commit to building a competitive compensation package and company environment for all individuals to thrive. We believe in competitive base compensation rooted in location specific market data and performance along with equity ownership in the company that allows every team member to build their personal wealth as the company grows, just as much as we believe in fostering a culture that supports our team members personally, professionally, and holistically. For this role the anticipated hiring base compensation range is $140,000 - $160,000 USD Annual and the compensation offered will include a robust market competitive package of base and equity. In addition to your base compensation offer you will also receive equity ownership in the company. More information about the value of this equity will be shared at the time of offer. This range is representative of NYC Market Data if you are applying to this role outside of the NYC area the range may change.
Equal Employment Opportunity Statement
The Farmer's Dog, Inc. is an equal employment opportunity employer and does not discriminate in hiring on the basis of sex, gender identity, sexual orientation, race, color, religion, creed, national origin, physical or mental disability, protected veteran status or any other legally protected characteristic or status. For more information, please visit Know Your Rights.
Reasonable Accommodations
TFD complies with applicable federal, state, and local disability laws and makes reasonable accommodations for applicants and employees with disabilities.  If a reasonable accommodation is needed to participate in the job application or interview process, to perform essential job functions, and/or to receive other benefits and privileges of employment, please contact humansops@thefarmersdog.com."
