"ID","Title","Link","Company","Location","Remote","Experience","EmploymentType","DatePosted","RoleDescription"
3630325,"Supervisor, Equipment Maintenance (Starship) - Nights","https://boards.greenhouse.io/spacex/jobs/8172674002?gh_jid=8172674002","SpaceX","Starbase, TX","No",5,"Full time","2025-09-23T20:25:17.680238Z","SpaceX was founded under the belief that a future where humanity is out exploring the stars is fundamentally more exciting than one where we are not. Today SpaceX is actively developing the technologies to make this possible, with the ultimate goal of enabling human life on Mars.EQUIPMENT MAINTENANCE SUPERVISOR (STARSHIP)
RESPONSIBILITIES

Work with maintenance manager to perform full spectrum analysis on asset reliability improvement opportunities, such as suggesting improved preventative maintenance actions, identification of design flaws, with a top down approach to maintenance demand driver reduction 
Leads a team of technicians through daily repairs, preventative maintenance actions, complex continuous improvement projects, to ensure maximum asset availability for Starbase manufacturing
Manages weekly workload distribution and technician task assignments
Triage of incoming maintenance requests from internal customers, and effectively resource manage priority workload with all available resources
Works with third-party vendors for parts acquisition, asset documentation standards, training, and on-site maintenance actions
Subject matter expert in equipment maintenance troubleshooting, mechatronics, project management, team key performance indicator analysis, manufacturing key performance indicator analysis, 5S and LEAN manufacturing strategies, and high-level people leadership in a fast-paced highly iterative environment.
Lead a diverse technician team to troubleshoot and repair control and electrical system failures involving  PLCs, HMIs, servomotors, servo amplifiers, input/output, field sensors
Lead a diverse technician team to troubleshoot and repair various machine hydraulic and pneumatic systems  actuators, valves, pumps, filters
Lead a diverse technician team to troubleshoot and repair automated tool mechanical systems  ballscrews, linear rails, guideways, gearboxes, 3 phase motors
Provide developmental leadership to a team of technicians, facilitating training and advancement of skills, to maintain cutting edge aerospace technologies
Perform other related duties, as assigned, for the purpose of ensuring an efficient and effective work environment

BASIC QUALIFICATIONS:

High school diploma or equivalency certificate
2+ years of experience leading a team, including leading projects and people
5+ years of technical experience with hydraulic, pneumatic, mechanical, and electrical repair

PREFERRED SKILLS AND EXPERIENCE:

Associate degree in a technical discipline 5+ years of experience as a maintenance technician or field service engineer
Experience installing, aligning and commissioning automated production cells in aerospace environment
Experience accessing and modifying Siemens control logic or similar PLC architectures
Experience in the application &amp; operation of precision machine tools in aerospace manufacturing environment
Experience with CAD and/or mechanical design
Experience in breakdown data analysis and six sigma (SQL experience is a distinct advantage)
Ability to read and interpret electrical, hydraulic and pneumatic schematics and drawings
Ability to write detailed repair reports (advanced MS Office skills)
Ability to use power tools hand tools and heavy ground support equipment
Ability to maintain a safe and clean working environment while adhering to company policies, quality policies, and industry standards
Detail oriented, organized, and able to demonstrate a high sense of urgency
Analytic thinker that gets to the root of problems and comes up with permanent solutions
Self-motivated, autonomous, and able to work well with others

ADDITIONAL REQUIREMENTS:

Must be available for all shifts, overtime, and weekends as needed
Capable of being forklift and boom lift certified
Capable of lifting 50 pounds unassisted and working at heights
Willing to travel up to 10%
ITAR REQUIREMENTS:

To conform to U.S. Government export regulations, applicant must be a (i) U.S. citizen or national, (ii) U.S. lawful, permanent resident (aka green card holder), (iii) Refugee under 8 U.S.C.  1157, or (iv) Asylee under 8 U.S.C.  1158, or be eligible to obtain the required authorizations from the U.S. Department of State. Learn more about the ITAR here.  

SpaceX is an Equal Opportunity Employer; employment with SpaceX is governed on the basis of merit, competence and qualifications and will not be influenced in any manner by race, color, religion, gender, national origin/ethnicity, veteran status, disability status, age, sexual orientation, gender identity, marital status, mental or physical disability or any other legally protected status.
Applicants wishing to view a copy of SpaceXs Affirmative Action Plan for veterans and individuals with disabilities, or applicants requiring reasonable accommodation to the application/interview process should reach out to EEOCompliance@spacex.com."
3630324,"Sr. Radiation Effects Engineer","https://boards.greenhouse.io/spacex/jobs/8175753002?gh_jid=8175753002","SpaceX","Redmond","No",5,"Full time","2025-09-23T20:25:17.680262Z","SpaceX was founded under the belief that a future where humanity is out exploring the stars is fundamentally more exciting than one where we are not. Today SpaceX is actively developing the technologies to make this possible, with the ultimate goal of enabling human life on Mars.
SR. RADIATION EFFECTS ENGINEER
As a member of our fast-paced Radiation Effects team, you will be responsible for ensuring avionics hardware performance across our fleet of vehicles (Dragon, Falcon, Starship, Lunar Human Landing System, etc.) through some of the harshest and varied radiation environments imaginable. In order to ensure maximum reliability in an ionizing radiation environment, the Radiation team at SpaceX performs exhaustive analysis, design, and test at the component, board, unit, and subsystem levels with extensive opportunity to interact with a vast array of rocket and spacecraft hardware and electronics. As one of the few teams required to interface with the design, manufacturing, integration, and mission operations teams, we play a critical role in the development of our systems as we advance our efforts towards broadband satellite internet and safe, reliable, inexpensive, and innovative access to space. This work all supports our fundamental goal of expanding human space exploration capabilities and establishing a permanent human presence on the moon and Mars.
RESPONSIBILITIES:

Support a cross-discipline team of design and system engineers in providing radiation test and analysis results, advice on requirements flow down, modeling and analysis reports, and recommendations for mitigating radiation effects
Develop component databases and applications for interfacing with radiation test data used across programs
Work with supply chain, component reliability and radiation engineering to ensure test data collected during radiation test campaigns is available and accessible to design engineers
Review PCN changes to ensure maintenance of radiation qualification status
Develop testing and reporting standards for component and flight PCBA radiation tests
Work with supply chain and component reliability teams to refine preferred components across programs
Work with circuit design, electronics manufacturing, and software implementation to analyze and improve test coverage
Make recommendations for design, process improvements, and data collection
Establish requirements for component procurement specifications
Comply with all radiation regulatory requirements for radiation safety

BASIC QUALIFICATIONS:

Bachelor's degree in an engineering discipline
5+ years of professional experience in the radiation effects field

PREFERRED SKILLS AND EXPERIENCE:

Experience with full stack web development including python, SQL, JavaScript, html
Experience with single event effects risk calculations
Previous work experience in radiation effects including modeling, testing, and/or analysis
Experience in writing scripts to control test hardware
Proficiency with hardware blueprints/schematics and circuit functions based on designs
Previous component engineering experience and/or component reliability experience
Strong mathematics and statistics knowledge base
Excellent written and verbal communication skills
Proficiency with avionics hardware spanning integrated circuits, PCBA boards, sensors/transducers, functional troubleshooting, and defect detection
Radiation dose safety training  

ADDITIONAL REQUIREMENTS:

Extended hours and weekend work may be required to support critical project and mission milestones

COMPENSATION AND BENEFITS
Pay range:     
Sr. Radiation Effects Engineer: $130,000.00 - $180,000.00/per year      
Your actual level and base salary will be determined on a case-by-case basis and may vary based on the following considerations: job-related knowledge and skills, education, and experience.
Base salary is just one part of your total rewards package at SpaceX. You may also be eligible for long-term incentives, in the form of company stock, stock options, or long-term cash awards, as well as potential discretionary bonuses and the ability to purchase additional stock at a discount through an Employee Stock Purchase Plan. You will also receive access to comprehensive medical, vision, and dental coverage, access to a 401(k) retirement plan, short and long-term disability insurance, life insurance, paid parental leave, and various other discounts and perks. You may also accrue 3 weeks of paid vacation and will be eligible for 10 or more paid holidays per year. Employees in Washington State accrue paid sick time in compliance with state and federal law. Company shuttles are offered to employees for roundtrip travel from select Seattle locations to the SpaceX Redmond office Monday to Friday.
ITAR REQUIREMENTS:

To conform to U.S. Government export regulations, applicant must be a (i) U.S. citizen or national, (ii) U.S. lawful, permanent resident (aka green card holder), (iii) Refugee under 8 U.S.C.  1157, or (iv) Asylee under 8 U.S.C.  1158, or be eligible to obtain the required authorizations from the U.S. Department of State. Learn more about the ITAR here.  

SpaceX is an Equal Opportunity Employer; employment with SpaceX is governed on the basis of merit, competence and qualifications and will not be influenced in any manner by race, color, religion, gender, national origin/ethnicity, veteran status, disability status, age, sexual orientation, gender identity, marital status, mental or physical disability or any other legally protected status.
Applicants wishing to view a copy of SpaceXs Affirmative Action Plan for veterans and individuals with disabilities, or applicants requiring reasonable accommodation to the application/interview process should reach out to EEOCompliance@spacex.com."
3630323,"Integration & Test Engineer (F9 Subassemblies)","https://boards.greenhouse.io/spacex/jobs/8173372002?gh_jid=8173372002","SpaceX","Hawthorne","No",1,"Full time","2025-09-23T20:25:17.680289Z","SpaceX was founded under the belief that a future where humanity is out exploring the stars is fundamentally more exciting than one where we are not. Today SpaceX is actively developing the technologies to make this possible, with the ultimate goal of enabling human life on Mars.INTEGRATION &amp; TEST ENGINEER (F9 SUBASSEMBLIES)
RESPONSIBILITIES: 

Oversee the assembly and testing processes for Falcon and Falcon Heavy launch vehicle assemblies
Assist design engineers in guiding new designs from concepts to qualified, production-capable spaceflight mechanisms
Work with design engineers to evaluate designs for manufacturability and test requirements, then implement in a rapidly evolving production environment
Develop, qualify, and refine manufacturing &amp; test processes to bring products from prototype to high-volume production
Define and create first-of-their-kind standards and practices within the industry, driving SpaceX to the forefront of aerospace hardware manufacturability
Interface with other engineers, subject matter experts, and technicians to solve large-scale production challenges
Ideate and implement tooling and test solutions, enabling high-quality build of SpaceX hardware
Quickly resolve non-conformances and work with the Quality team to implement root cause corrective actions
Identify, plan, and execute capital equipment, machine, and layout upgrades to meet volume production demand
Mentor other team members on high-level engineering tasks, promoting the team culture and technical excellence across resources

BASIC QUALIFICATIONS:

Bachelor's degree in an engineering discipline or physics
1+ years of engineering experience in manufacturing, design, test, or development (internship and project team experience is applicable)

PREFERRED SKILLS AND EXPERIENCE:

Experience with the building and testing of fluid and/or electrical systems
Experience with the build and test of pneumatic, hydraulic, and structural assemblies
Experience with test equipment (pumps, valves, heaters, instrumentation, data acquisition, and automation)
Experience with scientific computer science languages (Python, MATLAB, or similar)
Experience with fluid and electrical system simulation and automation testing
Experience data reduction and post-processing tools
Mechanical component and/or tooling design and analysis (3D computer-aided design)
Knowledge of metallic manufacturing techniques, processes, and equipment related to machining, welding, drilling, and automation
Experience working with GD&amp;T (Geometric Dimensioning &amp; Tolerancing) and familiarity with complex tolerance stack-ups
Experience with process development from R&amp;D to high-volume manufacturing
Experience writing work instructions and procedures for critical aerospace parts
Experience in a production environment within the aerospace industry

ADDITIONAL REQUIREMENTS:

Willing to work extended hours and/or weekends as needed
Will sometimes be working directly with the hardware on the floor and will have to be comfortable stooping, bending, and standing
This position is based in Hawthorne, CA and requires being onsite - remote work not considered

COMPENSATION AND BENEFITS:        
Pay range:Integration &amp; Test Engineer/Level I: $95,000.00 - $115,000.00/per yearIntegration &amp; Test Engineer/Level II: $110,000.00 - $130,000.00/per yearYour actual level and base salary will be determined on a case-by-case basis and may vary based on the following considerations: job-related knowledge and skills, education, and experience. Base salary is just one part of your total rewards package at SpaceX. You may also be eligible for long-term incentives, in the form of company stock, stock options, or long-term cash awards, as well as potential discretionary bonuses and the ability to purchase additional stock at a discount through an Employee Stock Purchase Plan. You will also receive access to comprehensive medical, vision, and dental coverage, access to a 401(k) retirement plan, short and long-term disability insurance, life insurance, paid parental leave, and various other discounts and perks. You may also accrue 3 weeks of paid vacation and will be eligible for 10 or more paid holidays per year. Employees accrue paid sick leave pursuant to Company policy which satisfies or exceeds the accrual, carryover, and use requirements of the law.ITAR REQUIREMENTS:

To conform to U.S. Government export regulations, applicant must be a (i) U.S. citizen or national, (ii) U.S. lawful, permanent resident (aka green card holder), (iii) Refugee under 8 U.S.C.  1157, or (iv) Asylee under 8 U.S.C.  1158, or be eligible to obtain the required authorizations from the U.S. Department of State. Learn more about the ITAR here.  

SpaceX is an Equal Opportunity Employer; employment with SpaceX is governed on the basis of merit, competence and qualifications and will not be influenced in any manner by race, color, religion, gender, national origin/ethnicity, veteran status, disability status, age, sexual orientation, gender identity, marital status, mental or physical disability or any other legally protected status.
Applicants wishing to view a copy of SpaceXs Affirmative Action Plan for veterans and individuals with disabilities, or applicants requiring reasonable accommodation to the application/interview process should reach out to EEOCompliance@spacex.com."
3630321,"Electromechanical Assembler (Starlink Aviation)","https://boards.greenhouse.io/spacex/jobs/8176368002?gh_jid=8176368002","SpaceX","Woodinville, WA","No",1,"Full time","2025-09-23T20:25:17.680317Z","SpaceX was founded under the belief that a future where humanity is out exploring the stars is fundamentally more exciting than one where we are not. Today SpaceX is actively developing the technologies to make this possible, with the ultimate goal of enabling human life on Mars.ELECTROMECHANICAL ASSEMBLER (STARLINK AVIATION)
As an electromechanical assembler for Starlink Aviation, you will be responsible for performing a wide range of tasks, including hardware assembly, testing, integration, and repair of Starlink Enterprise/Aviation products. This team will focus on mobility, ground systems, commercial products, and test equipment. SpaceX aims to connect a diverse array of customers worldwide, including those in the aviation, marine, and mobile sectors. In this role, you will be actively involved and hands-on in achieving this mission.
RESPONSIBILITIES:

Assemble, activate, and integrate mechanical and electrical systems for Starlink aviation platforms.
Install and repair Starlink products for enterprise aviation systems, adhering to strict FAA, Warp, and other regulatory guidelines.
Troubleshoot hardware issues in real-time and provide feedback to prevent recurring problems.
Conduct, collect, and report data from various tests, including vibration, shock, thermal, RF, load, and other evaluations required for FAA certification.
Maintain product quality and ensure compliance with specifications.
Collaborate with development and design engineers, machine shops, and external partners on diverse assignments.

BASIC QUALIFICATIONS:

High school diploma or equivalency certificate.
1+ year of experience in a hands-on environment using hand tools (e.g., Screwdriver, Ratchet, Allen Keys, Torque Wrench, Pliers, Multimeters etc.).
1+ year of experience performing electrical or mechanical installations or assembly.

PREFERRED SKILLS AND EXPERIENCE:

1+ year of experience fixing, installing, or building aircraft/aerospace hardware.
Proven ability to read and interpret technical documentation, including cable harnesses, wiring diagrams, layout and mechanical drawings, GD&amp;T, assembly procedures/work instructions, schematics, engineering drawings, and parts lists.
Hands-on experience fabricating harnesses, electro-mechanical assemblies, printed circuit board assemblies, and test stations.
Experience with electrical debug tools, including multimeter, oscilloscope, spectrum analyzer, network analyzer.
Excellent attention to detail and an insistence on permanently correcting errors.
A&amp;P schooling.
Associates degree.

ADDITIONAL REQUIREMENTS:

Willing to work overtime and weekends as needed. Estimated shift time: 1st shift: 5:30 AM - 4:00 PM.
Standing or sitting for long periods, climbing up and down ladders, bending, grasping, sitting, pulling, pushing, stooping, and stretching may be required to perform the functions of this position.
Must be able to lift up to 25lbs. unassisted.

COMPENSATION AND BENEFITS: 
Pay range:    Starlink Enterprise Integration Technician/Level 1: $23.00 - $29.00/hour Starlink Enterprise Integration Technician/Level 2: $28.00 - $34.50/hour Starlink Enterprise Integration Technician/Level 3: $33.00 - $40.00/hour 
Your actual level and base salary will be determined on a case-by-case basis and may vary based on the following considerations: job-related knowledge and skills, education, and experience.
Base salary is just one part of your total rewards package at SpaceX. You may also be eligible for long-term incentives, in the form of company stock, stock options, or long-term cash awards, as well as potential discretionary bonuses and the ability to purchase additional stock at a discount through an Employee Stock Purchase Plan. You will also receive access to comprehensive medical, vision, and dental coverage, access to a 401(k) retirement plan, short and long-term disability insurance, life insurance, paid parental leave, and various other discounts and perks. You may also accrue 3 weeks of paid vacation and will be eligible for 10 or more paid holidays per year. Non-exempt Washington employees are eligible for sick leave in accordance with Washington's Sick Leave policies.ITAR REQUIREMENTS:

To conform to U.S. Government export regulations, applicant must be a (i) U.S. citizen or national, (ii) U.S. lawful, permanent resident (aka green card holder), (iii) Refugee under 8 U.S.C.  1157, or (iv) Asylee under 8 U.S.C.  1158, or be eligible to obtain the required authorizations from the U.S. Department of State. Learn more about the ITAR here.  

SpaceX is an Equal Opportunity Employer; employment with SpaceX is governed on the basis of merit, competence and qualifications and will not be influenced in any manner by race, color, religion, gender, national origin/ethnicity, veteran status, disability status, age, sexual orientation, gender identity, marital status, mental or physical disability or any other legally protected status.
Applicants wishing to view a copy of SpaceXs Affirmative Action Plan for veterans and individuals with disabilities, or applicants requiring reasonable accommodation to the application/interview process should reach out to EEOCompliance@spacex.com."
