"ID","Title","Link","Company","Location","Remote","Experience","EmploymentType","DatePosted","RoleDescription"
3630315,"Design Verification Engineer (Silicon Engineering)","https://boards.greenhouse.io/spacex/jobs/8170455002?gh_jid=8170455002","SpaceX","Irvine","No",2,"Full time","2025-09-23T20:25:17.680426Z","SpaceX was founded under the belief that a future where humanity is out exploring the stars is fundamentally more exciting than one where we are not. Today SpaceX is actively developing the technologies to make this possible, with the ultimate goal of enabling human life on Mars.
DESIGN VERIFICATION ENGINEER (SILICON ENGINEERING) 


At SpaceX were leveraging our experience in building rockets and spacecraft to deploy Starlink, the worlds most advanced broadband internet system. Starlink is the worlds largest satellite constellation and is providing fast, reliable internet to millions of users worldwide. We design, build, test, and operate all parts of the system  thousands of satellites, consumer receivers that allow users to connect within minutes of unboxing, and the software that brings it all together. Weve only begun to scratch the surface of Starlinks potential global impact and are looking for best-in-class engineers to help maximize Starlinks utility for communities and businesses around the globe. 


We are seeking a motivated, proactive, and intellectually curious engineer who will work alongside world-class cross-disciplinary teams (systems, firmware, architecture, design, validation, product engineering, ASIC implementation). In this role, you will be developing cutting-edge next-generation ASICs for deployment in space and ground infrastructures around the globe. These chips are enabling connectivity in places it has previously not been available, affordable or reliable. Your efforts will help deliver cutting-edge solutions that will expand the performance and capabilities of the Starlink network.   

RESPONSIBILITIES:  

Responsible for digital ASIC verification at block and system level
Write and review test plans, develop test harnesses and test sequences
Develop SystemVerilog testbench infrastructure (both UVM and non-UVM) for testing designs, including DSP blocks 
Responsible for test plan execution, running regressions, code and functional coverage closure
Automate test case generation by using Python and MATLAB programs 
Contribute towards pre-silicon verification, chip bring-up and post-silicon validation
Be a hands-on self-starter who can execute the steps required to fully verify a complex digital designs

BASIC QUALIFICATIONS:

Bachelors degree in electrical engineering, computer science or computer engineering
2+ years of experience with design verification and test bench development

PREFERRED SKILLS AND EXPERIENCE:

Advanced degree in electrical engineering or computer engineering
Experience with verification methodologies such as UVM
Strong object-oriented programming knowledge
Strong problem-solving and coding skills
Experience in constrained random verification
Expertise in developing test plans, implementing coverage models, and analyzing results
Experience with scripting languages, e.g. Python for automation
RTL design, chip bring-up, and post-silicon validation experience
Ability to work in a dynamic environment with changing needs and requirements

ADDITIONAL REQUIREMENTS:

Must be willing to work extended hours and weekends as needed

COMPENSATION AND BENEFITS:        Pay range:    Design Verification Engineer/Level I: $120,000.00 - $145,000.00/per year    Design Verification Engineer/Level II: $140,000.00 - $170,000.00/per year    
Your actual level and base salary will be determined on a case-by-case basis and may vary based on the following considerations: job-related knowledge and skills, education, and experience.
Base salary is just one part of your total rewards package at SpaceX. You may also be eligible for long-term incentives, in the form of company stock, stock options, or long-term cash awards, as well as potential discretionary bonuses and the ability to purchase additional stock at a discount through an Employee Stock Purchase Plan. You will also receive access to comprehensive medical, vision, and dental coverage, access to a 401(k) retirement plan, short &amp; long-term disability insurance, life insurance, paid parental leave, and various other discounts and perks. You may also accrue 3 weeks of paid vacation &amp; will be eligible for 10 or more paid holidays per year. Exempt employees are eligible for 5 days of sick leave per year.ITAR REQUIREMENTS:

To conform to U.S. Government export regulations, applicant must be a (i) U.S. citizen or national, (ii) U.S. lawful, permanent resident (aka green card holder), (iii) Refugee under 8 U.S.C.  1157, or (iv) Asylee under 8 U.S.C.  1158, or be eligible to obtain the required authorizations from the U.S. Department of State. Learn more about the ITAR here.  

SpaceX is an Equal Opportunity Employer; employment with SpaceX is governed on the basis of merit, competence and qualifications and will not be influenced in any manner by race, color, religion, gender, national origin/ethnicity, veteran status, disability status, age, sexual orientation, gender identity, marital status, mental or physical disability or any other legally protected status.
Applicants wishing to view a copy of SpaceXs Affirmative Action Plan for veterans and individuals with disabilities, or applicants requiring reasonable accommodation to the application/interview process should reach out to EEOCompliance@spacex.com."
3630313,"Delivery Systems Specialist - Driver","https://boards.greenhouse.io/spacex/jobs/8170429002?gh_jid=8170429002","SpaceX","Woodinville, WA","No",3,"Full time","2025-09-23T20:25:17.680441Z","SpaceX was founded under the belief that a future where humanity is out exploring the stars is fundamentally more exciting than one where we are not. Today SpaceX is actively developing the technologies to make this possible, with the ultimate goal of enabling human life on Mars.DELIVERY SYSTEMS SPECIALIST - DRIVER
At SpaceX, were leveraging our experience in building rockets and spacecraft to deploy Starlink, the worlds most advanced broadband internet system. Starlink is the worlds largest satellite constellation and is providing fast, reliable internet to 7M+ users worldwide. We design, build, test, and operate all parts of the system  thousands of satellites, consumer antennae that allow users to connect within minutes of unboxing, and the software that brings it all together. Weve only begun to scratch the surface of Starlinks potential global impact, and that work starts here with the Materials Management team in Woodinville.
The Delivery Systems Specialist position directly supports our Starlink production factory. As Starlink grows, we are expanding our local delivery and logistics operations for satellites and ground station antennae. This role is responsible for completing bulk pick-ups, loading, and delivery duties between our Kent and Redmond facilities, as well as a variety of Vendors and Suppliers along the way. This is a critical position to the mission of global connectivity, ensuring that building materials and components are delivered to production consistently, safely, and reliably. 
RESPONSIBILITIES:

Load, drive, and unload manufacturing, test, and support items within a 200-mile radius of the SpaceX campus
Operate LTL equipment (under 26k GVW) including vans and flat-beds meeting all federal, state, and local transportation requirements and regulations
Safely load trucks at pickup points and transport truckload to destination following the rules of the road at all times
Safely load and unload trucks at designated drop-off points
Forklift use will be the primary method of loading and unloading trucks
Ensure truckload contents are secure for safe and undamaged delivery to the destination
Scan barcodes meeting business WMS requirements
Contribute to Receiving, Material Handling, and Inventory operations within the Distribution Center and across SpaceX as needed
Take driving route origin-destination direction from the internal fleet supervisor and communicate any issues with the immediate supervisor and/or affected parties as needed
Maintain and review all applicable documents (paperwork) related to items being delivered to ensure they are not damaged during delivery
Monitor service records of the vehicle when driving and report all problems to the manager immediately
Maintain cleanliness of vehicle and refueling when low
Maintain a safe driving record

BASIC QUALIFICATIONS:

High school diploma or equivalency certificate
Class A Commercial Driver's License (CDL)
2+ years of experience in expediting or material handling 
3+ years of experience in commercial or professional driving 
1+ year of experience operating a forklift and/or material-handling motorized vehicles and equipment

PREFERRED SKILLS AND EXPERIENCE:

Experience with barcode scanning to document material movement
Hazardous Material Endorsement (HME) for Class A CDL license holders
Experience working with aircraft or automotive parts and assemblies
ERP system experience (SAP, Oracle, etc.)
Material handling and stake bed driving experience (under 26k GVW)
Trucking experience, preferably with customer-service-oriented delivery background
Experience driving for a high-volume manufacturing environment
Excellent organizational and time management skills
Counter-balance sit-down forklift experience

ADDITIONAL REQUIREMENTS:

Must be available for at least one of the following shifts:

Woodinville

1st shift B: 8:00 am - 6:30 pm




Must be able to work overtime and/or weekends when needed to meet critical deadlines
Ability to lift up to 40 lbs. unassisted
Ability to obtain a Hazardous Material Endorsement (HME) for Class A CDL license holders
Lifting, standing, climbing, bending, grasping, sitting, pulling, pushing, stooping, stretching, and carrying are generally required to perform the functions of this position
Must be willing to work in an open-aired environment, lacking temperature controls
Valid Class C license

COMPENSATION AND BENEFITS:
Level 4: $28.00 - $33.00/hourLevel 5: $31.00 - $37.00/hour
Your actual level and base salary will be determined on a case-by-case basis and may vary based on the following considerations: job-related knowledge and skills, education, and experience.
Base salary is just one part of your total rewards package at SpaceX. You may also be eligible for long-term incentives, in the form of company stock, stock options, or long-term cash awards, as well as potential discretionary bonuses and the ability to purchase additional stock at a discount through an Employee Stock Purchase Plan. You will also receive access to comprehensive medical, vision, and dental coverage, access to a 401(k) retirement plan, short &amp; long-term disability insurance, life insurance, paid parental leave, and various other discounts and perks. You may also accrue 3 weeks of paid vacation &amp; will be eligible for 10 or more paid holidays per year. Non-exempt Washington employees are eligible for sick leave in accordance with Washington's Sick Leave policies.ITAR REQUIREMENTS:

To conform to U.S. Government export regulations, applicant must be a (i) U.S. citizen or national, (ii) U.S. lawful, permanent resident (aka green card holder), (iii) Refugee under 8 U.S.C.  1157, or (iv) Asylee under 8 U.S.C.  1158, or be eligible to obtain the required authorizations from the U.S. Department of State. Learn more about the ITAR here.  

SpaceX is an Equal Opportunity Employer; employment with SpaceX is governed on the basis of merit, competence and qualifications and will not be influenced in any manner by race, color, religion, gender, national origin/ethnicity, veteran status, disability status, age, sexual orientation, gender identity, marital status, mental or physical disability or any other legally protected status.
Applicants wishing to view a copy of SpaceXs Affirmative Action Plan for veterans and individuals with disabilities, or applicants requiring reasonable accommodation to the application/interview process should reach out to EEOCompliance@spacex.com."
3630311,"ASIC/SOC DV Engineer (Silicon Engineering)","https://boards.greenhouse.io/spacex/jobs/8170460002?gh_jid=8170460002","SpaceX","Sunnyvale","No",2,"Full time","2025-09-23T20:25:17.680458Z","SpaceX was founded under the belief that a future where humanity is out exploring the stars is fundamentally more exciting than one where we are not. Today SpaceX is actively developing the technologies to make this possible, with the ultimate goal of enabling human life on Mars.
ASIC/SOC DV ENGINEER (SILICON ENGINEERING) 


At SpaceX were leveraging our experience in building rockets and spacecraft to deploy Starlink, the worlds most advanced broadband internet system. Starlink is the worlds largest satellite constellation and is providing fast, reliable internet to millions of users worldwide. We design, build, test, and operate all parts of the system  thousands of satellites, consumer receivers that allow users to connect within minutes of unboxing, and the software that brings it all together. Weve only begun to scratch the surface of Starlinks potential global impact and are looking for best-in-class engineers to help maximize Starlinks utility for communities and businesses around the globe. 


We are seeking a motivated, proactive, and intellectually curious engineer who will work alongside world-class cross-disciplinary teams (systems, firmware, architecture, design, validation, product engineering, ASIC implementation). In this role, you will be developing cutting-edge next-generation ASICs for deployment in space and ground infrastructures around the globe. These chips are enabling connectivity in places it has previously not been available, affordable or reliable. Your efforts will help deliver cutting-edge solutions that will expand the performance and capabilities of the Starlink network.   

RESPONSIBILITIES:  

Responsible for digital ASIC verification at block and system level
Write and review test plans, develop test harnesses and test sequences
Develop SystemVerilog testbench infrastructure (both UVM and non-UVM) for testing designs 
Responsible for test plan execution, running regressions, code and functional coverage closure
Automate test case generation by using Python and MATLAB programs 
Contribute towards pre-silicon verification, chip bring-up and post-silicon validation
Be a hands-on self-starter who can execute the steps required to fully verify a complex digital designs

BASIC QUALIFICATIONS:

Bachelors degree in electrical engineering, computer science or computer engineering
2+ years of experience with design verification and test bench development

PREFERRED SKILLS AND EXPERIENCE:

Advanced degree in electrical engineering or computer engineering
Experience with verification methodologies such as UVM
Strong object-oriented programming knowledge
Strong problem-solving and coding skills
Experience in constrained random verification
Expertise in developing test plans, implementing coverage models, and analyzing results
Experience with scripting languages, e.g. Python for automation
RTL design, chip bring-up, and post-silicon validation experience
Ability to work in a dynamic environment with changing needs and requirements

ADDITIONAL REQUIREMENTS:

Must be willing to work extended hours and weekends as needed

COMPENSATION AND BENEFITS:        Pay range:    Design Verification Engineer/Level I: $130,000.00 - $155,000.00/per year    Design Verification Engineer/Level II: $150,000.00 - $180,000.00/per year    
Your actual level and base salary will be determined on a case-by-case basis and may vary based on the following considerations: job-related knowledge and skills, education, and experience.
Base salary is just one part of your total rewards package at SpaceX. You may also be eligible for long-term incentives, in the form of company stock, stock options, or long-term cash awards, as well as potential discretionary bonuses and the ability to purchase additional stock at a discount through an Employee Stock Purchase Plan. You will also receive access to comprehensive medical, vision, and dental coverage, access to a 401(k) retirement plan, short &amp; long-term disability insurance, life insurance, paid parental leave, and various other discounts and perks. You may also accrue 3 weeks of paid vacation &amp; will be eligible for 10 or more paid holidays per year. Exempt employees are eligible for 5 days of sick leave per year.ITAR REQUIREMENTS:

To conform to U.S. Government export regulations, applicant must be a (i) U.S. citizen or national, (ii) U.S. lawful, permanent resident (aka green card holder), (iii) Refugee under 8 U.S.C.  1157, or (iv) Asylee under 8 U.S.C.  1158, or be eligible to obtain the required authorizations from the U.S. Department of State. Learn more about the ITAR here.  

SpaceX is an Equal Opportunity Employer; employment with SpaceX is governed on the basis of merit, competence and qualifications and will not be influenced in any manner by race, color, religion, gender, national origin/ethnicity, veteran status, disability status, age, sexual orientation, gender identity, marital status, mental or physical disability or any other legally protected status.
Applicants wishing to view a copy of SpaceXs Affirmative Action Plan for veterans and individuals with disabilities, or applicants requiring reasonable accommodation to the application/interview process should reach out to EEOCompliance@spacex.com."
3091565,"Radiation Effects Test Engineer","https://boards.greenhouse.io/spacex/jobs/8032327002?gh_jid=8032327002","SpaceX","Hawthorne","No",2,"Full time","2025-09-23T20:25:17.680473Z","SpaceX was founded under the belief that a future where humanity is out exploring the stars is fundamentally more exciting than one where we are not. Today SpaceX is actively developing the technologies to make this possible, with the ultimate goal of enabling human life on Mars. 
RADIATION EFFECTS TEST ENGINEER 
As a member of our fast-paced Radiation Effects team, you will be responsible for ensuring avionics hardware performance across our fleet of vehicles (Dragon, Falcon, Starship, Lunar Human Landing System, etc.) through some of the harshest and varied radiation environments imaginable. To ensure maximum reliability in an ionizing radiation environment, the Radiation team at SpaceX performs exhaustive analysis, design, and test at the component, board, unit and subsystem levels with extensive opportunity to interact with a vast array of rocket and spacecraft hardware and electronics.
As one of the few teams required to interface with the design, manufacturing, integration, and mission operations teams, we play a critical role in the development of our systems. We will advance our efforts towards broadband satellite internet and safe, reliable, inexpensive, and innovative access to space with the fundamental goal of expanding human space exploration capabilities and establishing a permanent human presence on the Moon and Mars.
RESPONSIBILITIES:

Support a cross-discipline team of design and system engineers, while providing radiation test, automation, and reporting
Develop, implement, and troubleshoot complex test systems
Prepare and fully execute test plans and analysis for single event effect, total ionizing dose, and displacement damage dose
Perform testing to characterize parts and assemblies for their total ionizing dose and single event effect (protons and heavier ions) sensitivities
Perform root-cause analysis of test failures, and communicate recommended actions
Implement process controls through the form of procedural documentation and test system automation.

BASIC QUALIFICATIONS:

Bachelors degree in electrical engineering or physics
2+ years of experience in the radiation effects field
Experience programming in Python

PREFERRED SKILLS AND EXPERIENCE:

Previous work experience in radiation effects including modeling, testing, and/or analysis
Strong programming skill (Python, C++, or SQL)
Excellent written and verbal communication skills
Experience in design and/or analysis of digital and analog circuits
Ability to identify failures in radiation testing and knowledge on how to mitigate common failure mechanisms induced by ionizing radiation
Experience with systems requiring resistance to ionizing dose including total ionizing dose testing, analysis to predict dose on orbit and familiarity with common problems and vulnerabilities to total ionizing dose
Experience developing tests for microprocessors, ASICs, or FPGAs
Experience with testing RF or optical interface devices
Familiarity and comfort with avionics hardware spanning integrated circuits, PCBA boards, sensors/transducers, functional troubleshooting and defect detection
Familiarity and comfort with hardware blueprints/schematics and circuit functions based on designs
Superior organizational and analytical skills with keen attention to detail and quality

ADDITIONAL REQUIREMENTS:

Must be able to lift up to 25 lbs. unassisted
Extended hours and weekend work may be required to support critical project and mission milestones

 
COMPENSATION AND BENEFITS
Pay range:      
Radiation Effects Test Engineer/Level I: $100,000.00 - $120,000.00/per year       Radiation Effects Test Engineer/Level II: $115,000.00 - $135,000.00/per year      
Your actual level and base salary will be determined on a case-by-case basis and may vary based on the following considerations: job-related knowledge and skills, education, and experience.
Base salary is just one part of your total rewards package at SpaceX. You may also be eligible for long-term incentives, in the form of company stock, stock options, or long-term cash awards, as well as potential discretionary bonuses and the ability to purchase additional stock at a discount through an Employee Stock Purchase Plan. You will also receive access to comprehensive medical, vision, and dental coverage, access to a 401(k) retirement plan, short and long-term disability insurance, life insurance, paid parental leave, and various other discounts and perks. You may also accrue 3 weeks of paid vacation and will be eligible for 10 or more paid holidays per year. Employees accrue paid sick leave pursuant to Company policy which satisfies or exceeds the accrual, carryover, and use requirements of the law.   
 ITAR REQUIREMENTS:

To conform to U.S. Government export regulations, applicant must be a (i) U.S. citizen or national, (ii) U.S. lawful, permanent resident (aka green card holder), (iii) Refugee under 8 U.S.C.  1157, or (iv) Asylee under 8 U.S.C.  1158, or be eligible to obtain the required authorizations from the U.S. Department of State. Learn more about the ITAR here.  

SpaceX is an Equal Opportunity Employer; employment with SpaceX is governed on the basis of merit, competence and qualifications and will not be influenced in any manner by race, color, religion, gender, national origin/ethnicity, veteran status, disability status, age, sexual orientation, gender identity, marital status, mental or physical disability or any other legally protected status.
Applicants wishing to view a copy of SpaceXs Affirmative Action Plan for veterans and individuals with disabilities, or applicants requiring reasonable accommodation to the application/interview process should reach out to EEOCompliance@spacex.com."
