"ID","Title","Link","Company","Location","Remote","Experience","EmploymentType","DatePosted","RoleDescription"
3637470,"Starlink Warehouse Associate","https://boards.greenhouse.io/spacex/jobs/8178503002?gh_jid=8178503002","SpaceX","Hawthorne","No",5,"Full time","2025-09-23T20:25:17.679910Z","SpaceX was founded under the belief that a future where humanity is out exploring the stars is fundamentally more exciting than one where we are not. Today SpaceX is actively developing the technologies to make this possible, with the ultimate goal of enabling human life on Mars.STARLINK WAREHOUSE ASSOCIATE
This Warehouse Associate position supports the Starlink product factory. As Starlink continues to grow, we are expanding our inventory operation specifically for Starlink products. An inventory specialist is responsible for completing putaways for inbound material, picking products for production, filling the lineside build locations with material, putting finished goods into inventory, picking finished goods for customer orders, and ensuring inventory accuracy.
RESPONSIBILITIES:

Receive, store and issue raw materials, parts, details, and hardware to support shop operations
Store parts and materials in bins, drawers, and racks, identifying parts and stored location
Perform picking function to make up necessary kits of parts, material, and hardware as required, ascertaining that all parts are available and accounted for in kit
Maintain strict material handling practices in accordance with procedures
Monitor shelf-life storage and maintain proper rotation of stock
Verify all material received for conformity with accompanying paperwork, checking for damage, correct part numbers, quantity and, revisions
Issue material against approved paperwork such as affixing verification and traceability on required serialized parts before issuing
Fulfill orders for both domestic and international consumers and enterprises
Validate lot trace
Perform cycle counts
Perform good housekeeping chores in area
Support the organization's metric goals and objectives
Abide by all procedures, desk instructions, and standard operating documents

BASIC QUALIFICATIONS:

High school diploma or equivalency certificate
1+ years of inventory control experience

PREFERRED SKILLS AND EXPERIENCE:

Bachelors degree
5+ years of inventory control experience in a warehouse
ERP system experience (SAP, Oracle, etc.)
Excellent computer skills including Microsoft Office (Word, Excel, Outlook)
Experience and understanding of inventory and kitting processes
Experience operating a forklift and other related inventory equipment
Experience within the aerospace, automotive, semiconductor, or electronic fields

ADDITIONAL REQUIREMENTS:

Must be available for at least one of the following shifts:

Weekday (Monday - Friday): 1st shift 5 AM - 3:30 PM
Weekday (Monday - Friday): 2nd shift 3 PM - 1:30 AM


Must be able to lift up to 25lbs
Lifting, standing, climbing, bending, grasping, sitting, pulling, pushing, stooping, stretching, and carrying are generally required to perform the functions of this position
Must be willing to work in an open-aired environment, lacking temperature controls
Must be able to work overtime and/or weekends when needed to meet critical deadlines

COMPENSATION AND BENEFITS:    
Pay Range:    
Starlink Warehouse Associate/Level 1: $22.00/hourStarlink Warehouse Associate/Level 2: $23.00 - $26.00/hour    Starlink Warehouse Associate/Level 3: $25.00 - $28.00/hour      
Your actual level and base salary will be determined on a case-by-case basis and may vary based on the following considerations: job-related knowledge and skills, education, and experience.
Base salary is just one part of your total rewards package at SpaceX. You may also be eligible for long-term incentives, in the form of company stock, stock options, or long-term cash awards, as well as potential discretionary bonuses and the ability to purchase additional stock at a discount through an Employee Stock Purchase Plan. You will also receive access to comprehensive medical, vision, and dental coverage, access to a 401(k) retirement plan, short and long-term disability insurance, life insurance, paid parental leave, and various other discounts and perks. You may also accrue 3 weeks of paid vacation and will be eligible for 10 or more paid holidays per year.    
 ITAR REQUIREMENTS:

To conform to U.S. Government export regulations, applicant must be a (i) U.S. citizen or national, (ii) U.S. lawful, permanent resident (aka green card holder), (iii) Refugee under 8 U.S.C.  1157, or (iv) Asylee under 8 U.S.C.  1158, or be eligible to obtain the required authorizations from the U.S. Department of State. Learn more about the ITAR here.  

SpaceX is an Equal Opportunity Employer; employment with SpaceX is governed on the basis of merit, competence and qualifications and will not be influenced in any manner by race, color, religion, gender, national origin/ethnicity, veteran status, disability status, age, sexual orientation, gender identity, marital status, mental or physical disability or any other legally protected status.
Applicants wishing to view a copy of SpaceXs Affirmative Action Plan for veterans and individuals with disabilities, or applicants requiring reasonable accommodation to the application/interview process should reach out to EEOCompliance@spacex.com."
3637469,"Starlink Production Associate - 1st shift (Temporary)","https://boards.greenhouse.io/spacex/jobs/8178498002?gh_jid=8178498002","SpaceX","Hawthorne","No",2,"Full time","2025-09-23T20:25:17.679938Z","SpaceX was founded under the belief that a future where humanity is out exploring the stars is fundamentally more exciting than one where we are not. Today SpaceX is actively developing the technologies to make this possible, with the ultimate goal of enabling human life on Mars.STARLINK PRODUCTION ASSOCIATE - 1ST SHIFT (TEMPORARY)
One of the most ambitious missions that SpaceX has undertaken to date, the Starlink satellite constellation, is our solution to providing reliable internet to the entire world. We are looking for talented production associates/assemblers to help establish new manufacturing and test processes and eventually ramp to full-scale production for the user terminal (a high volume manufactured product that consumers will have in their homes).
The success of Starlink depends on the quality, reliability, cost, manufacturability, throughput, and security of the products that you deliver. If you seek a fast-paced, dynamic environment; if you thrive on solving difficult problems where resolutions have high impact; and if you love the challenge of building something from scratch, then this role will be an ideal next career step.
RESPONSIBILITIES:

Support the development of prototype manufacturing and test capabilities
Mechanical/electrical assembly of user terminal components, subassemblies, and final assembly according to instructions
Operate light equipment such as drills, custom build tooling, crimpers, presses
Program, load, operate, and troubleshoot automated equipment
Execute equipment maintenance and calibration schedules
Package final products for delivery
Maintain consumables inventory
Assist engineers with development builds and other tasks
Help develop and optimize production line stations and processes
Keep a clean, organized, and thoroughly maintained workspace
Ensure product quality and conformance to design requirements
Put safety as number one priority

POSITION DETAILS:
This is a temporary position with SpaceX, for the length of time as stated, and is subject to change with minimal notice as business needs dictate.


LENGTH OF POSITION: 3 months 
LOCATION: Hawthorne 
SHIFT: 1st shift - Mon-Fri 5:00am - 5:00pm


BASIC QUALIFICATIONS:

High school diploma or equivalency certificate

PREFERRED SKILLS AND EXPERIENCE:

2+ years of mechanical or electrical assembly experience
Demonstrated ability to read, interpret and work from drawings, and controlled documentation such as: layout drawings, mechanical drawings, assembly procedures/work instructions; schematics, engineering drawings, and parts list
Able to proficiently use a PC, Microsoft Windows, and Microsoft Office suite
Excellent communication and organizational skills
Experience working in an electro-mechanical manufacturing company, a precision manufacturing company, or high volume manufacturing company
Experience with electrical wiring
Electro-mechanical assembly and prototype development experience
Experience setting up and running tests and experiments

ADDITIONAL REQUIREMENTS:

Able to work 1st shift, overtime and/or weekends as needed. Approximate work hours: 5:00am - 5:00pm
Standing for long periods of time, climbing up and down ladders, bending, grasping, sitting, pulling, pushing, stooping, and stretching may be required to perform the functions of this position
Able to lift up to 50lbs. unassisted

COMPENSATION AND BENEFITS: 
Pay range:    Starlink Production Associate/Level 1: $22.00/hour    Starlink Production Associate/Level 2: $23.00 - $26.00/hour    Starlink Production Associate/Level 3: $25.00 - $28.50/hour    
Your actual level and base salary will be determined on a case-by-case basis and may vary based on the following considerations: job-related knowledge and skills, education, and experience.
Base salary is just one part of your total rewards package at SpaceX. You may also be eligible for potential discretionary bonuses. You will also receive access to comprehensive medical coverage, access to a 401(k) retirement plan, and various other discounts and perks. You will also be eligible for 10 or more paid holidays per year. 
 ITAR REQUIREMENTS:

To conform to U.S. Government export regulations, applicant must be a (i) U.S. citizen or national, (ii) U.S. lawful, permanent resident (aka green card holder), (iii) Refugee under 8 U.S.C.  1157, or (iv) Asylee under 8 U.S.C.  1158, or be eligible to obtain the required authorizations from the U.S. Department of State. Learn more about the ITAR here.  

SpaceX is an Equal Opportunity Employer; employment with SpaceX is governed on the basis of merit, competence and qualifications and will not be influenced in any manner by race, color, religion, gender, national origin/ethnicity, veteran status, disability status, age, sexual orientation, gender identity, marital status, mental or physical disability or any other legally protected status.
Applicants wishing to view a copy of SpaceXs Affirmative Action Plan for veterans and individuals with disabilities, or applicants requiring reasonable accommodation to the application/interview process should reach out to EEOCompliance@spacex.com."
3637468,"Sr. Tooling Design Engineer, Consumer Hardware (Starlink)","https://boards.greenhouse.io/spacex/jobs/8177505002?gh_jid=8177505002","SpaceX","Bastrop, TX","No",5,"Full time","2025-09-23T20:25:17.679957Z","SpaceX was founded under the belief that a future where humanity is out exploring the stars is fundamentally more exciting than one where we are not. Today SpaceX is actively developing the technologies to make this possible, with the ultimate goal of enabling human life on Mars.
SR. TOOLING DESIGN ENGINEER, CONSUMER HARDWARE (STARLINK) 


At SpaceX were leveraging our experience in building rockets and spacecraft to deploy Starlink, the worlds most advanced broadband internet system. Starlink is the worlds largest satellite constellation and is providing fast, reliable internet to millions of users worldwide. We design, build, test, and operate all parts of the system  thousands of satellites, consumer receivers that allow users to connect within minutes of unboxing, and the software that brings it all together. Weve only begun to scratch the surface of Starlinks potential global impact and are looking for best-in-class engineers to help maximize Starlinks utility for communities and businesses around the world.


Starlink Tooling Design Engineers in our Austin facilities are hyper-focused on the high-volume consumer products that we ship directly to customers all over the world. We design this hardware to be both technically sophisticated and easy to use. Our customers currently include teachers in the most remote parts of the Amazon, researchers in Antarctica, digital nomads who travel via RV, emergency responders, commercial airlines, cruise lines, and residential users who live in more rural or developing areas. As a member of this team, you will lead creative, multi-disciplinary projects that include designing both the consumer products themselves and the factories that manufacture them, ushering in the next era of the internet, and delivering internet to those that need it most. 



RESPONSIBILITIES: 



Own Starlink consumer hardware from conceptual design through high volume production and public launch 
Develop design criteria, collaborate on requirements, and drive system-level optimization 
Test and iterate on products to enable high field reliability and performance in all environments and use cases
Design and develop the production lines that manufacture your product, including robot end effector design, process development, control system design, automation programming, and more
Refine the production system to create high-rate, high-yield, and reliable processes
Establish an efficient product lifecycle starting in the supply chain all the way through final integration that balances cost, complexity, and quality; work closely with partner teams to design and realize an efficient in-house production line 





BASIC QUALIFICATIONS: 





Bachelor's degree in an engineering discipline 
Experience with CAD and FEA software packages 
5+ years of professional experience with mechanical/electromechanical design, analysis, testing, and/or manufacturing 



PREFERRED SKILLS AND EXPERIENCE: 




Masters degree in engineering or a related technical discipline 
3+ years of professional experience in mechanical design and analysis
2+ years of hands-on project experience with complex mechanical systems, preferably as a team lead
Proficient in 3D CAD (NX preferred)
Solid understanding and application of GD&amp;T, mechanical engineering fundamentals, structural analysis, and failure modes of complex mechanical systems
Prior ownership of a complex component or assembly from initial design through high-volume production ramp
Familiarity with manufacturing processes and how to design for manufacturability
Exposure to some variety of production machinery, industrial sensors, and equipment (motion systems, dispense systems, temperature controllers, laser distance sensors, injection molders, die casters, etc.)
Self-motivated with strong organizational, written, and oral communication skills




ADDITIONAL REQUIREMENTS: 




Ability to work long hours and weekends as necessary to support critical milestones



ITAR REQUIREMENTS:

To conform to U.S. Government export regulations, applicant must be a (i) U.S. citizen or national, (ii) U.S. lawful, permanent resident (aka green card holder), (iii) Refugee under 8 U.S.C.  1157, or (iv) Asylee under 8 U.S.C.  1158, or be eligible to obtain the required authorizations from the U.S. Department of State. Learn more about the ITAR here.  

SpaceX is an Equal Opportunity Employer; employment with SpaceX is governed on the basis of merit, competence and qualifications and will not be influenced in any manner by race, color, religion, gender, national origin/ethnicity, veteran status, disability status, age, sexual orientation, gender identity, marital status, mental or physical disability or any other legally protected status.
Applicants wishing to view a copy of SpaceXs Affirmative Action Plan for veterans and individuals with disabilities, or applicants requiring reasonable accommodation to the application/interview process should reach out to EEOCompliance@spacex.com."
3637467,"Sr. Packaging Engineer (Starlink Satellites)","https://boards.greenhouse.io/spacex/jobs/8178291002?gh_jid=8178291002","SpaceX","Redmond","No",5,"Full time","2025-09-23T20:25:17.679981Z","SpaceX was founded under the belief that a future where humanity is out exploring the stars is fundamentally more exciting than one where we are not. Today SpaceX is actively developing the technologies to make this possible, with the ultimate goal of enabling human life on Mars.SR. PACKAGING ENGINEER (STARLINK SATELLITES)
Starlink is seeking a highly motivated and experienced Packaging professional with strong project management skills. In this role, you will be responsible for working with internal and external stakeholders to deliver hardware safely and efficiently through the supply chain to support production operations. As SpaceX scales Starlink Satellite manufacturing, the Packaging Engineer will be responsible for leading the execution of packaging projects from concept through implementation. This role requires technical rigor, cross-functional leadership, and the ability to drive projects that directly impact SpaceXs mission success.
RESPONSIBILITIES:

Design, qualify, and implement product packaging solutions that optimize space efficiency, logistics costs, part protection, and efficient material flow
Continuously evaluate new packaging materials, designs, manufacturing processes to ensure alignment with industry best practices
Review engineering drawings and product specifications to understand physical characteristics and handling/safety requirements
Coordinate test fit and in-line trials within the supply base and internal production lines to ensure all stakeholder requirements are met
Develop detailed packaging specifications to ensure solutions are scalable, adopted, and cost-effective
Lead Plan for Every Part (PFEP) initiatives supporting Starlink satellite production
Ensure effective collaboration between design engineering, procurement, production, logistics, and suppliers with respect to new packaging initiatives
Own project timelines and risk management for all packaging initiatives
Support long-term packaging strategy, including reusability initiatives and cost-reduction roadmaps

BASIC QUALIFICATIONS:

Bachelors degree in packaging engineering, industrial engineering, mechanical engineering, or an engineering discipline
3+ years of experience working in a production environment
5+ years of experience designing, qualifying, or implementing packaging solutions

PREFERRED SKILLS AND EXPERIENCE:

Familiarization with various packaging commodities and how they are manufactured, including but not limited to: Wood, plastics, metals, and foam materials
Exceptional interpersonal communication skills, technical packaging skills and project management skills
Experience managing packaging or logistics projects in a high-volume manufacturing environment, including returnable packaging and reverse logistics.
Experience working in a fast-paced production environment
Proven ability to lead cross-functional teams and manage multiple projects simultaneously
Demonstrated knowledge of high-volume production processes i.e. PPAP, APQP, FAIR
Experience with MRP or ERP systems
Hands-on mechanical troubleshooting
Strong analytical skills with the ability to use data for decision-making and process optimization
Self-motivated, detail-oriented, and comfortable in a fast-moving and dynamic environment

ADDITIONAL REQUIREMENTS:

Able to work extended hours and weekends as needed to support critical project timelines
Ability to travel domestically and internationally up to 20% of the time

COMPENSATION AND BENEFITS:
Pay range:Sr. Engineer: $125,000.00 - $175,000.00/per year
Your actual level and base salary will be determined on a case-by-case basis and may vary based on the following considerations: job-related knowledge and skills, education, and experience.
Base salary is just one part of your total rewards package at SpaceX. You may also be eligible for long-term incentives, in the form of company stock, stock options, or long-term cash awards, as well as potential discretionary bonuses and the ability to purchase additional stock at a discount through an Employee Stock Purchase Plan. You will also receive access to comprehensive medical, vision, and dental coverage, access to a 401(k) retirement plan, short and long-term disability insurance, life insurance, paid parental leave, and various other discounts and perks. You may also accrue 3 weeks of paid vacation and will be eligible for 10 or more paid holidays per year. Employees in Washington State accrue paid sick time in compliance with state and federal law. Company shuttles are offered to employees for roundtrip travel from select Seattle locations to the SpaceX Redmond office Monday to Friday.ITAR REQUIREMENTS:

To conform to U.S. Government export regulations, applicant must be a (i) U.S. citizen or national, (ii) U.S. lawful, permanent resident (aka green card holder), (iii) Refugee under 8 U.S.C.  1157, or (iv) Asylee under 8 U.S.C.  1158, or be eligible to obtain the required authorizations from the U.S. Department of State. Learn more about the ITAR here.  

SpaceX is an Equal Opportunity Employer; employment with SpaceX is governed on the basis of merit, competence and qualifications and will not be influenced in any manner by race, color, religion, gender, national origin/ethnicity, veteran status, disability status, age, sexual orientation, gender identity, marital status, mental or physical disability or any other legally protected status.
Applicants wishing to view a copy of SpaceXs Affirmative Action Plan for veterans and individuals with disabilities, or applicants requiring reasonable accommodation to the application/interview process should reach out to EEOCompliance@spacex.com."
