"ID","Title","Link","Company","Location","Remote","Experience","EmploymentType","DatePosted","RoleDescription"
3648967,"Sr. Financial Systems Analyst (D365)","https://boards.greenhouse.io/spacex/jobs/8181508002?gh_jid=8181508002","SpaceX","Hawthorne","No",4,"Full time","2025-09-23T20:25:17.679573Z","SpaceX was founded under the belief that a future where humanity is out exploring the stars is fundamentally more exciting than one where we are not. Today SpaceX is actively developing the technologies to make this possible, with the ultimate goal of enabling human life on Mars.SR. FINANCIAL SYSTEMS ANALYST (D365)
We are seeking an experienced financial systems analyst with a technical mindset and functional domain expertise in finance and operations. This role requires a thorough understanding of Microsoft Dynamics 365 architecture and functionality to configure and customize D365 ERP for the new and evolving business processes. You will have the opportunity to work on projects and systems from the ground up as we continue to scale.  
RESPONSIBILITIES: 

Own and manage D365 F&amp;O configurations, customizations, and integrations while ensuring compliance with security protocols, data privacy standards, and internal audit requirements to minimize risks and prevent unauthorized access
Conduct thorough risk assessments and impact analyses for new processes, features, or custom flows (using X++, Power Automate, etc.), implementing safeguards to protect critical business data and operations
Project manage across all key phases of development - requirements gathering, design, implementation, testing, and go-live success
Architect and implement solutions in D365 F&amp;O, focusing on modules such as GL, Accounts Payable, Accounts Receivable, Fixed Assets, Projects, Inventory, and Cash and Bank Management
Design, develop, test, and deploy custom components in D365 F&amp;O using X++, Visual Studio, and Azure DevOp
Develop and implement integrations with third-party systems using modern APIs and best practices
Collaborate closely with stakeholders in Finance, Application Software, and Information Technology
Liaison with Microsofts support team and escalate issues as needed
Handle confidential financial, operational, and proprietary data with the utmost discretion, including regular audits, user access reviews, and incident response to maintain system integrity
Monitor system performance, conduct regular maintenance, and optimize D365 F&amp;O processes to ensure scalability, reliability, and minimal downtime in a dynamic operational environment

BASIC QUALIFICATIONS:

Bachelor's degree in engineering, finance, physics, mathematics, computer science, information systems, or other technical discipline
4+ years of combined work experience as a developer, business systems analyst or product manager, with at least 2 of those years in a finance or supply chain domain
Experience with SQL

PREFERRED SKILLS AND EXPERIENCE:

Experience with Dynamics 365
ERP and related systems development or implementation of Procure-to-Pay, Order-to-Cash Cycle or Financial Systems
Ability to influence cross-functional teams without formal authority or structure
Experience working in fast paced development environments in a compliant manner (consistent track record of innovation with caution)
Strong analytical, conceptual, problem-solving and technical skills with the ability to create original and creative solutions
Experience building robust testing plans and familiarity with change management best practices

ADDITIONAL REQUIREMENTS:

Willing to work extended hours and weekends as needed
This position is based in Hawthorne, CA (Los Angeles area), and requires being onsite full-time  hybrid and remote work will not be considered

COMPENSATION AND BENEFITS:
Pay range: 
Sr. Financial Systems Analyst: $110,000.00 - $145,000.00/per year
Your actual level and base salary will be determined on a case-by-case basis and may vary based on the following considerations: job-related knowledge and skills, education, and experience.
Base salary is just one part of your total rewards package at SpaceX. You may also be eligible for long-term incentives, in the form of company stock, stock options, or long-term cash awards, as well as potential discretionary bonuses and the ability to purchase additional stock at a discount through an Employee Stock Purchase Plan. You will also receive access to comprehensive medical, vision, and dental coverage, access to a 401(k) retirement plan, short and long-term disability insurance, life insurance, paid parental leave, and various other discounts and perks. You may also accrue 3 weeks of paid vacation and will be eligible for 10 or more paid holidays per year. Employees accrue paid sick leave pursuant to Company policy which satisfies or exceeds the accrual, carryover, and use requirements of the law.
 ITAR REQUIREMENTS:

To conform to U.S. Government export regulations, applicant must be a (i) U.S. citizen or national, (ii) U.S. lawful, permanent resident (aka green card holder), (iii) Refugee under 8 U.S.C.  1157, or (iv) Asylee under 8 U.S.C.  1158, or be eligible to obtain the required authorizations from the U.S. Department of State. Learn more about the ITAR here.  

SpaceX is an Equal Opportunity Employer; employment with SpaceX is governed on the basis of merit, competence and qualifications and will not be influenced in any manner by race, color, religion, gender, national origin/ethnicity, veteran status, disability status, age, sexual orientation, gender identity, marital status, mental or physical disability or any other legally protected status.
Applicants wishing to view a copy of SpaceXs Affirmative Action Plan for veterans and individuals with disabilities, or applicants requiring reasonable accommodation to the application/interview process should reach out to EEOCompliance@spacex.com."
3648966,"RF Test Engineer (Akoustis)","https://boards.greenhouse.io/spacex/jobs/8181183002?gh_jid=8181183002","SpaceX","New York","No",1,"Full time","2025-09-23T20:25:17.679653Z","SpaceX was founded under the belief that a future where humanity is out exploring the stars is fundamentally more exciting than one where we are not. Today SpaceX is actively developing the technologies to make this possible, with the ultimate goal of enabling human life on Mars.RF TEST ENGINEER (AKOUSTIS)
Akoustis is now operating as a wholly owned subsidiary of SpaceX providing industry leading RF filters using patented XBAW technology to help drive the mission of making human life multi-planetary, while also connecting the world through Starlink. Our work will help further the impact that Starlink is already making to 7M+ users around the world, while allowing us to broaden that reach dramatically and continue connecting the unconnected here on earth.
Akoustis supports the success of Starlink by supplying world class RF filters manufactured with the highest levels of quality and reliability. At Akoustis, we continually strive for manufacturing excellence with a focus on cost controls and production throughput. We are seeking an experienced RF Test Engineer to join our fast-paced manufacturing team.
RESPONSIBILITIES:

Develop and implement test cases for new RF BAW filters devices.
Develop calibration procedures and implement them into manufacturing for devices ranging in frequency from 2GHz to &gt; 10GHz.
Drive continuous process improvement to enhance yield, reduce cycle time, and lower manufacturing costs.
Develop cost of ownership and risk management models to evaluate RF probe test plans.
Sustain and optimize workflow in test work center for high-mix environment.
Serve as tool owner for automated probe stations and VNAs.
Lead test operators in maintaining area work flow.
Work closely with maintenance teams and tool vendors to troubleshoot and resolve tool and process issues.
Collaborate with the design teams to establish ground rules and designs that optimize manufacturability.
Lead the installation of new test tools, including both capability-enhancing tools and capacity expansion tools.
Write and maintain Standard Operating Procedures (SOPs), engineering instructions, and documentation related to lithography process control.
Utilize Statistical Process Control (SPC) and Design of Experiments (DOE) methodologies to monitor, control, and improve processes.

BASIC QUALIFICATIONS:

Bachelor's degree in electrical engineering or other engineering field.
1+ years of RF test engineering experience.

PREFERRED QUALIFICATIONS:

Proven experience with: automated wafer probe station, VNA systems, design of probe cards and data analysis of RF test data. 
Experience leading and directing operators.
Proficiency in JMP statistical software, Microsoft Office Suite, and KLayout CAD software.
Strong written, verbal, and organizational communication skills.
Demonstrated ability to create detailed technical documentation and training materials.
Solid understanding of SPC, DOE, 8D, and risk/change management processes.
Experience leading cross-functional projects or tool installation programs.
Familiarity with high-volume manufacturing environments involving frequent product changeovers.
Experience in quality audits and yield improvement initiatives.

ADDITIONAL REQUIREMENTS:

Must be willing to work extended hours and weekends as needed to meet critical milestones.
This position will sit 100% onsite in our Canandaigua, NY facility.

COMPENSATION AND BENEFITS:             
Pay range:    RF Test Engineer/Level I: $80,000.00 - $115,000.00/per year    RF Test Engineer/Level II: $95,000.00 - $130,000.00/per year    
Your actual level and base salary will be determined on a case-by-case basis and may vary based on the following considerations: job-related knowledge and skills, education, and experience.
Base salary is just one part of your total rewards package at SpaceX. You may also be eligible for long-term incentives, in the form of company stock, stock options, or long-term cash awards, as well as potential discretionary bonuses and the ability to purchase additional stock at a discount through an Employee Stock Purchase Plan. You will also receive access to comprehensive medical, vision, and dental coverage, access to a 401(k) retirement plan, short and long-term disability insurance, life insurance, paid parental leave, and various other discounts and perks. You may also accrue 3 weeks of paid vacation and will be eligible for 10 or more paid holidays per year. Employees accrue paid sick leave pursuant to Company policy which satisfies or exceeds the accrual, carryover, and use requirements of the law.ITAR REQUIREMENTS:

To conform to U.S. Government export regulations, applicant must be a (i) U.S. citizen or national, (ii) U.S. lawful, permanent resident (aka green card holder), (iii) Refugee under 8 U.S.C.  1157, or (iv) Asylee under 8 U.S.C.  1158, or be eligible to obtain the required authorizations from the U.S. Department of State. Learn more about the ITAR here.  

SpaceX is an Equal Opportunity Employer; employment with SpaceX is governed on the basis of merit, competence and qualifications and will not be influenced in any manner by race, color, religion, gender, national origin/ethnicity, veteran status, disability status, age, sexual orientation, gender identity, marital status, mental or physical disability or any other legally protected status.
Applicants wishing to view a copy of SpaceXs Affirmative Action Plan for veterans and individuals with disabilities, or applicants requiring reasonable accommodation to the application/interview process should reach out to EEOCompliance@spacex.com."
3648965,"Hardware Reliability Engineer (Starlink Product) ","https://boards.greenhouse.io/spacex/jobs/8181544002?gh_jid=8181544002","SpaceX","Hawthorne","No",3,"Full time","2025-09-23T20:25:17.679676Z","SpaceX was founded under the belief that a future where humanity is out exploring the stars is fundamentally more exciting than one where we are not. Today SpaceX is actively developing the technologies to make this possible, with the ultimate goal of enabling human life on Mars.HARDWARE RELIABILITY ENGINEER (STARLINK PRODUCT)
SpaceX is expanding our low-latency, broadband internet system to meet the needs of consumers across the globe. Enabled by a constellation of low Earth orbit satellites, Starlink provides fast, reliable internet to populations with little or no connectivity, including those in rural communities and places where existing services are too expensive or unreliable. The Hardware Reliability Team at Starlink is an interdisciplinary team that is committed to the reliability of the mechanical and electrical hardware required to connect our customers to our satellites. 
Your breadth of exposure will span across dozens of areas (mechanical, electrical, RF, software, test, etc.) as you collaborate with core groups at SpaceX to bring hardware from initial concept development to full-scale high-volume production.
You will use data to understand the factors that drive process and product reliability in design and manufacturing. You will dive deep into the details to identify, understand, and solve difficult technical problems to influence product design and manufacturing processes. You will be exposed to a hands-on environment that will enable you to spend time on the factory floor and in the test lab to improve the reliability of hardware and, ultimately, the user experience. 
RESPONSIBILITIES:

Develop and implement reliability test strategies for new products and their subcomponents to maximize field life and minimize early life failures
Develop, implement, and validate test and inspection processes for new and existing products and production processes, ensuring that criteria are objective and that reliability goals are consistently met
Design and execute novel environmental, RF, mechanical, and electrical testing techniques tailored to the product and its functions
Write test programs to exercise the functionality of the product over various conditions and environments
Automate reliability test initiatives and reporting using proper data visualization techniques and thorough knowledge of the product and its functions
Define the ongoing reliability testing strategy to monitor the manufacturing process and screen for long-term reliability defects caused by process and component variability
Monitor product and process quality through production ramp-up using a suite of analysis tools, and drive improvements to areas that are under-performing in terms of key quality metrics
Investigate failures in production and test, identifying and mitigating the immediate and underlying root causes in order to reduce risk and improve reliability of designs and processes
Contain suspect or known non-conforming product, providing guidance to production representatives and engineers to assist in quarantining and rework activities
Work closely with hardware, software, manufacturing, and network engineering teams to maximize reliability across all disciplines

BASIC QUALIFICATIONS:

Bachelors degree in an engineering discipline
1+ years of experience in test, analysis, manufacturing, or hardware development (internship and project experience is applicable)

PREFERRED SKILLS AND EXPERIENCE:

Master's degree in an engineering discipline
3+ years of experience in test, analysis, manufacturing, or hardware development (internship and project experience is applicable)  
Experience with both electronics and mechanical design and analysis including knowledge of RF principles
Programming experience in Python, C, and SQL with an emphasis on data analysis and automation
Demonstrated capability to think creatively and solve complex problems with little to no supervision and on schedule, both as an individual or as a member of an integrated team
Experience in a fast-paced, iterative design environment within the consumer electronics, mobile handset, medical devices, aerospace, marine, or automotive industries

ADDITIONAL REQUIREMENTS:

Ability to work extended hours, weekends, and offsite as needed
Must be able to work onsite in Hawthorne, CA, remote or hybrid work not considered
Must be able to travel (up to 5%)

COMPENSATION AND BENEFITS:Pay range:    Hardware Reliability Engineer/Level I: $95,000.00 - $115,000.00/per year    Hardware Reliability Engineer/Level II: $110,000.00 - $130,000.00/per year        Your actual level and base salary will be determined on a case-by-case basis and may vary based on the following considerations: job-related knowledge and skills, education, and experience.
Base salary is just one part of your total rewards package at SpaceX. You may also be eligible for long-term incentives, in the form of company stock, stock options, or long-term cash awards, as well as potential discretionary bonuses and the ability to purchase additional stock at a discount through an Employee Stock Purchase Plan. You will also receive access to comprehensive medical, vision, and dental coverage, access to a 401(k) retirement plan, short and long-term disability insurance, life insurance, paid parental leave, and various other discounts and perks. You may also accrue 3 weeks of paid vacation and will be eligible for 10 or more paid holidays per year. Employees accrue paid sick leave pursuant to Company policy which satisfies or exceeds the accrual, carryover, and use requirements of the law.ITAR REQUIREMENTS:

To conform to U.S. Government export regulations, applicant must be a (i) U.S. citizen or national, (ii) U.S. lawful, permanent resident (aka green card holder), (iii) Refugee under 8 U.S.C.  1157, or (iv) Asylee under 8 U.S.C.  1158, or be eligible to obtain the required authorizations from the U.S. Department of State. Learn more about the ITAR here.  

SpaceX is an Equal Opportunity Employer; employment with SpaceX is governed on the basis of merit, competence and qualifications and will not be influenced in any manner by race, color, religion, gender, national origin/ethnicity, veteran status, disability status, age, sexual orientation, gender identity, marital status, mental or physical disability or any other legally protected status.
Applicants wishing to view a copy of SpaceXs Affirmative Action Plan for veterans and individuals with disabilities, or applicants requiring reasonable accommodation to the application/interview process should reach out to EEOCompliance@spacex.com."
3497133,"Financial Analyst","https://boards.greenhouse.io/spacex/jobs/8136166002?gh_jid=8136166002","SpaceX","Hawthorne","No",2,"Internship","2025-09-23T20:25:17.679694Z","SpaceX was founded under the belief that a future where humanity is out exploring the stars is fundamentally more exciting than one where we are not. Today SpaceX is actively developing the technologies to make this possible, with the ultimate goal of enabling human life on Mars.FINANCIAL ANALYST
The Financial Analyst will be instrumental in the development, tracking, forecasting, reporting, and accounting for all SpaceX projects. This is a key financial planning and analysis (FP&amp;A) role with executive-level visibility driving spending and contract profitability for all of our product lines, including Starlink, Starship, Falcon, and Dragon. The successful candidate will interface with all aspects of the company, including production, engineering, sales, program management, accounting, and executive management.
RESPONSIBILITIES:

Lead forecast of key performance indicators (KPIs), including spending and resource requirements for assigned business groups, such as headcount, capital, and operating expenses
Forecast future unit costs with cross-functional teams and track progress in achieving cost reduction targets
Conduct ad-hoc analyses as needed to support operational decision-making, from new idea generation through to the implementation phase
Perform a leading role on internal projects, working closely with peer organizations to understand key business issues and translate them into financial models and metrics
Prepare and update capital expenditure and inventory cash forecasts
Support product cost tracking and inventory analysis, including scrap, inventory obsolescence, and productivity efforts
Develop and enhance tools to track revenue performance and incurred project costs every month
Provide insight on revenue, spending variances, and department-level reporting to business partners
Analyze and interpret financial data for use in management reviews

BASIC QUALIFICATIONS:

Bachelors degree
2+ years of experience in an accounting, finance, or business role (internship experience qualifies) 

PREFERRED SKILLS AND EXPERIENCE:

Bachelors degree in business, finance, economics, or engineering
Advanced skills in Microsoft Excel, applied business statistics, and general modeling experience of complex non-linear systems
Experience in a manufacturing or technology environment
Familiarity with reporting, visualization, intelligence, and analysis tools (SQL, Power BI, Tableau, etc.)
Strong presentation skills with the ability to regularly interface with executive management
Experience with presenting analytical results in both verbal and written form across a multi-disciplinary organization
Ability to frame unstructured and complex analytical problems for a broad audience

ADDITIONAL REQUIREMENTS:

Willing to work extended hours and weekends as needed
This position is based in Hawthorne, CA (Los Angeles area), and requires being onsite full-time  hybrid and remote work will not be considered

COMPENSATION AND BENEFITS:
Pay range: 
Financial Analyst: $80,000.00 - $115,000.00/per year 
Your actual level and base salary will be determined on a case-by-case basis and may vary based on the following considerations: job-related knowledge and skills, education, and experience.
Base salary is just one part of your total rewards package at SpaceX. You may also be eligible for long-term incentives, in the form of company stock, stock options, or long-term cash awards, as well as potential discretionary bonuses and the ability to purchase additional stock at a discount through an Employee Stock Purchase Plan. You will also receive access to comprehensive medical, vision, and dental coverage, access to a 401(k) retirement plan, short and long-term disability insurance, life insurance, paid parental leave, and various other discounts and perks. You may also accrue 3 weeks of paid vacation and will be eligible for 10 or more paid holidays per year. Employees accrue paid sick leave pursuant to Company policy which satisfies or exceeds the accrual, carryover, and use requirements of the law.ITAR REQUIREMENTS:

To conform to U.S. Government export regulations, applicant must be a (i) U.S. citizen or national, (ii) U.S. lawful, permanent resident (aka green card holder), (iii) Refugee under 8 U.S.C.  1157, or (iv) Asylee under 8 U.S.C.  1158, or be eligible to obtain the required authorizations from the U.S. Department of State. Learn more about the ITAR here.  

SpaceX is an Equal Opportunity Employer; employment with SpaceX is governed on the basis of merit, competence and qualifications and will not be influenced in any manner by race, color, religion, gender, national origin/ethnicity, veteran status, disability status, age, sexual orientation, gender identity, marital status, mental or physical disability or any other legally protected status.
Applicants wishing to view a copy of SpaceXs Affirmative Action Plan for veterans and individuals with disabilities, or applicants requiring reasonable accommodation to the application/interview process should reach out to EEOCompliance@spacex.com."
