"ID","Title","Link","Company","Location","Remote","Experience","EmploymentType","DatePosted","RoleDescription"
3519313,"Senior Software Engineer ","https://boards.greenhouse.io/purestorage/jobs/7188973?gh_jid=7188973","storage","Prague, Czech Republic","No","Not specified","Full time","2025-09-23T20:25:38.449246Z","Were in an unbelievably exciting area of tech and are fundamentally reshaping the data storage industry. Here, you lead with innovative thinking, grow along with us, and join the smartest team in the industry.
This type of workwork that changes the worldis what the tech industry was founded on. So, if you're ready to seize the endless opportunities and leave your mark, come join us.THE ROLE
The Digital Experience (DX) team is on a mission to simplify fleet management through intelligent, cloud-native solutions. As a key member of our team in Prague, you will design and develop our cutting-edge SaaS platform, which provides customers with a unified system to effortlessly manage their assets. You will collaborate with peers and stakeholders across the company to build scalable cloud infrastructure and leverage automation, security, and AI-driven insights to deliver a seamless user experience.
WHAT YOU'LL DO

Work on the full application development lifecycle, designing, developing, operating, and maintaining mission-critical processing services.
Focus on security, compliance, and interoperability while experimenting with new technologies to innovate secure and cost-effective solutions for handling customer information.
Collaborate with peers and stakeholders to identify requirements and take solutions from initial design to production.
Champion best practices in design, development, unit testing, code reviews, documentation, continuous integration, and continuous deployment.

WHAT YOU BRING

Proven experience designing, implementing, and testing various product components.
Proficiency in modern backend programming languages such as Python, Java, or Golang, with the ability to quickly ramp up on new technologies and frameworks as needed.
A strong understanding of data structures, algorithms, and the software product lifecycle.
Experience with cloud applications and infrastructure, including AWS and Kubernetes.
A solid grasp of cloud networking infrastructure and SQL, such as PostgreSQL.
The ability to thrive in a highly collaborative and team-oriented environment.
We are primarily an in-office environment and therefore, you will be expected to work from the Prague, Czech Republic office in compliance with Pures policies, unless you are on PTO, or work travel, or other approved leave.

#LIONSITEWHAT YOU CAN EXPECT FROM US:

Pure Innovation: We celebrate those who think critically, like a challenge and aspire to be trailblazers.
Pure Growth: We give you the space and support to grow along with us and to contribute to something meaningful. We have been Named Fortune's Best Large Workplaces in the Bay AreaTM, Fortune's Best Workplaces for MillennialsTM and certified as a Great Place to Work!
Pure Team: We build each other up and set aside ego for the greater good.

And because we understand the value of bringing your full and best self to work, we offer a variety of perks to manage a healthy balance, including flexible time off, wellness resources and company-sponsored team events. Check out purebenefits.com for more information.
ACCOMMODATIONS AND ACCESSIBILITY:
Candidates with disabilities may request accommodations for all aspects of our hiring process. For more on this, contact us at TA-Ops@purestorage.com if youre invited to an interview.
OUR COMMITMENT TO A STRONG AND INCLUSIVE TEAM:
Were forging a future where everyone finds their rightful place and where every voice matters. Where uniqueness isnt just accepted but embraced. Thats why we are committed to fostering the growth and development of every person, cultivating a sense of community through our Employee Resource Groups and advocating for inclusive leadership. Pure is proud to be an equal opportunity and affirmative action employer. We do not discriminate based upon race, religion, color, national origin, sex (including pregnancy, childbirth, or related medical conditions), sexual orientation, gender, gender identity, gender expression, transgender status, sexual stereotypes, age, status as a protected veteran, status as an individual with a disability, or any other characteristic legally protected by the laws of the jurisdiction in which you are being considered for hire.
JOIN US AND BRING YOUR BEST.
BRING YOUR BOLD.
BRING YOUR FLASH."
3617271,"Senior Data Scientist - Procurement Spend","https://boards.greenhouse.io/purestorage/jobs/7234512?gh_jid=7234512","storage","Bangalore","No",7,"Full time","2025-09-23T20:25:38.449271Z","Were in an unbelievably exciting area of tech and are fundamentally reshaping the data storage industry. Here, you lead with innovative thinking, grow along with us, and join the smartest team in the industry.
This type of workwork that changes the worldis what the tech industry was founded on. So, if you're ready to seize the endless opportunities and leave your mark, come join us.About the Role
We are looking for a highly capable and globally minded Data Scientist - Procurement Spends to join our Strategic Sourcing team. This role will play a key part in supporting the Global Strategic Sourcing function across the US, EMEA, and APJ, by creating, driving, and executing a variety of category-focused projects and initiatives.
The ideal candidate is experienced, detail-oriented, and proactivesomeone who can independently analyze procurement data, provide strategic insights, and identify sourcing and savings opportunities with minimal hand-holding. In addition to supporting ad hoc and recurring reporting needs, this role will leverage advanced data science and machine learning capabilities to help drive global process consistency, benchmarking, compliance, and sourcing innovation.
Key Responsibilities

Support the Global Strategic Sourcing team by delivering clear, actionable spend insights across regions and categories.
Consolidate and critically evaluate data from multiple sources including spend, contract, supplier, and savings data.
Perform detailed benchmarking against industry best practices, KPIs, and competitive performance metrics.
Conduct advanced data analysis and statistical modeling to identify patterns, predict supplier performance, and highlight savings opportunities.
Design and implement machine learning models (supervised/unsupervised, deep learning, NLP) to extract insights from structured and unstructured procurement data.
Build and customize machine learning libraries and tools to enhance procurement analytics capabilities.
Identify savings, supplier consolidation, and negotiation opportunities and proactively surface them to sourcing managers.
Partner with global stakeholders and sourcing leads to define focus areas and create high-quality analytical outputs that support strategic decision-making.
Build and maintain dashboards, data models, and reporting tools to support procurement visibility and performance tracking.
Drive or support global process improvement initiatives, including compliance reporting, automation, policy development, and sourcing platform implementation.
Establish and refine processes and documentation to ensure global consistency and scalable operations.
Assist with or lead sourcing-related projects and initiatives aligned with category strategies and procurement transformation goals.

Qualifications
Required:

Bachelors or Masters degree in Business, Finance, Supply Chain, Analytics, Data Science, Statistics, or related field.
7+ years of experience in procurement analytics, data science, or strategic sourcing with a focus on global or regional spend management.
Strong data analytics skills with expertise in Excel, statistical modeling, and advanced analysis.
Proficiency in Python and/or R for data manipulation, modeling, and automation.
Hands-on experience with machine learning models (supervised, unsupervised, deep learning, NLP).
Experience with ERP/P2P systems (e.g., SAP, NetSuite, Oracle, Coupa) and BI/reporting tools (e.g., Tableau, Power BI, Looker).
Excellent cross-functional communication and interpersonal skills, with demonstrated experience collaborating across geographies.
Proven ability to independently manage workload, prioritize tasks, and deliver on tight timelines.

Preferred:

Project management skills and familiarity with methodologies such as Six Sigma, PMI, Agile, or similar.
Experience building ML libraries or frameworks from scratch.
Experience with automation or AI tools (e.g., RPA, Alteryx) to streamline reporting or analysis.
Prior involvement in benchmarking, supplier performance evaluation, or procurement transformation initiatives.
Familiarity with sourcing policy formation, contract compliance, or procurement governance.

What Youll Bring

A strong analytical mindset with the ability to turn data into strategy.
Curiosity and initiativeconstantly looking for better ways to inform sourcing decisions.
A collaborative approach and ability to partner with stakeholders across business units and time zones.
A passion for elevating procurements impact through advanced analytics, ML, and AI-driven insights.
Drive to innovate and continuously improve procurement processes and outcomes globally.
WHAT YOU CAN EXPECT FROM US:

Pure Innovation: We celebrate those who think critically, like a challenge and aspire to be trailblazers.
Pure Growth: We give you the space and support to grow along with us and to contribute to something meaningful. We have been Named Fortune's Best Large Workplaces in the Bay AreaTM, Fortune's Best Workplaces for MillennialsTM and certified as a Great Place to Work!
Pure Team: We build each other up and set aside ego for the greater good.

And because we understand the value of bringing your full and best self to work, we offer a variety of perks to manage a healthy balance, including flexible time off, wellness resources and company-sponsored team events. Check out purebenefits.com for more information.
ACCOMMODATIONS AND ACCESSIBILITY:
Candidates with disabilities may request accommodations for all aspects of our hiring process. For more on this, contact us at TA-Ops@purestorage.com if youre invited to an interview.
OUR COMMITMENT TO A STRONG AND INCLUSIVE TEAM:
Were forging a future where everyone finds their rightful place and where every voice matters. Where uniqueness isnt just accepted but embraced. Thats why we are committed to fostering the growth and development of every person, cultivating a sense of community through our Employee Resource Groups and advocating for inclusive leadership. Pure is proud to be an equal opportunity and affirmative action employer. We do not discriminate based upon race, religion, color, national origin, sex (including pregnancy, childbirth, or related medical conditions), sexual orientation, gender, gender identity, gender expression, transgender status, sexual stereotypes, age, status as a protected veteran, status as an individual with a disability, or any other characteristic legally protected by the laws of the jurisdiction in which you are being considered for hire.
JOIN US AND BRING YOUR BEST.
BRING YOUR BOLD.
BRING YOUR FLASH."
3617270,"SDET, Portworx","https://boards.greenhouse.io/purestorage/jobs/7248134?gh_jid=7248134","storage","Bangalore","No",7,"Full time","2025-09-23T20:25:38.449298Z","Were in an unbelievably exciting area of tech and are fundamentally reshaping the data storage industry. Here, you lead with innovative thinking, grow along with us, and join the smartest team in the industry.
This type of workwork that changes the worldis what the tech industry was founded on. So, if you're ready to seize the endless opportunities and leave your mark, come join us.SHOULD YOU ACCEPT THIS CHALLENGE...
You will  join Portworx QA team, which is responsible delivering highest quality Portworx suite of products. You will be contributing to cleanest code, being customer oriented and putting quality first.
What You Will Be Doing

Datapath Testing for the Cloud Native Storage product line.
Filing and owning related bugs (documenting, debugging, follow-up with Dev teams, reproduce, etc)
Own and drive features to completion (review requirements, design docs, customer use cases to build test strategies, test cases, and end-to-end workflows in the System Test ecosystem for new and existing features over multiple releases)
Build up and scale out of complex system tests and test ecosystems using virtualized environments and various test tools.
Work with cross functional teams to identify root causes and provide assistance with reproduction work on Customer Escalations.


What You Bring To The Team

Experience in Storage system Testing with ability to create enterprise end-to-end test ecosystems from the ground up and maintain it over time.  
Experience in testing snapshots, cloning, NFS
Knowledge of EXT4 FS
Experience in developing IO Profiles and understanding IO patterns
Understanding use case vs functional aspects and coming up with E2E tests 
Understanding how to benchmark typical linux system with different IO tools like FIO/vdbench/TPCC etc
Highly skilled in building out and working with Virtualized environments (ESXi, KVM, Hyper-V, Dockers)
Comfortable with Linux environments (ability to script and automate a plus)
Team player, excellent communication skills, with strong multi-tasking ability
Excellent problem solver
K8s ecosystem understanding is a huge plus. 
7+ years relevant work experience
B.S. in EE or CS or equivalent preferred



What Can Give You a Head Start 

Knowledge of SAN, NAS storage products - Read/Write IOPs, IO datapath.
FIle System protocols: NFS, SMB
Familiarity and hands-on experience volume snapshots and datapath testing
Ability to deploy and use 3rd party tools to simulate IO test workloads

WHAT YOU CAN EXPECT FROM US:

Pure Innovation: We celebrate those who think critically, like a challenge and aspire to be trailblazers.
Pure Growth: We give you the space and support to grow along with us and to contribute to something meaningful. We have been Named Fortune's Best Large Workplaces in the Bay AreaTM, Fortune's Best Workplaces for MillennialsTM and certified as a Great Place to Work!
Pure Team: We build each other up and set aside ego for the greater good.

And because we understand the value of bringing your full and best self to work, we offer a variety of perks to manage a healthy balance, including flexible time off, wellness resources and company-sponsored team events. Check out purebenefits.com for more information.
ACCOMMODATIONS AND ACCESSIBILITY:
Candidates with disabilities may request accommodations for all aspects of our hiring process. For more on this, contact us at TA-Ops@purestorage.com if youre invited to an interview.
OUR COMMITMENT TO A STRONG AND INCLUSIVE TEAM:
Were forging a future where everyone finds their rightful place and where every voice matters. Where uniqueness isnt just accepted but embraced. Thats why we are committed to fostering the growth and development of every person, cultivating a sense of community through our Employee Resource Groups and advocating for inclusive leadership. Pure is proud to be an equal opportunity and affirmative action employer. We do not discriminate based upon race, religion, color, national origin, sex (including pregnancy, childbirth, or related medical conditions), sexual orientation, gender, gender identity, gender expression, transgender status, sexual stereotypes, age, status as a protected veteran, status as an individual with a disability, or any other characteristic legally protected by the laws of the jurisdiction in which you are being considered for hire.
JOIN US AND BRING YOUR BEST.
BRING YOUR BOLD.
BRING YOUR FLASH."
3617269,"SDET, FlashArray","https://boards.greenhouse.io/purestorage/jobs/7247745?gh_jid=7247745","storage","Bangalore","No",7,"Full time","2025-09-23T20:25:38.449324Z","Were in an unbelievably exciting area of tech and are fundamentally reshaping the data storage industry. Here, you lead with innovative thinking, grow along with us, and join the smartest team in the industry.
This type of workwork that changes the worldis what the tech industry was founded on. So, if you're ready to seize the endless opportunities and leave your mark, come join us.SHOULD YOU ACCEPT THIS CHALLENGE..
The FlashArray team builds the industrys most innovative, high-performance, and highly available portfolio of products that are designed for the most demanding mission critical applications.  While we deliver a hardware storage array, over 90% of our engineering staff are software engineers. Our customers are the most important part of our business and they love FlashArray for its simplicity of management, the constant flow of new and exciting upgrades, and ability to live on the cutting edge of technology while never taking downtime, ever. Most recently, we extended the value of our FlashArray capabilities into the cloud with CloudSnap and Cloud Block Store for AWS. These new innovations enable our customers to leverage the agility of the public cloud for both traditional IT and cloud-native applications. 
 

If this describes you, let's talk! You can take a part in changing how the world works with data.
 
Responsibilities:
 

Ensuring FlashArray product and features ship with the highest quality.
Create System test designs that focus on FlashArray Feature Interoperability at Scale, Automate workflows and find high value defects to assure quality of anything we ship.
Work with Development, Support and Escalation teams to help reproduce and root cause customer issues Identifying, analyzing, and documenting any defects discovered during testing.
Design and build tools that make it efficient to execute and triage a large number of test scripts
Understand the inner workings of features to target specific failure domains in our stack to make the product/features fault tolerant and resilient.
Continuously look for test gaps, perform root cause analysis &amp; close loop on customer found defects.

Qualifications:
 

BS in Computer Science or equivalent.
7+ years of software system testing experience, or equivalent.
Strong knowledge of System testing using end-to-end Automation
Experience in qualifying enterprise products in cloud and container platforms (AWS, Azure, Google Cloud, Kubernetes, Docker)
Experience with any  virtualization technologies: VMware, Hyper-V, OpenStack.
Experience with multiple operating systems: Linux, Solaris, Windows.
Hands on automation in Python or similar scripting languages
Preferred but not required - storage protocols Fibre Channel, FCoE, iSCSI, NVME.
Ability to independently deploy and maintain test environments.
Proven analytical and creative problem-solving abilities.
Capable of prioritizing multiple projects in a fast-paced environment.
Natural curiosity with excellent written, oral, and interpersonal communication skills.
Must be willing and able to work in an open office, team environment

WHAT YOU CAN EXPECT FROM US:

Pure Innovation: We celebrate those who think critically, like a challenge and aspire to be trailblazers.
Pure Growth: We give you the space and support to grow along with us and to contribute to something meaningful. We have been Named Fortune's Best Large Workplaces in the Bay AreaTM, Fortune's Best Workplaces for MillennialsTM and certified as a Great Place to Work!
Pure Team: We build each other up and set aside ego for the greater good.

And because we understand the value of bringing your full and best self to work, we offer a variety of perks to manage a healthy balance, including flexible time off, wellness resources and company-sponsored team events. Check out purebenefits.com for more information.
ACCOMMODATIONS AND ACCESSIBILITY:
Candidates with disabilities may request accommodations for all aspects of our hiring process. For more on this, contact us at TA-Ops@purestorage.com if youre invited to an interview.
OUR COMMITMENT TO A STRONG AND INCLUSIVE TEAM:
Were forging a future where everyone finds their rightful place and where every voice matters. Where uniqueness isnt just accepted but embraced. Thats why we are committed to fostering the growth and development of every person, cultivating a sense of community through our Employee Resource Groups and advocating for inclusive leadership. Pure is proud to be an equal opportunity and affirmative action employer. We do not discriminate based upon race, religion, color, national origin, sex (including pregnancy, childbirth, or related medical conditions), sexual orientation, gender, gender identity, gender expression, transgender status, sexual stereotypes, age, status as a protected veteran, status as an individual with a disability, or any other characteristic legally protected by the laws of the jurisdiction in which you are being considered for hire.
JOIN US AND BRING YOUR BEST.
BRING YOUR BOLD.
BRING YOUR FLASH."
3617268,"Analytics Engineer, Singapore","https://boards.greenhouse.io/purestorage/jobs/6972637?gh_jid=6972637","storage","Singapore","No","Not specified","Full time","2025-09-23T20:25:38.449341Z","Were in an unbelievably exciting area of tech and are fundamentally reshaping the data storage industry. Here, you lead with innovative thinking, grow along with us, and join the smartest team in the industry.
This type of workwork that changes the worldis what the tech industry was founded on. So, if you're ready to seize the endless opportunities and leave your mark, come join us.About the Role
We're looking for a Analytics Engineer to join the WWSE Growth &amp; Excellence team. In this global role, youll streamline operational workflows through data automation and intelligent process design. Youll work closely with cross-functional stakeholders across Sales, Operations, and Data Engineering to drive better visibility into how technical product experiences contribute to pipeline movement and revenue generation.
What Youll Do

Build dashboards for global audiences (powered by Snowflake) to surface insights for Quarterly Business Reviews (QBRs) and Sales Briefings (QSRs).
Visualize key metrics such as usage trends, engagement levels, and conversion rates.
Maintain and scale the Customer Win Dashboard
Integrate a consultative selling value library into Pure Realize and SFDC. 
Analyze the impact of Test Drive activities on opportunity outcomes, including correlation with closed-won deals.
Identify and resolve data integrity issues between Test Drive systems and Salesforce, ensuring accurate mapping of activities to opportunities.
Develop solutions to reconcile opportunity misalignment scenarios between SFDC and Test Drive (e.g., closed and reopened deals).
Automate the manual voucher generation process for Test Drives, reducing time and error-prone tasks.

Key Responsibilities

Develop Python or API-based automations to streamline internal operations
Connect and clean data from disparate sources (Snowflake, Salesforce, Test Drive)
Build dashboards to support QBRs and executive briefings with actionable insights
Solve misalignment between Test Drive activity and opportunity attribution in Salesforce
Support data governance and accuracy across analytics workflows

What Were Looking For

Analytically minded with strong problem-solving skills.
Proficient in data analysis, automation, and visualization tools (e.g., Snowflake, SQL, Python, BI
tools).
Detail-oriented and process-driven, with a passion for improving efficiency and accuracy.
Collaborative team player who can work across functions to drive results.
Experience with Salesforce and sales operations workflows is a plus.
WHAT YOU CAN EXPECT FROM US:

Pure Innovation: We celebrate those who think critically, like a challenge and aspire to be trailblazers.
Pure Growth: We give you the space and support to grow along with us and to contribute to something meaningful. We have been Named Fortune's Best Large Workplaces in the Bay AreaTM, Fortune's Best Workplaces for MillennialsTM and certified as a Great Place to Work!
Pure Team: We build each other up and set aside ego for the greater good.

And because we understand the value of bringing your full and best self to work, we offer a variety of perks to manage a healthy balance, including flexible time off, wellness resources and company-sponsored team events. Check out purebenefits.com for more information.
ACCOMMODATIONS AND ACCESSIBILITY:
Candidates with disabilities may request accommodations for all aspects of our hiring process. For more on this, contact us at TA-Ops@purestorage.com if youre invited to an interview.
OUR COMMITMENT TO A STRONG AND INCLUSIVE TEAM:
Were forging a future where everyone finds their rightful place and where every voice matters. Where uniqueness isnt just accepted but embraced. Thats why we are committed to fostering the growth and development of every person, cultivating a sense of community through our Employee Resource Groups and advocating for inclusive leadership. Pure is proud to be an equal opportunity and affirmative action employer. We do not discriminate based upon race, religion, color, national origin, sex (including pregnancy, childbirth, or related medical conditions), sexual orientation, gender, gender identity, gender expression, transgender status, sexual stereotypes, age, status as a protected veteran, status as an individual with a disability, or any other characteristic legally protected by the laws of the jurisdiction in which you are being considered for hire.
JOIN US AND BRING YOUR BEST.
BRING YOUR BOLD.
BRING YOUR FLASH."
