"ID","Title","Link","Company","Location","Remote","Experience","EmploymentType","DatePosted","RoleDescription"
3624791,"NPI Technical Program Manager, Global Operations","https://boards.greenhouse.io/purestorage/jobs/7236380?gh_jid=7236380","storage","Santa Clara","No","Not specified","Full time","2025-09-23T20:25:38.448994Z","Were in an unbelievably exciting area of tech and are fundamentally reshaping the data storage industry. Here, you lead with innovative thinking, grow along with us, and join the smartest team in the industry.
This type of workwork that changes the worldis what the tech industry was founded on. So, if you're ready to seize the endless opportunities and leave your mark, come join us.SHOULD YOU ACCEPT THIS CHALLENGE......
As an NPI Technical Program Manager within the Operations Program Management Team, you will be a driving force for operational excellence. From concept through mass production, you will orchestrate end-to-end activities in the Global Supply Chain Organization, with a focus on technical deliverables and deep collaboration across functionsespecially with engineering. In this role, you will shape how we scale, optimize efficiencies, and support global demand.
WHAT YOU WILL BE DOING...

Define and Manage NPI Operational Strategy: Develop and drive end-to-end NPI and sustaining program/project plans within Operations, ensuring day-to-day coordination, quality assurance, and on-time delivery. Own milestones, schedules, resources, costs, risks, and technical deliverables across internal teams and contract manufacturers. Lead seamless product transitions to deliver the best technical and quality outcomes for customers while balancing quality, customer experience, time-to-market, and cost (including E&amp;O).
Lead Cross-Functional Collaboration: Serve as the central point of contact, engaging with both technical and non-technical groups across all organizational levels, including executives. Facilitate PRD/POR/DFx/Test reviews to ensure Operations requirements are incorporated in design or effectively mitigated. Provide comprehensive program visibility to stakeholders, executives, and team members through portals, dashboards, and metrics.
Drive Process and Quality Improvement: Identify and lead cross-functional initiatives to scale operational efficiency, enhance product quality, and balance customer experience with time-to-market and cost. Apply exceptional communication and collaboration skills to influence, align, and build high-trust relationships across functions.

WHAT YOU'LL BRING TO THIS ROLE:

Program Management Expertise: Proven success delivering complete engineered systemsincluding hardware, firmware, validation, and manufacturingwith high quality and predictable execution, from concept to mass production. Hands-on experience collaborating with global CM/OEM/ODM/IHV vendors through development and ramp.
Technical and Business Acumen: Inquisitive and detail-oriented, with the ability to understand, test, and challenge both technical and business requirements while working collaboratively with business and technology owners. Strong skills with modern cloud-based productivity tools.
Stakeholder Communication &amp; Customer Focus: Strong customer orientation with the ability to communicate effectively with highly technical management teams as well as non-technical stakeholders. Skilled at influencing and building high-trust relationships with cross-functional teams and executives.
Strategic Problem-Solving &amp; Leadership: Demonstrated ability to operate autonomously across multiple teams and functions, apply critical thinking, and provide thought leadership. Thrives in fast-paced, rapidly growing environments, challenges the status quo, and exercises sound judgment in executive-level escalations.

We are primarily an in-office environment and therefore, you will be expected to work from the Santa Clara office in compliance with Pures policies, unless you are on PTO, or work travel, or other approved leave.
#LI-ONSITE 
Salary ranges are determined based on role, level and location. For positions open to candidates in multiple geographical locations, the base salary range is reflective of the labor market across the applicable locations. 
This role may be eligible for incentive pay and/or equity. 
There is no application deadline and we accept applications on an ongoing basis until the job is filled.The annual base salary range is: $149,000$224,000 USDWHAT YOU CAN EXPECT FROM US:

Pure Innovation: We celebrate those who think critically, like a challenge and aspire to be trailblazers.
Pure Growth: We give you the space and support to grow along with us and to contribute to something meaningful. We have been Named Fortune's Best Large Workplaces in the Bay AreaTM, Fortune's Best Workplaces for MillennialsTM and certified as a Great Place to Work!
Pure Team: We build each other up and set aside ego for the greater good.

And because we understand the value of bringing your full and best self to work, we offer a variety of perks to manage a healthy balance, including flexible time off, wellness resources and company-sponsored team events. Check out purebenefits.com for more information.
ACCOMMODATIONS AND ACCESSIBILITY:
Candidates with disabilities may request accommodations for all aspects of our hiring process. For more on this, contact us at TA-Ops@purestorage.com if youre invited to an interview.
OUR COMMITMENT TO A STRONG AND INCLUSIVE TEAM:
Were forging a future where everyone finds their rightful place and where every voice matters. Where uniqueness isnt just accepted but embraced. Thats why we are committed to fostering the growth and development of every person, cultivating a sense of community through our Employee Resource Groups and advocating for inclusive leadership. Pure is proud to be an equal opportunity and affirmative action employer. We do not discriminate based upon race, religion, color, national origin, sex (including pregnancy, childbirth, or related medical conditions), sexual orientation, gender, gender identity, gender expression, transgender status, sexual stereotypes, age, status as a protected veteran, status as an individual with a disability, or any other characteristic legally protected by the laws of the jurisdiction in which you are being considered for hire.
JOIN US AND BRING YOUR BEST.
BRING YOUR BOLD.
BRING YOUR FLASH."
3621303,"Technical Program Manager, Data Center Deployment","https://boards.greenhouse.io/purestorage/jobs/7224804?gh_jid=7224804","storage","Santa Clara","No","Not specified","Full time","2025-09-23T20:25:38.449017Z","Were in an unbelievably exciting area of tech and are fundamentally reshaping the data storage industry. Here, you lead with innovative thinking, grow along with us, and join the smartest team in the industry.
This type of workwork that changes the worldis what the tech industry was founded on. So, if you're ready to seize the endless opportunities and leave your mark, come join us.THE ROLE
Pure is seeking a Senior Technical Program Manager to lead our data center deployment initiatives. In this high-impact role, you'll be the driving force behind the design and implementation of our next-generation data center solutions, managing a multi-million dollar budget and ensuring technical excellence. You'll partner with key stakeholders across engineering, operations, and finance to transform strategic vision into reality, while navigating complex technical requirements and mitigating risks.
WHAT YOU'LL DO

Define and manage the technical roadmap for data center deployments, from initial concept to full-scale operation, ensuring alignment with business objectives and resource allocation.
Lead cross-functional teams to define, scope, and execute on hardware and software requirements, including server types, storage, networking components, and system configurations.
Own the end-to-end project lifecycle, driving predictable and frequent software and hardware releases while maintaining high standards for quality and performance.
Oversee a multi-million dollar budget, providing clear financial oversight and making data-driven recommendations to optimize system utilization, refresh cycles, and resource pooling.
Act as the primary point of contact for all technical and logistical aspects of deployment, communicating effectively with both technical and non-technical audiences to ensure project success.

WHAT YOU BRING

Demonstrated experience leading large-scale technical programs, with a proven track record of managing complex projects with significant budget and resource dependencies.
Deep technical understanding of data center infrastructure, including hardware, software, and networking concepts.
Strong analytical and problem-solving skills, with the ability to identify and mitigate risks proactively.
Exceptional communication skills, capable of influencing and collaborating with diverse teams and stakeholders to achieve shared goals.
Ability to take full ownership of program outcomes, driving quality, defining metrics, and championing best practices across the organization.


We are primarily an in-office environment and therefore, you will be expected to work from the Santa Clara, CA office in compliance with Pures policies, unless you are on PTO, or work travel, or other approved leave.

{INCLUDE ONE OF THE BELOW FOR POSTING LOCATION IDENTIFICATION}
  #LI-ONSITE 
Salary ranges are determined based on role, level and location. For positions open to candidates in multiple geographical locations, the base salary range is reflective of the labor market across the applicable locations. 
This role may be eligible for incentive pay and/or equity. 
There is no application deadline and we accept applications on an ongoing basis until the job is filled.The annual base salary range is: $136,000$234,000 USDWHAT YOU CAN EXPECT FROM US:

Pure Innovation: We celebrate those who think critically, like a challenge and aspire to be trailblazers.
Pure Growth: We give you the space and support to grow along with us and to contribute to something meaningful. We have been Named Fortune's Best Large Workplaces in the Bay AreaTM, Fortune's Best Workplaces for MillennialsTM and certified as a Great Place to Work!
Pure Team: We build each other up and set aside ego for the greater good.

And because we understand the value of bringing your full and best self to work, we offer a variety of perks to manage a healthy balance, including flexible time off, wellness resources and company-sponsored team events. Check out purebenefits.com for more information.
ACCOMMODATIONS AND ACCESSIBILITY:
Candidates with disabilities may request accommodations for all aspects of our hiring process. For more on this, contact us at TA-Ops@purestorage.com if youre invited to an interview.
OUR COMMITMENT TO A STRONG AND INCLUSIVE TEAM:
Were forging a future where everyone finds their rightful place and where every voice matters. Where uniqueness isnt just accepted but embraced. Thats why we are committed to fostering the growth and development of every person, cultivating a sense of community through our Employee Resource Groups and advocating for inclusive leadership. Pure is proud to be an equal opportunity and affirmative action employer. We do not discriminate based upon race, religion, color, national origin, sex (including pregnancy, childbirth, or related medical conditions), sexual orientation, gender, gender identity, gender expression, transgender status, sexual stereotypes, age, status as a protected veteran, status as an individual with a disability, or any other characteristic legally protected by the laws of the jurisdiction in which you are being considered for hire.
JOIN US AND BRING YOUR BEST.
BRING YOUR BOLD.
BRING YOUR FLASH."
3621300,"System Software Engineer (C++)","https://boards.greenhouse.io/purestorage/jobs/7174478?gh_jid=7174478","storage","Prague, Czech Republic","No","Not specified","Full time","2025-09-23T20:25:38.449067Z","Were in an unbelievably exciting area of tech and are fundamentally reshaping the data storage industry. Here, you lead with innovative thinking, grow along with us, and join the smartest team in the industry.
This type of workwork that changes the worldis what the tech industry was founded on. So, if you're ready to seize the endless opportunities and leave your mark, come join us.Our customers rely on our products, FlashArray and FlashBlade, for effortless management, relentless innovation, and the gold standard in reliability. As we expand our capabilities into the cloud with services like CloudSnap and Cloud Block Store for AWS, we are solving the complex problem of uniting on-premises performance with public cloud agility. This is a unique opportunity to work on a platform that is both mission-critical and at the forefront of the industry.
Our engineering teams are at the heart of this innovation. We don't just write code; we own the end-to-end development of new features that define our product roadmap. Whether you're looking to take ownership of a new feature, drive the technical direction of a major project, or tackle our most challenging architectural problems, you will have the opportunity to make a massive impact. Our teams collaborate closely across functions and locations to ensure our work directly aligns with customer needs and redefines what's possible in cloud-native applications.
WHAT YOU'LL DO

Take end-to-end ownership of features, from initial concept through development and deployment.
Collaborate with cross-functional teams and product management to ensure features meet customer needs.
Drive technical direction by representing the team in technical leadership meetings and sharing expertise.
Analyze and solve challenging technical problems while maintaining the highest quality standards.
Focus on customer satisfaction by delivering valuable solutions and embracing continuous learning within a supportive team environment.
We are primarily an in-office environment and therefore, you will be expected to work from the Prague office in compliance with Pures policies, unless you are on PTO, or work travel, or other approved leave.

WHAT YOU BRING

Proven experience working with C++ in a professional or academic setting.
Proficiency in a systems software domain, which may include distributed systems, operating systems, Linux kernel, database internals, hypervisors, containers, or compiler optimization.
Familiarity with another programming language, such as Java, Python, or Go.
Strong communication skills and the ability to articulate technical concepts to a team.
A proactive engineering approach with a focus on problem-solving and clean, maintainable code.
A demonstrated design sensibility and a collaborative approach to problem-solving.

#LI-ONSITEWHAT YOU CAN EXPECT FROM US:

Pure Innovation: We celebrate those who think critically, like a challenge and aspire to be trailblazers.
Pure Growth: We give you the space and support to grow along with us and to contribute to something meaningful. We have been Named Fortune's Best Large Workplaces in the Bay AreaTM, Fortune's Best Workplaces for MillennialsTM and certified as a Great Place to Work!
Pure Team: We build each other up and set aside ego for the greater good.

And because we understand the value of bringing your full and best self to work, we offer a variety of perks to manage a healthy balance, including flexible time off, wellness resources and company-sponsored team events. Check out purebenefits.com for more information.
ACCOMMODATIONS AND ACCESSIBILITY:
Candidates with disabilities may request accommodations for all aspects of our hiring process. For more on this, contact us at TA-Ops@purestorage.com if youre invited to an interview.
OUR COMMITMENT TO A STRONG AND INCLUSIVE TEAM:
Were forging a future where everyone finds their rightful place and where every voice matters. Where uniqueness isnt just accepted but embraced. Thats why we are committed to fostering the growth and development of every person, cultivating a sense of community through our Employee Resource Groups and advocating for inclusive leadership. Pure is proud to be an equal opportunity and affirmative action employer. We do not discriminate based upon race, religion, color, national origin, sex (including pregnancy, childbirth, or related medical conditions), sexual orientation, gender, gender identity, gender expression, transgender status, sexual stereotypes, age, status as a protected veteran, status as an individual with a disability, or any other characteristic legally protected by the laws of the jurisdiction in which you are being considered for hire.
JOIN US AND BRING YOUR BEST.
BRING YOUR BOLD.
BRING YOUR FLASH."
3621299,"Supply Chain Manager ","https://boards.greenhouse.io/purestorage/jobs/7081480?gh_jid=7081480","storage","Houston","No",7,"Full time","2025-09-23T20:25:38.449095Z","Were in an unbelievably exciting area of tech and are fundamentally reshaping the data storage industry. Here, you lead with innovative thinking, grow along with us, and join the smartest team in the industry.
This type of workwork that changes the worldis what the tech industry was founded on. So, if you're ready to seize the endless opportunities and leave your mark, come join us.SHOULD YOU ACCEPT THIS CHALLENGE...
We are seeking a Global Supply Chain Manager to drive Global operations for Manufacturing.  In this highly collaborative role, you will be responsible for ensuring operational readiness, execution excellence, and supply continuity while managing escalations, risk mitigation, and planning activities across our Contract Manufacturer (CM) network.You will partner closely with internal cross-functional teams, including NPI, Quality, Test, Engineering, Planning and Logisticsas well as external suppliers and CM's, to support both New Product Introduction (NPI) and sustaining operations. 
WHAT YOULL BE DOING... 

Drive the end-to-end supply chain execution for production activities, ensuring continuity of supply to meet revenue and operational targets.
Identify and mitigate operational risks across Supply Chain Operations and Manufacturing
Collaborate with CMs to enhance operational excellence, focusing on key performance indicators (KPIs) such as yield, on-time delivery, inventory management, and cost reduction.
Develop and monitor KPIs to track efficiency and performance, aiming to reduce supply risks.
Participate in process improvement initiatives and document best practices across Manufacturing and operations. 
Serve as the primary point of contact for CM, supply chain execution activities, escalation management, and  ensure continuity of supply.
Managing readiness to produce products according to schedule/forecast by overseeing Clear to Build (CTB) processes.
Develop production strategies for new product introductions (NPI) through end-of-life (EOL) that ensure an optimal balance between supply and demand
Reviewing, developing, and updating internal processes and those with CMs.
Being a problem-solver and recommending improvements across various departments (CM, Supply Chain Operations, Quality, Engineering, Finance)
Monitor supply and demand variability and develop effective strategies to mitigate potential material risks.

WHAT YOULL NEED TO BRING TO THIS ROLE...

BA/BS degree in relevant areas like Supply Chain, Manufacturing, Operations, Business, Economics, or Engineering.
7+ years of experience in Supply Chain Management, Manufacturing Operations
Strong background in Contract Manufacturing and Operational leadership, with a focus on both Production and MRP systems (Bills of Materials, shortages, sales orders, purchase orders).
Excellent problem-solving skills, critical thinking, and ability to navigate ambiguity.
Strong communication and cross-functional collaboration skills across Global teams.
Ability to drive operational improvements, risk mitigation, and process optimization initiatives in a dynamic, fast-paced environment.
Demonstrated ability to develop and implement effective supply chain processes and strategies.
Tech-savvy with ERP, Tableau, and advanced skills in MS Suite (Excel, PowerPoint, Access).
Great problem-solving, team-building, and leadership skills
Strong analytical and data analysis skills. 
Capability to manage multiple projects and priorities effectively.
We are primarily an in-office environment and therefore, you will be expected to work out of our partners factory located in Houston office in compliance with Pures policies, unless you are on PTO, or work travel, or other approved leave.

#LI-ONSITE 
Salary ranges are determined based on role, level and location. For positions open to candidates in multiple geographical locations, the base salary range is reflective of the labor market across the applicable locations. 
This role may be eligible for incentive pay and/or equity. 
There is no application deadline and we accept applications on an ongoing basis until the job is filled.The annual base salary range is: $108,000$164,000 USDWHAT YOU CAN EXPECT FROM US:

Pure Innovation: We celebrate those who think critically, like a challenge and aspire to be trailblazers.
Pure Growth: We give you the space and support to grow along with us and to contribute to something meaningful. We have been Named Fortune's Best Large Workplaces in the Bay AreaTM, Fortune's Best Workplaces for MillennialsTM and certified as a Great Place to Work!
Pure Team: We build each other up and set aside ego for the greater good.

And because we understand the value of bringing your full and best self to work, we offer a variety of perks to manage a healthy balance, including flexible time off, wellness resources and company-sponsored team events. Check out purebenefits.com for more information.
ACCOMMODATIONS AND ACCESSIBILITY:
Candidates with disabilities may request accommodations for all aspects of our hiring process. For more on this, contact us at TA-Ops@purestorage.com if youre invited to an interview.
OUR COMMITMENT TO A STRONG AND INCLUSIVE TEAM:
Were forging a future where everyone finds their rightful place and where every voice matters. Where uniqueness isnt just accepted but embraced. Thats why we are committed to fostering the growth and development of every person, cultivating a sense of community through our Employee Resource Groups and advocating for inclusive leadership. Pure is proud to be an equal opportunity and affirmative action employer. We do not discriminate based upon race, religion, color, national origin, sex (including pregnancy, childbirth, or related medical conditions), sexual orientation, gender, gender identity, gender expression, transgender status, sexual stereotypes, age, status as a protected veteran, status as an individual with a disability, or any other characteristic legally protected by the laws of the jurisdiction in which you are being considered for hire.
JOIN US AND BRING YOUR BEST.
BRING YOUR BOLD.
BRING YOUR FLASH."
