"ID","Title","Link","Company","Location","Remote","Experience","EmploymentType","DatePosted","RoleDescription"
3636676,"Senior Pre-Sales Systems Engineer, Enterprise - Chicago","https://boards.greenhouse.io/purestorage/jobs/7261155?gh_jid=7261155","storage","Chicago","Yes",5,"Full time","2025-09-23T20:25:38.448740Z","Were in an unbelievably exciting area of tech and are fundamentally reshaping the data storage industry. Here, you lead with innovative thinking, grow along with us, and join the smartest team in the industry.
This type of workwork that changes the worldis what the tech industry was founded on. So, if you're ready to seize the endless opportunities and leave your mark, come join us.THE ROLE:
Are you passionate about driving innovation in the data storage industry? Are you skilled in crafting technical solutions that exceed customer expectations? If so, we have an exciting opportunity for you! Pure Storage, a leader in the data storage and flash technology space, is seeking a talented and motivated Pre-Sales Systems Engineer to join our dynamic team. 
As a Senior Pre-Sales Systems Engineer, you will play a crucial role in understanding our customers' unique challenges and tailoring Pure Storage solutions to meet their specific needs. Collaborating closely with the sales team, you will act as a technical expert during the sales process, helping to showcase the value of our products and services.
WHAT YOU'LL DO:

Develop an exhaustive understanding of what drives a customers business and what motivates their decision making
Connect the dots from technology solutions, inclusive of the Pure Storage portfolio and others from the ecosystem, to measurable customer business outcomes
Partner closely with account managers, specialists and channel partners to create a seamless and holistic customer experience and strategy to drive revenue growth and net new business
Passionately bring to light the advantages of a Pure Storage solution
Delight customers and teammates with your technical leadership and domain expertise on storage products, distributed storage architectures, file systems, and competitive storage offerings in the DAS, NAS and SAN product spaces
Take control of evaluations,  benchmarks and system configurations
Build and deliver technical product and architecture presentations with vigor to customers and lock in the technical win with clients and prospective accounts
Capture requirements and translate Customers business needs into innovative solutions to accelerate their growth and capacity
Contribute significant portions and/or lead responses to RFPs, RFQs and RFIs
Seek out and spur new opportunities for interoperability, functional, and performance testing/validation
Promote mutual roadmap and planning exchanges
Liaise with product and technical marketing to produce materials (i.e. whitepaper, web presentations) that support overall alliance plans and objectives
Stay current with the competition and ensure that materials accurately reflect the latest, differentiated solution positioning
Move with market trends and competitive landscape to promote thought leadership within our organization
Lead by example living the Pure Values:  Persistence, Creativity, Teamwork, Ownership and Customer-first  

WHAT YOU BRING:

BS in CS, EE or other technical degree and/or equivalent experience
Pre-sales experience is required
5 or more years of relevant experience, mixed among technology, design, and communications required. Experience supporting the sales of enterprise storage, networking, systems, cloud, or software to enterprise accounts preferred
Deep understanding of the architecture, design and implementation of multi-tiered client/server and web-based computing solutions
Must have a familiarity with modern web architecture a plus (LAMP stack, scale-out vs scale-up architectures, AWS well-architected framework, microservices architecture)
Prior experience in targeting new prospects and converting them into clients
Contribute significant portions and/or lead responses to RFPs, RFQs and RFIs
Superior knowledge of current and emerging storage architectures (FC, iSCSI, NAS, OSD, SAN)
Previous experience with Linux, NFS file systems and Linux distributed network environment
Installation/configuration of distributed computing, multiprocessing, virtual memory subsystem, storage subsystems architecture, shared memory architectures, cache architectures, windowing systems
Strong knowledge of digital transformation to a Cloud Native architecture, On-Prem, Public Cloud, Provisioning Automation, and Containers
Knowledge of VMware, Local Area Networking, Ethernet, TCP/IP and general networking
Familiarity with AWS, Azure, GCP a plus
Familiarity with containers, k8s and microservices architectures a plus
Curiosity and passion around technology and explaining and showing new technology platforms and concepts to customers
Familiarity with storage-intensive applications and their requirements such as structured databases (SQL, Oracle) is highly desirable
Excellent verbal and written interpersonal skills

#LI-REMOTE
#LI-JL4 
Salary ranges are determined based on role, level and location. For positions open to candidates in multiple geographical locations, the base salary range is reflective of the labor market across the applicable locations. 
This role may be eligible for incentive pay and/or equity. 
There is no application deadline and we accept applications on an ongoing basis until the job is filled.The annual base salary range is: $137,200$206,500 USDWHAT YOU CAN EXPECT FROM US:

Pure Innovation: We celebrate those who think critically, like a challenge and aspire to be trailblazers.
Pure Growth: We give you the space and support to grow along with us and to contribute to something meaningful. We have been Named Fortune's Best Large Workplaces in the Bay AreaTM, Fortune's Best Workplaces for MillennialsTM and certified as a Great Place to Work!
Pure Team: We build each other up and set aside ego for the greater good.

And because we understand the value of bringing your full and best self to work, we offer a variety of perks to manage a healthy balance, including flexible time off, wellness resources and company-sponsored team events. Check out purebenefits.com for more information.
ACCOMMODATIONS AND ACCESSIBILITY:
Candidates with disabilities may request accommodations for all aspects of our hiring process. For more on this, contact us at TA-Ops@purestorage.com if youre invited to an interview.
OUR COMMITMENT TO A STRONG AND INCLUSIVE TEAM:
Were forging a future where everyone finds their rightful place and where every voice matters. Where uniqueness isnt just accepted but embraced. Thats why we are committed to fostering the growth and development of every person, cultivating a sense of community through our Employee Resource Groups and advocating for inclusive leadership. Pure is proud to be an equal opportunity and affirmative action employer. We do not discriminate based upon race, religion, color, national origin, sex (including pregnancy, childbirth, or related medical conditions), sexual orientation, gender, gender identity, gender expression, transgender status, sexual stereotypes, age, status as a protected veteran, status as an individual with a disability, or any other characteristic legally protected by the laws of the jurisdiction in which you are being considered for hire.
JOIN US AND BRING YOUR BEST.
BRING YOUR BOLD.
BRING YOUR FLASH."
3636675,"Java Software Engineer","https://boards.greenhouse.io/purestorage/jobs/7171379?gh_jid=7171379","storage","Prague, Czech Republic","No","Not specified","Full time","2025-09-23T20:25:38.448755Z","Were in an unbelievably exciting area of tech and are fundamentally reshaping the data storage industry. Here, you lead with innovative thinking, grow along with us, and join the smartest team in the industry.
This type of workwork that changes the worldis what the tech industry was founded on. So, if you're ready to seize the endless opportunities and leave your mark, come join us.THE ROLE
We are seeking a Java Software Engineer to join our engineering team. You will be responsible for designing, developing, and maintaining high-quality applications using Java and related technologies. You will work closely with cross-functional teams to deliver scalable, reliable, and performant solutions that align with our organizational standards.
WHAT YOU'LL DO

Design and implement innovative features and technologies that drive high-performance, reliable virtualization integrations.
Own and deliver FlashArray virtualization plugins end-to-end, from initial concept through to production release.
Analyze and solve complex challenges across virtualization platforms with a focus on simplicity and scalability.
Collaborate with talented peers, contributing to and drawing inspiration from a highly skilled, team-oriented environment.
Delight customers by enabling seamless FlashArray integration into their virtualization environments.
Continuously learn and grow, whether building on existing knowledge or gaining new expertise in virtualization, storage, or system software.
We are primarily an in-office environment and therefore, you will be expected to work from the Prague office in compliance with Pures policies, unless you are on PTO, or work travel, or other approved leave

WHAT YOU BRING

Experience across all phases of the software product lifecycle (concept, product definition, MVP, launch, mature product support)
Proficiency in Java, with openness to work/learn Go, Python, and/or C++.
Background in enterprise environments, cloud platforms, or large-scale deployments, with knowledge of embedded programming or storage systems as a plus.
Strong collaboration and communication skills, with the ability to share ideas effectively across teams and roles.
A natural curiosity, design sensibility, and enthusiasm for working in an open, team-oriented environment.
WHAT YOU CAN EXPECT FROM US:

Pure Innovation: We celebrate those who think critically, like a challenge and aspire to be trailblazers.
Pure Growth: We give you the space and support to grow along with us and to contribute to something meaningful. We have been Named Fortune's Best Large Workplaces in the Bay AreaTM, Fortune's Best Workplaces for MillennialsTM and certified as a Great Place to Work!
Pure Team: We build each other up and set aside ego for the greater good.

And because we understand the value of bringing your full and best self to work, we offer a variety of perks to manage a healthy balance, including flexible time off, wellness resources and company-sponsored team events. Check out purebenefits.com for more information.
ACCOMMODATIONS AND ACCESSIBILITY:
Candidates with disabilities may request accommodations for all aspects of our hiring process. For more on this, contact us at TA-Ops@purestorage.com if youre invited to an interview.
OUR COMMITMENT TO A STRONG AND INCLUSIVE TEAM:
Were forging a future where everyone finds their rightful place and where every voice matters. Where uniqueness isnt just accepted but embraced. Thats why we are committed to fostering the growth and development of every person, cultivating a sense of community through our Employee Resource Groups and advocating for inclusive leadership. Pure is proud to be an equal opportunity and affirmative action employer. We do not discriminate based upon race, religion, color, national origin, sex (including pregnancy, childbirth, or related medical conditions), sexual orientation, gender, gender identity, gender expression, transgender status, sexual stereotypes, age, status as a protected veteran, status as an individual with a disability, or any other characteristic legally protected by the laws of the jurisdiction in which you are being considered for hire.
JOIN US AND BRING YOUR BEST.
BRING YOUR BOLD.
BRING YOUR FLASH."
3636674,"Engineering Manager, Self-Service Upgrades","https://boards.greenhouse.io/purestorage/jobs/7259520?gh_jid=7259520","storage","Prague, Czech Republic","No","Not specified","Full time","2025-09-23T20:25:38.448770Z","Were in an unbelievably exciting area of tech and are fundamentally reshaping the data storage industry. Here, you lead with innovative thinking, grow along with us, and join the smartest team in the industry.
This type of workwork that changes the worldis what the tech industry was founded on. So, if you're ready to seize the endless opportunities and leave your mark, come join us.THE ROLE Were looking for an Engineering Manager to lead our Self Service Upgrade (SSU) team in Praguea group driving one of Pure Storages top company-wide priorities. This team owns the full customer-facing workflow for upgrading operating systems on on-premise devices, making a direct impact on customer experience and company success. Youll collaborate across business units, guide a talented mix of backend and frontend engineers, and shape the way Pure delivers at scale. This is a high-visibility role where your leadership will enable long-term initiatives across the company.
WHAT YOULL DO

Lead and grow a team of engineers, fostering a culture of innovation, ownership, and adaptability in a dynamic environment.
Drive delivery of the full-stack SSU workflowfrom planning with product and design, to execution on physical customer devices, to quality reporting and success measurement.
Partner closely with Product Management, UX, QA, and other engineering teams across Pure to align dependencies and deliver on company-wide strategic goals.
Ensure production stability and customer satisfaction through proactive issue management, continuous delivery practices, and timely response to feedback loops.
Shape the future of the SSU team by evolving processes, priorities, and capabilities to meet expanding scope and business impact.

WHAT YOU BRING

Proven experience leading software engineering teams, with a solid foundation in software development and delivery of cloud-based, customer-facing products.
Demonstrated ability to manage projects end-to-end through the SDLC, balancing priorities, scope, and capacity while meeting commitments.
Commitment to customer success with the ability to navigate production issues, ensuring reliability and continuous improvement.
Excellent problem-solving and communication skills, with the flexibility to adapt quickly to changing requirements and environments.
We are primarily an in-office environment and therefore, you will be expected to work from the Prague office in compliance with Pures policies, unless you are on PTO, or work travel, or other approved leave.

#LI-ONSITEWHAT YOU CAN EXPECT FROM US:

Pure Innovation: We celebrate those who think critically, like a challenge and aspire to be trailblazers.
Pure Growth: We give you the space and support to grow along with us and to contribute to something meaningful. We have been Named Fortune's Best Large Workplaces in the Bay AreaTM, Fortune's Best Workplaces for MillennialsTM and certified as a Great Place to Work!
Pure Team: We build each other up and set aside ego for the greater good.

And because we understand the value of bringing your full and best self to work, we offer a variety of perks to manage a healthy balance, including flexible time off, wellness resources and company-sponsored team events. Check out purebenefits.com for more information.
ACCOMMODATIONS AND ACCESSIBILITY:
Candidates with disabilities may request accommodations for all aspects of our hiring process. For more on this, contact us at TA-Ops@purestorage.com if youre invited to an interview.
OUR COMMITMENT TO A STRONG AND INCLUSIVE TEAM:
Were forging a future where everyone finds their rightful place and where every voice matters. Where uniqueness isnt just accepted but embraced. Thats why we are committed to fostering the growth and development of every person, cultivating a sense of community through our Employee Resource Groups and advocating for inclusive leadership. Pure is proud to be an equal opportunity and affirmative action employer. We do not discriminate based upon race, religion, color, national origin, sex (including pregnancy, childbirth, or related medical conditions), sexual orientation, gender, gender identity, gender expression, transgender status, sexual stereotypes, age, status as a protected veteran, status as an individual with a disability, or any other characteristic legally protected by the laws of the jurisdiction in which you are being considered for hire.
JOIN US AND BRING YOUR BEST.
BRING YOUR BOLD.
BRING YOUR FLASH."
3632539,"Manager, Systems Engineering, Greater China","https://boards.greenhouse.io/purestorage/jobs/7241725?gh_jid=7241725","storage","Admiralty, Hong Kong","No","Not specified","Full time","2025-09-23T20:25:38.448784Z","Were in an unbelievably exciting area of tech and are fundamentally reshaping the data storage industry. Here, you lead with innovative thinking, grow along with us, and join the smartest team in the industry.
This type of workwork that changes the worldis what the tech industry was founded on. So, if you're ready to seize the endless opportunities and leave your mark, come join us.The Systems Engineering Manager, Greater China role blends technical pre-sales leadership with regional strategy and customer advocacy for Greater China. Success comes from developing top-tier technical teams, adapting solutions to regional requirements, and building trusted relationships with local customers and partnersall while maintaining Pure Storages brand and operational standards.
Job Description Summary
Role Overview
The Systems Engineering Manager, Greater China will leads a team of Systems Engineers focused on enabling pre-sales technical success with customers, partners, and prospects throughout Mainland China, Hong Kong, and Taiwan. This role balances technical leadership, strategic market adaptation, and driving business through hands-on customer engagement.
Key Responsibilities

Technical Leadership:Coach, mentor, and develop the System Engineering team to deliver expert technical guidance on Pure Storage solutions, ensuring consistent quality across all engagements.Drive ongoing technical enablementkeeping the team updated on new products, competitive positioning, and architecture trends relevant to Greater China.Lead complex solution design, proof of concept, and technical deep-dives for strategic accounts.



Customer Engagement &amp; Advocacy:Build trusted relationships with enterprise customers and partners by understanding their business objectives, technical requirements, and regional IT ecosystem nuances.Champion the voice of the customer internally, advocating for features, product improvements, or local compliance needs. Support sales and marketing activities through technical presentations, workshops, and tailored solution demonstrationsoften in Mandarin or Cantonese.


Market Adaptation &amp; Regional Strategy:Assess the Greater China storage and cloud landscape, adapting Pure Storage offerings and messaging to suit regional market trends, regulatory requirements, and competitive pressures.Ensure the team aligns with local business practices and effectively positions Pure Storage technology for the unique needs of Greater China customers.


Cross-Functional Collaboration:Collaborate closely with Sales, Marketing, Channel Partners, and Product Management to drive growth strategies and ensure technical alignment for major opportunities and launches in the region.Partner with Global and Regional System Engineering leadership to share best practices, coordinate enablement efforts, and localize collateral for Greater China.


Operational Excellence:Set performance goals, manage pipeline activity, and forecast resource needs across the SE team. Foster a culture of diversity, inclusion, and continuous improvement.Ensure compliance with all local business, legal, and Pure Storage brand policies.


Required Skills &amp; Experience

Demonstrated technical sales leadership experienceideally in storage, cloud, or enterprise softwareserving Greater China customers.
Proven ability to coach and build high-performing SE teams in a multi-country, cross-language environment (Mandarin/Cantonese/English fluency desirable).
Deep understanding of local IT infrastructure, cloud adoption, and storage trends in Greater China.
Strong customer-facing and presentation skills, able to tailor messages for executives and technical audiences.
Experience working with channel partners, system integrators, and distributors in the region.
Bachelors degree or higher in computer science, engineering, or related field.

You will be based in our Hong Kong office. As this is an office-centric role, you are expected to be present in the office for 3 days a week. As outlined in Pure's Hybrid Work Policy, there will be variations over periods of time, depending on business need.WHAT YOU CAN EXPECT FROM US:

Pure Innovation: We celebrate those who think critically, like a challenge and aspire to be trailblazers.
Pure Growth: We give you the space and support to grow along with us and to contribute to something meaningful. We have been Named Fortune's Best Large Workplaces in the Bay AreaTM, Fortune's Best Workplaces for MillennialsTM and certified as a Great Place to Work!
Pure Team: We build each other up and set aside ego for the greater good.

And because we understand the value of bringing your full and best self to work, we offer a variety of perks to manage a healthy balance, including flexible time off, wellness resources and company-sponsored team events. Check out purebenefits.com for more information.
ACCOMMODATIONS AND ACCESSIBILITY:
Candidates with disabilities may request accommodations for all aspects of our hiring process. For more on this, contact us at TA-Ops@purestorage.com if youre invited to an interview.
OUR COMMITMENT TO A STRONG AND INCLUSIVE TEAM:
Were forging a future where everyone finds their rightful place and where every voice matters. Where uniqueness isnt just accepted but embraced. Thats why we are committed to fostering the growth and development of every person, cultivating a sense of community through our Employee Resource Groups and advocating for inclusive leadership. Pure is proud to be an equal opportunity and affirmative action employer. We do not discriminate based upon race, religion, color, national origin, sex (including pregnancy, childbirth, or related medical conditions), sexual orientation, gender, gender identity, gender expression, transgender status, sexual stereotypes, age, status as a protected veteran, status as an individual with a disability, or any other characteristic legally protected by the laws of the jurisdiction in which you are being considered for hire.
JOIN US AND BRING YOUR BEST.
BRING YOUR BOLD.
BRING YOUR FLASH."
