"ID","Title","Link","Company","Location","Remote","Experience","EmploymentType","DatePosted","RoleDescription"
3648898,"Communications and PR Intern","https://jobs.smartrecruiters.com/NBCUniversal3/744000083433223-communications-and-pr-intern","universal","Sydney","No","Not specified","Internship","2025-09-23T20:25:24.733675Z","Reporting to the Director of PR and Communications you will be integral in assisting the team with external communications and PR across the lifestyle, entertainment and family portfolio of channels in the region, including Bravo, DreamWorks, Studio Universal and NBCUniversals all reality streaming service Hayu.Responsibilities:Working alongside the team to develop external communications across our portfolio of brands, promoting new and exciting shows and/or channels.Collating press clippings and tracking all media coverage for brands and priority series.  Assisting and compiling internal PR coverage reports and decks.Managing media contact lists and ensuring they are kept up to date with media movements.Tracking industry trends and relevant talent movements.Working with programming and our global PR teams to assist with the creation and distribution of the monthly programming highlights, sent to media.Asset delivery, including images, screeners and interview requests for media, affiliates and PR agencies.Assisting with red carpet opportunities for our 7Bravo host on upcoming film releases.  Writing and tailoring international media releases for the local market.Targeting media outlets and developing pitches to secure coverage to promote programming priorities. Talent support, including interviews, on-ground shoots and red-carpet events.Assist with raising POs and finance trackingSupport to the APAC MD office on corporate communications and business development projectsBasic RequirementsProficient in MS PowerPoint, Word, Outlook and ExcelExcellent attention to detailWell organized with great prioritization skillsAbility to take initiative and work independentlyExcellent communication and a great team playerPassionate about PR, media, entertainment and the television/film industry.A people person with an optimistic approach and can-do attitudeThis part time role requires a 9-month commitment, from February 2026 - November 2026You also MUST include a cover letter stating the month and year you graduate, why you would like to work for NBCUniversal, and what you feel you can bring to the role.  This is an integral of the application processDesired CharacteristicsCurrently undertaking university study in Communications/PRAn interest in working in media and developing a career within the broadcast and entertainment industryAustralian Citizen or Permanent ResidentVisa sponsorship is not available for this positionPlease note that future visa sponsorship at NBCUniversal is rarely available for post-graduate employment opportunities.As part of our selection process, external candidates may be required to attend an in-person interview with an NBCUniversal employee at one of our locations prior to a hiring decision. NBCUniversal's policy is to provide equal employment opportunities to all applicants and employees without regard to race, color, religion, creed, gender, gender identity or expression, age, national origin or ancestry, citizenship, disability, sexual orientation, marital status, pregnancy, veteran status, membership in the uniformed services, genetic information, or any other basis protected by applicable law.If you are a qualified individual with a disability or a disabled veteran and require support throughout the application and/or recruitment process as a result of your disability, you have the right to request a reasonable accommodation. You can submit your request to AccessibilitySupport@nbcuni.com."
3648897,"Publicity and Partnership Intern - NZ","https://jobs.smartrecruiters.com/NBCUniversal3/744000083433296-publicity-and-partnership-intern-nz","universal","Auckland","No","Not specified","Internship","2025-09-23T20:25:24.733700Z","General/Team Support:Report into the Publicity, Partnerships &amp; Social Manager.Supports the wider team as required.Reception duties one day per week.Admin / Marketing Duties:Attend weekly WIPsActively contribute to campaign ideas and brainstormsAttend film screenings on an ad hoc basisAssist in pulling together presentations for both internal and head-office stakeholdersFirst drafts of creative copy pointers and social co-opProof-reading documentsUndertake any research needed for a campaignGeneral administrative assistance as requiredAssist with SAP and POsPublicity:Chasing and collating proof of in-market advertising, social coverage, and reviews from critics, media, and influencers.Compile post-campaign wrap reports; writing an overview and adding POPs.Coordinate influencer gifting from ideation through to execution.Assist with Preview Screening/Premiere planning and execution.Assist with Junket preparations for approved outlets on a film-by-film basis.Other duties as requested.Partnerships: Chasing and collating proof of in-market partnership activity across digital, social, in-store, and activations.Brainstorm and help with the implementation of partnerships concepts and rollout.Compile post-campaign wrap reports upon the conclusion of each partnership.Other duties as requested.Social:Assist with populating our owned channel social calendars.Brainstorm bespoke social content for use across owned social channels.Other duties as requested.Basic RequirementProficient in MS PowerPoint, Word, Outlook and ExcelAdobe Photoshop or Canva experience would be advantageousExcellent attention to detailWell organized with great prioritization skillsAbility to take initiative and work independentlyExcellent communication and a great team playerCreativeThis part time role requires a 9-month commitment, from February 2026 - November 2026You also MUST include a cover letter stating the month and year you graduate, why you would like to work for NBCUniversal, and what you feel you can bring to the role.  This is an integral of the application processDesired CharacteristicsPassionate about the film &amp; moviesCurrently undertaking university study in a marketing-based disciplineNew Zealand Citizen or Permanent ResidentVisa sponsorship is not available for this positionPlease note that future visa sponsorship at NBCUniversal is rarely available for post-graduate employment opportunities.As part of our selection process, external candidates may be required to attend an in-person interview with an NBCUniversal employee at one of our locations prior to a hiring decision. NBCUniversal's policy is to provide equal employment opportunities to all applicants and employees without regard to race, color, religion, creed, gender, gender identity or expression, age, national origin or ancestry, citizenship, disability, sexual orientation, marital status, pregnancy, veteran status, membership in the uniformed services, genetic information, or any other basis protected by applicable law.If you are a qualified individual with a disability or a disabled veteran and require support throughout the application and/or recruitment process as a result of your disability, you have the right to request a reasonable accommodation. You can submit your request to AccessibilitySupport@nbcuni.com."
3648896,"Franchise Retail Marketing Intern - SEAI","https://jobs.smartrecruiters.com/NBCUniversal3/744000083432441-franchise-retail-marketing-intern-seai","universal","Sydney","No","Not specified","Internship","2025-09-23T20:25:24.733724Z","Reporting into the Director Commercial  Agent Markets SEAI, the Franchise and Retail Marketing Intern for Southeast Asia and India (SEAI) will support our licensees, retailers and agent activities across the region.Lead local and regional marketing approvals across retail, mall and licensee submissionsLocalise global social content for our regions in partnership with Southeast Asia agentMaintain updated sales materials including brand decks, sales sheets and welcome packsCreate regular E-Newsletters for external partners with franchise and retail updatesAssist with key trade events through managing invite lists, product samples and presentationsAssist with tracking changing trends in the region on digital, broadcast/content, retail and competitive landscapeMaintain databases, spreadsheets and tracking documents liaising internally and externally where requiredSharing best practice inspiration with agentsAssist with the preparation of targeted pitch presentations for potential partners and retailersHelp with other adhoc tasks as required to support the teamPresentation of project to the management team at the end of internshipBasic RequirementsProficient in MS Outlook, PowerPoint and ExcelProficient in Adobe Creative Suite with a focus on Illustrator and PhotoshopDetail oriented and organised, with exceptional prioritisation skillsAble to work under pressure and tight deadlinesAbility to take initiative and work independentlyExcellent communication and a great team playerThis part time role requires a 9-month commitment, from February 2026 - November 2026You also MUST include a cover letter stating the month and year you graduate, why you would like to work for NBCUniversal, and what you feel you can bring to the role.  This is an integral of the application processDesired CharacteristicsCompleting a degree in Business, Marketing, or CommunicationsAustralian Citizen or Permanent ResidentVisa sponsorship is not available for this positionPlease note that future visa sponsorship at NBCUniversal is rarely available for post-graduate employment opportunities.As part of our selection process, external candidates may be required to attend an in-person interview with an NBCUniversal employee at one of our locations prior to a hiring decision. NBCUniversal's policy is to provide equal employment opportunities to all applicants and employees without regard to race, color, religion, creed, gender, gender identity or expression, age, national origin or ancestry, citizenship, disability, sexual orientation, marital status, pregnancy, veteran status, membership in the uniformed services, genetic information, or any other basis protected by applicable law.If you are a qualified individual with a disability or a disabled veteran and require support throughout the application and/or recruitment process as a result of your disability, you have the right to request a reasonable accommodation. You can submit your request to AccessibilitySupport@nbcuni.com."
3648895,"TVD Sales Intern","https://jobs.smartrecruiters.com/NBCUniversal3/744000083432981-tvd-sales-intern","universal","Sydney","No","Not specified","Internship","2025-09-23T20:25:24.733748Z","Job DescriptionWork closely with the TVD Sales team with updating monthly, weekly and quarterly product reports and licensee reports.Cross checking finalised deals with the production system to ensure correct details entered.Working on proactive initiatives with the TVD Sales team to go to market with.Provide administrative support for various projects including Budgets, presentations in PowerPoint etc.Perform general clerical duties such as data entry, help with expenses, and adhoc requirementsManage calendar and coordinate meetings/conference callsMaintain and update client databases and systems including SAP, Salesforce, Safe, and MicrostrategyMonitor the marketplace for changes that affect sales activities, both directly and indirectly and researching current market trends.Identify new opportunities for sales as a result of new entrants, changing technology and/or delivery systems.  In coordination with the TVD Sales team, develop sales strategies to quickly address and capitalize on these new opportunities.Basic RequirementsProficient in MS PowerPoint, Work, Outlook and Excel (knowledge of Pivot Tables &amp; Macros is desirable but not definitive).Excellent attention to detail (a definitive)Well organized  with the ability to manage multiple tasks with great prioritization skills.Be a good communicator with an analytical mindA desire to learn.Understanding of the Australian &amp; American media landscapes, particularly TVThis part time role requires a 9-month commitment, from February 2026 - November 2026You also MUST include a cover letter stating the month and year you graduate, why you would like to work for NBCUniversal, and what you feel you can bring to the role.  This is an integral of the application processDesired CharacteristicAustralian citizen or permanent residentActively completing a business, Legal or Marketing degree in the 2026 year.Visa sponsorship is not available for this positionPlease note that future visa sponsorship at NBCUniversal is rarely available for post-graduate employment opportunities.As part of our selection process, external candidates may be required to attend an in-person interview with an NBCUniversal employee at one of our locations prior to a hiring decision. NBCUniversal's policy is to provide equal employment opportunities to all applicants and employees without regard to race, color, religion, creed, gender, gender identity or expression, age, national origin or ancestry, citizenship, disability, sexual orientation, marital status, pregnancy, veteran status, membership in the uniformed services, genetic information, or any other basis protected by applicable law.If you are a qualified individual with a disability or a disabled veteran and require support throughout the application and/or recruitment process as a result of your disability, you have the right to request a reasonable accommodation. You can submit your request to AccessibilitySupport@nbcuni.com."
3648894,"Sales and Marketing Intern","https://jobs.smartrecruiters.com/NBCUniversal3/744000083434065-sales-and-marketing-intern","universal","Sydney","No","Not specified","Internship","2025-09-23T20:25:24.733772Z","As the Marketing Intern you will play a pivotal role in supporting the APAC marketing team with particular focus on channel brands including Bravo NZ, 7Bravo, UTV ANZ and DreamWorks Australia. Reporting to the Associate Marketing Manager APAC, this fast-paced role encompasses all aspects of marketing from campaign planning, social, digital, PR and events. The preferred candidate will be able to immerse themselves within the wider Networks marketing team with exposure to their Australian and Singapore-based teams.Tasks include but are not limited to:Support marketing managers with planning and execution of consumer and trade campaigns across APAC  working closely with teams in Australia &amp; SingaporeAssist in the development of GTM marketing assets and collateralAssist in creation of post-campaign reportingAttend weekly and monthly team WIPsServicing key partners and affiliates with regular and ad-hoc deliverables including programming highlights, cross-promos, key art, imagery &amp; reportingCreate monthly programming highlights for ANZ portfolio of channelsEvent support including new channel launches, affiliate &amp; trade events, consumer activations as well as management of inventory &amp; merchandiseAssist Commercial team in pitch deck ideation, creation, and delivery.Sign up to affiliate EDMs and report major campaign activities with competitor titles on a quarterly basisSign up and review industry publications to stay across industry news, launches, opportunitiesAssist with merchandise organisation, tracking and fulfillment to affiliate partnersBasic Requirements: Proficiency in editing software including Photoshop &amp; Premiere Pro a plus as well as knowledge of Adobe Photoshop and Canva.Exceptional organisational and prioritization skills with strong attention to detailAbility to take initiative and work independentlyStrong reporting and analytics skillsThis part time role requires a 9-month commitment, from February 2026 - November 2026You also MUST include a cover letter stating the month and year you graduate, why you would like to work for NBCUniversal, and what you feel you can bring to the role.  This is an integral of the application processDesired Characteristics:Completing a degree in Marketing, Communications or Business.Knowledge and passion for entertainment and television, particularly reality and lifestyle TVAustralian Citizen or Permanent ResidentVisa sponsorship is not available for this positionPlease note that future visa sponsorship at NBCUniversal is rarely available for post-graduate employment opportunities.As part of our selection process, external candidates may be required to attend an in-person interview with an NBCUniversal employee at one of our locations prior to a hiring decision. NBCUniversal's policy is to provide equal employment opportunities to all applicants and employees without regard to race, color, religion, creed, gender, gender identity or expression, age, national origin or ancestry, citizenship, disability, sexual orientation, marital status, pregnancy, veteran status, membership in the uniformed services, genetic information, or any other basis protected by applicable law.If you are a qualified individual with a disability or a disabled veteran and require support throughout the application and/or recruitment process as a result of your disability, you have the right to request a reasonable accommodation. You can submit your request to AccessibilitySupport@nbcuni.com."
3648893,"TV Programming Intern","https://jobs.smartrecruiters.com/NBCUniversal3/744000083434265-tv-programming-intern","universal","Sydney","No","Not specified","Internship","2025-09-23T20:25:24.733796Z","TV Programming Intern is part of the Programming team reporting to the Program Manager.Responsible for providing support and administrative assistance across the programming department working on multiple channels.KEY RESPONSIBILITIESMetadata input in to broadcast systemsBuild knowledge of NBCU broadcasts systemsAssist Senior Programmer &amp; Programmer across linear and VOD channelsCreate the Monthly Programming Priorities7Bravo Monthly Picture gridsMonthly Highlights document + distribution to SKY New ZealandSales AU &amp; NZ Calendar updatesMonthly Key Programming Priorities submissionMonthly Oxygen metadata submissionMonthly VOD Priorities for Bravo NZInter-department cross functional tasksEnsure all deadlines are metAssist with ad hoc programming related tasksBasic RequirementsStrong attention to detailExcellent communication and interpersonal skillsStrong organisational and time management skillsProactive, accurate, and detail orientedThis part time role requires a 9-month commitment, from February 2026 - November 2026You also MUST include a cover letter stating the month and year you graduate, why you would like to work for NBCUniversal, and what you feel you can bring to the role.  This is an integral of the application process
Desired CharacteristicsCurrently completing and degree in Media, Communications or similarProficiency in Microsoft Office Suite  Outlook and Excel in particularAn interest in working in media and developing a career within the broadcast industryAustralian Citizen or Permanent ResidentVisa sponsorship is not available for this positionPlease note that future visa sponsorship at NBCUniversal is rarely available for post-graduate employment opportunities.As part of our selection process, external candidates may be required to attend an in-person interview with an NBCUniversal employee at one of our locations prior to a hiring decision. NBCUniversal's policy is to provide equal employment opportunities to all applicants and employees without regard to race, color, religion, creed, gender, gender identity or expression, age, national origin or ancestry, citizenship, disability, sexual orientation, marital status, pregnancy, veteran status, membership in the uniformed services, genetic information, or any other basis protected by applicable law.If you are a qualified individual with a disability or a disabled veteran and require support throughout the application and/or recruitment process as a result of your disability, you have the right to request a reasonable accommodation. You can submit your request to AccessibilitySupport@nbcuni.com."
3648892,"Office Services Intern","https://jobs.smartrecruiters.com/NBCUniversal3/744000083434595-office-services-intern","universal","Sydney","No","Not specified","Internship","2025-09-23T20:25:24.733820Z","Assist the Office Services Manager.Attend EHS meetingsAttend Office Services Meeting with international counterpartsAssist as required with the Melbourne &amp; Auckland offices.Collect and distribute mail.Assist IT as required.Create desk labels for new starters.Manage and update the UPIA Visual directory.Supervise Meeting rooms and ensure their equipment and supplies are intact  reporting issues to IT. Overall presentation is acceptable for the next meeting - remove any rubbish, glass etc. and tidy chairs.Cover Reception lunch break.Manage Level 33 - tidy up, removing any crockery, glassware or items that do not belong. Liaising with staff to ensure the space is intact.Replenish kitchen/tea point supplies as needed.Keep Level 32 Kitchen &amp; Tea Point tidy.Refill Photocopiers. - Ensure spaces around the photocopiers are tidy and remove rubbish and any items that do not belong.Manage sanitary items for Level 32 &amp; 33.Transfer cutlery from Tea Point to main kitchen each day ready for lunch rush.Assist with in-house events.Ad-hoc projects as required.Basic RequirementsHigh level customer focus and delivery.Professional presentation.Ability to work autonomously as well as part of a team.Positive attitude in a busy and sometimes pressured environment.Previous experience in an administrative role.Experience with tools like Microsoft Word, Excel, PowerPoint, etc.Excellent communication skills.Ability to multitask and a strong attention to detail.Solid command of the English language, written and verbal.This part time role requires a 9-month commitment, from February 2026 - November 2026You also MUST include a cover letter stating the month and year you graduate, why you would like to work for NBCUniversal, and what you feel you can bring to the role.  This is an integral of the application processDesired Characteristics Completing a degree in Business or ManagementAustralian Citizen or Permanent ResidentVisa sponsorship is not available for this positionPlease note that future visa sponsorship at NBCUniversal is rarely available for post-graduate employment opportunities.As part of our selection process, external candidates may be required to attend an in-person interview with an NBCUniversal employee at one of our locations prior to a hiring decision. NBCUniversal's policy is to provide equal employment opportunities to all applicants and employees without regard to race, color, religion, creed, gender, gender identity or expression, age, national origin or ancestry, citizenship, disability, sexual orientation, marital status, pregnancy, veteran status, membership in the uniformed services, genetic information, or any other basis protected by applicable law.If you are a qualified individual with a disability or a disabled veteran and require support throughout the application and/or recruitment process as a result of your disability, you have the right to request a reasonable accommodation. You can submit your request to AccessibilitySupport@nbcuni.com."
