"ID","Title","Link","Company","Location","Remote","Experience","EmploymentType","DatePosted","RoleDescription"
3646129,"Program Manager","https://jobs.smartrecruiters.com/NBCUniversal3/744000083254080-program-manager","universal","Orlando","Yes",6,"Full time","2025-09-23T20:25:24.734034Z","ABOUT THE ROLEFANDANGO is looking for a Program Manager to lead our next big thing in content delivery.In this role, youll join the Fandango At Home PMO team, helping to deliver the tools and systems that power how we stream content. If you enjoy solving complex problems, building for scale, and making a measurable impact  wed love to meet you.The Program Manager will be leading and organizing various initiatives across the Fandango At Home program. The Program Manager will partner with Product and Technical leaders across the Fandango At Home teams to plan scope, define team capacity and own delivery of initiatives, while providing regular status reporting and identifying risks to leadership and stakeholders.Experience managing medium to large-scale programs on consumer facing web, mobile or home entertainment platforms with strong working knowledge of Agile/Scrum and Kanban methodologies will increase prospect for success.WHAT YOU'LL DOManage program for Fandango At Home (VOD, EST, PPV) initiatives.Define program structure that follows standard Fandango PMO program governance.Develop project plans for medium to large-scale initiatives.Report status of program initiatives to all levels of the organization.Manage timelines, risk, control scope and communicate any risk events to stakeholders.Ensure proper level of documentation is delivered with each program; document requirements as necessary.Manage and monitor dependencies across teams for cross-platform initiatives.WHAT WE'RE LOOKING FORMinimum 6 to 8 years relevant project and program management experience.Must have a deep understanding of project management tools and approaches to manage complex, multi-disciplinary projects and the flexibility to lead diverse and dynamic teams to deliver balanced and integrated solutions.Must have experience creating project plans for medium to large-scale initiatives.Experience working with key stakeholders to build out and report on program roadmap.Experience leading multiple teams and managing cross platform projects &amp; programs.Experience using Jira to manage and track projects. In-depth Jira knowledge and experience architecting Jira backend, a plus.Interest in process optimization and rolling out of process updates across tech org.Must be organized.Ability to roll out and enforce processes within the technology organization.Ability to understand and analyze different technology solutions at a high level.Ability to work with minimal supervision and to direct and improve a small team.Strong interpersonal &amp; communications skills.Ability to effectively collaborate with internal and external (3rd party) organizations.Able to exercise discretion and keep strictest levels of confidentiality.B.S. or B.A. in Information Systems, Computer Science or Engineering or equivalent.BONUS POINTS FORExperience in a software organization managing multiple projects.A broad range of knowledge regarding internet technologies, including (but not necessarily limited to) cloud technologies, publishing tools, mobile and living room (home entertainment) technology including client/ server architecture, and ad serving integration.A working knowledge of cyber security, compliance and data privacy standards.Fully Remote: This role has been designated as fully remote, meaning it is expected to be performed from a non-Versant worksite, typically an employees residence.As part of our selection process, external candidates may be required to attend an in-person interview with an NBCUniversal employee at one of our locations prior to a hiring decision. NBCUniversal's policy is to provide equal employment opportunities to all applicants and employees without regard to race, color, religion, creed, gender, gender identity or expression, age, national origin or ancestry, citizenship, disability, sexual orientation, marital status, pregnancy, veteran status, membership in the uniformed services, genetic information, or any other basis protected by applicable law.If you are a qualified individual with a disability or a disabled veteran and require support throughout the application and/or recruitment process as a result of your disability, you have the right to request a reasonable accommodation. You can submit your request to AccessibilitySupport@nbcuni.com.Although you'll be hired as an NBCU employee, your employment and the responsibilities associated with this job likely will transition to Versant in the future. By joining at this pivotal time, you'll be a part of this exciting company as it takes shape."
3646128,"Landscape Architect/Designer - Universal Creative - UK Project","https://jobs.smartrecruiters.com/NBCUniversal3/744000083254190-landscape-architect-designer-universal-creative-uk-project","universal","Bedford","No","Not specified","Full time","2025-09-23T20:25:24.734059Z","JOB SUMMARYManage the planning and area development design for the resort roadways and back of house areas, focusing on site planning, placemaking, and soft/hard landscape design solutions.MAJOR RESPONSIBILITIES (% of time)                        Provides area development and landscape specific designs for resort-wide projects, collaborating with in-house teams and external consultants. Contributes to the layout of roadways, parking, hotels, back-of-house facilities, and other resort components. Develops and manages detailed design plans with consideration given to building massing, parking, water conveyance and retention, open spaces, access points, vehicular and pedestrian circulation, hardscape and landscape areas. Prepares plans and illustrations to convey the thematic environment and design intent - 30%Assists the Planning &amp; Area Development Design management team with a focus on landscape and hardscape design including plant selection that achieves thematic and operational goals - 20%Analyses site constraints and proposes solutions related to placemaking, guest circulation, planting areas, landscape materials, hardscape, guest facing and service integration, and transportation/EVA requirements. Supports all phases of design (RIBA Phase 2-4), coordinating closely with design, operations, consultants, and project management to maintain design intent and budget alignment. Presents designs and interfaces with project teams at each design phase. Manages and supports the construction and installation of the design - 20%Interfaces with outside vendors, as directed by management, to ensure alignment with project goals - 15%Works within the team environment to help maintain common cost/schedule goals - 10%Interfaces with Universal staff for on-going quality control - 5%Understand and actively participate in Environmental, Health &amp; Safety responsibilities by following established UO policy, procedures, training and team member involvement activities.Perform other duties as assigned.SUPERVISORY RESPONSIBILITYPotential direct and indirect supervision of contractors and/or consultants depending on the project.Carries out supervisory responsibilities in accordance with the organisations policies and applicable laws.SCOPEParticipates in decisions of major nature. High degree of tact &amp; diplomacy to obtain favorable results.QUALIFICATIONSAbility to read, analyse, and interpret general business periodicals, professional journals, technical procedures, or governmental regulations.Ability to write reports, business correspondence, and procedure manuals.Ability to effectively present information to top management, public groups, and/or boards of directors.Reasonable accommodation may be made to enable individuals with disabilities to perform the essential functions.Consistent attendance is a job requirement.EDUCATIONBachelors degree in landscape architecture, or equivalent required. Masters degree in Landscape Architecture preferred.EXPERIENCERelevant landscape architecture and planning experience with a focus on theme park &amp; resort development required; or equivalent combination of education and experience.As part of our selection process, external candidates may be required to attend an in-person interview with an NBCUniversal employee at one of our locations prior to a hiring decision. NBCUniversal's policy is to provide equal employment opportunities to all applicants and employees without regard to race, color, religion, creed, gender, gender identity or expression, age, national origin or ancestry, citizenship, disability, sexual orientation, marital status, pregnancy, veteran status, membership in the uniformed services, genetic information, or any other basis protected by applicable law.If you are a qualified individual with a disability or a disabled veteran and require support throughout the application and/or recruitment process as a result of your disability, you have the right to request a reasonable accommodation. You can submit your request to AccessibilitySupport@nbcuni.com."
3646127,"Sales Manager","https://jobs.smartrecruiters.com/NBCUniversal3/744000083267280-sales-manager","universal","Rome","No","Not specified","Full time","2025-09-23T20:25:24.734084Z","The Sales Manager  Theatrical Distribution is responsible for driving revenue through the strategic placement and negotiation of film titles with cinema exhibitors, including both major chains and independent theaters. Reporting directly to the Sales Director, the Sales Manager plays a pivotal role in shaping and executing theatrical distribution strategies to maximize box office performance.Key ResponsibilitiesDevelop and implement effective sales strategies for theatrical releases across the domestic market.Cultivate and manage strong relationships with cinema chains, independent exhibitors, and distribution partners.Analyze box office performance, audience trends, and market data to inform sales tactics and release plans.Analyze box office data and performance metrics to inform future sales decisions.Forecast revenue and contribute to annual sales targets and budgets.Represent the company at industry events, screenings, and film markets to promote titles and strengthen exhibitor relationships.Monitor competitor releases and emerging market trends to identify growth opportunities.Relationships with the Trade Marketing team to align sales and promotional strategies.Ensure contracts, delivery, and payments are managed efficiently and on schedule.Involvement in DCP delivery and kdm (key digital message) processes.In-depth knowledge of the theatrical landscape and cinema operations.Proven experience in film distribution or sales, preferably with a focus on theatrical distribution.Strong negotiation, communication, and relationship-building skills.Demonstrated interest in business development and market expansion.Excellent multitasking and organizational abilities, with the capacity to work effectively under pressure.A proactive problem-solver with a positive attitude toward change and innovation.Technologically proficient; familiar with database management, spreadsheets, and word processing tools.Business Fluent (written and spoken) in Italian as well as English.As part of our selection process, external candidates may be required to attend an in-person interview with an NBCUniversal employee at one of our locations prior to a hiring decision. NBCUniversal's policy is to provide equal employment opportunities to all applicants and employees without regard to race, color, religion, creed, gender, gender identity or expression, age, national origin or ancestry, citizenship, disability, sexual orientation, marital status, pregnancy, veteran status, membership in the uniformed services, genetic information, or any other basis protected by applicable law.If you are a qualified individual with a disability or a disabled veteran and require support throughout the application and/or recruitment process as a result of your disability, you have the right to request a reasonable accommodation. You can submit your request to AccessibilitySupport@nbcuni.com."
3646126,"Engineering Manager, Automation","https://jobs.smartrecruiters.com/NBCUniversal3/744000083267043-engineering-manager-automation","universal","New York","No",2,"Full time","2025-09-23T20:25:24.734110Z","Our Media Group portfolio is a powerhouse collection of consumer-first brands, supported by media industry leaders, Comcast, NBCUniversal and Sky. When you join our team, youll work across our dynamic portfolio including Peacock, NOW, Fandango, SkyShowtime, Showmax, and TV Everywhere, powering streaming across more than 70 countries globally. And the evolution doesnt stop there. With unequalled scale, our teams make the most out of every opportunity to collaborate and learn from one another. Were always looking for ways to innovate faster, accelerate our growth and consistently offer the very best in consumer experience. But most of all, were backed by a culture of respect. We embrace authenticity and inspire people to thrive.The Video Software Engineering team is looking for Engineering Manager, Automation to grow and develop our QA engineering talent and build inclusive, high-performing team. Engineering Manager works closely and collaboratively with teams across Peacock technology to test and support deliver of high-quality streaming service. Engineering Manager defines, implements and oversees the overall quality strategy, including automation, manual testing, and continuous quality improvement initiatives.ResponsibilitiesSupport and lead a team of QA engineers across multiple Scrum teams, ensuring consistent execution and delivery.Mentor individuals to embrace diversity and help building an inclusive and flexibleWorkplace.Collaborate with Engineering and Product leadership to align testing priorities with business goals.Oversee the design, development, and maintenance of scalable and reliable test automation frameworks and CI/CD integrations.Establish and monitor quality metrics and KPIs to report on testing effectiveness and product health to leadershipChampion testing best practices, including shift-left testing, test-driven development, and robust exploratory testing.Identify gaps in coverage, tooling, or process and proactively implement solutions.Conduct regular code and test reviews, ensuring high standards and alignment with QA practices.Drive initiatives for test data management and environment stability.Maintain compliance with industry standards, internal controls, and regulatory requirements.Cultivate a culture of accountability, continuous improvement, and innovation within the QA teamParticipate in Agile ceremonies and cross-departmental planning as a QA technical stakeholder.Proactively suggest changes to the process to enhance efficiency as the team evolves.Bachelor's degree or equivalent in Computer Science, Engineering, Information Technology, or a related field.Ability to integrate into a large agile project and manage rapid testing cycles.Hands-on experience with at least one third-generation programming language (such as Java/C#) AND/OR scripting language (such as JavaScript, Python).Intermediate knowledge in Test frameworks and runners JUnit, TestNG, Cucumber, Gherkin, Selenium/Appium or Cypress for automation testing.Knowledge of API testing, and an understanding of underpinning technologies (XML/JSON/REST/SOAP).Expertise in reviewing code alongside QA engineers with an eye on ensuring consistent and repeatable solutioning.Experience in a JIRA / Confluence environment.Experience managing headcounts and other organizational leadership tasks.Cross-functional collaboration skills; preferably with multiple technology lines-of-business.2+ years of Engineering Management experience, prior QA Automation experience at senior level.Strong background in the video engineering and streaming.Proven success in building and scaling test automation strategies across large or complex applications.Hands-on experience with middleware/API testing, RDBMS.Deep knowledge of CI/CD tools and integration of testing frameworks into deployment pipelines.Excellent organizational, interpersonal, and communication skills, including the ability to influence at all levels.Experience managing geographically distributed teams and remote-first collaboration.Desired QualificationsUnderstanding of how a high performing team in fast paced environment operates.Understanding of deadlines, constraints and scope of delivery and experience working with the business partners to ensure the right balance between these are metSetting expectations and handling risks early.Being an analytic problem solver with a strong sense of autonomy, but with an open collaborative approach to getting the job done.Interest in promoting an inclusive team culture where engineers of diverse backgrounds can grow.Committed to quality in every assignment, large or small.Transparency, selflessness, and authenticity.This position is eligible for company sponsored benefits, including medical, dental, and vision insurance, 401(k), paid leave, tuition reimbursement, and a variety of other discounts and perks. Learn more about the benefits offered by NBCUniversal by visiting the Benefits page of the Careers website. Salary range: $135,000 - $160,000 (bonus and long-term incentive eligible).As part of our selection process, external candidates may be required to attend an in-person interview with an NBCUniversal employee at one of our locations prior to a hiring decision. NBCUniversal's policy is to provide equal employment opportunities to all applicants and employees without regard to race, color, religion, creed, gender, gender identity or expression, age, national origin or ancestry, citizenship, disability, sexual orientation, marital status, pregnancy, veteran status, membership in the uniformed services, genetic information, or any other basis protected by applicable law.If you are a qualified individual with a disability or a disabled veteran and require support throughout the application and/or recruitment process as a result of your disability, you have the right to request a reasonable accommodation. You can submit your request to AccessibilitySupport@nbcuni.com."
3646125,"Senior Manager, News Standards","https://jobs.smartrecruiters.com/NBCUniversal3/744000083285686-senior-manager-news-standards","universal","Washington","No",8,"Full time","2025-09-23T20:25:24.734138Z","NBCUniversal News Group is seeking a Senior Manager to join its News Standards team, which serves all NBCU News Group platforms and shows. Reporting to the Vice President of Standards, this role provides direct support and guidance to journalists, working with editors, producers, and the news coverage team to uphold the highest editorial and ethical standards. The Senior Manager will play a critical role in safeguarding the credibility and integrity of our journalism, defending and building on the trust NBC News has earned for more than 85 years. Job Duties:Serve as a primary point of contact for editorial teams seeking guidance on standards and practices. Review scripts, digital copy, video, podcasts, graphics, banners, and social posts for fairness, accuracy, and compliance with NBCU News Group standards and policies. Provide fast, thoughtful counsel during breaking news and high-pressure situations, including legally complex or sensitive coverage. Train and mentor newsroom staff on standards policies, including NBC News foundational standards, social media guidance, AI-generated content, and sensitive coverage areas. Partner with Legal, PR, and editorial leadership on issues involving corrections, fairness, sourcing, conflicts of interest, and use of third-party content. Ensure consistency of standards guidance across platforms, balancing speed with editorial responsibility. Participate in policy development and periodic updates to the Standards library, ensuring alignment with evolving newsroom practices and technology. Support coverage planning for major events (elections, mass casualty events, high-profile trials) with pre-publication guidance. 8+ years of experience in journalism, with demonstrated editorial judgment and newsroom leadership. Bachelors degree in communications, journalism, English, history, or related field.Deep knowledge of journalistic ethics, newsroom workflows, and legal considerations across broadcast, streaming, and digital platforms. Proven ability to remain calm and decisive in breaking news environments, balancing speed with responsibility. Exceptional writing, editing, and communication skills. Strong collaborative approach, with the ability to partner effectively across platforms and disciplines. Commitment to NBCU News Groups values of fairness, accuracy, and transparency. Ability to handle confidential material with utmost discretion. Must be able to work weekends, evenings, and holidays as needed. Openness and adaptability to new approaches to content and storytelling. Must have unrestricted work authorization to work in the United StatesMust be willing to work in New York, NY or Washington, D.C.Additional Requirements:Hybrid: This position has been designated as hybrid, generally contributing from the office a minimum of three days per week.This position is eligible for company sponsored benefits, including medical, dental and vision insurance, 401(k), paid leave, tuition reimbursement, and a variety of other discounts and perks. Learn more about the benefits offered by NBCUniversal by visiting the Benefits page of the Careers website.Salary Range: $125,000 - $150,000 (bonus eligible)As part of our selection process, external candidates may be required to attend an in-person interview with an NBCUniversal employee at one of our locations prior to a hiring decision. NBCUniversal's policy is to provide equal employment opportunities to all applicants and employees without regard to race, color, religion, creed, gender, gender identity or expression, age, national origin or ancestry, citizenship, disability, sexual orientation, marital status, pregnancy, veteran status, membership in the uniformed services, genetic information, or any other basis protected by applicable law.If you are a qualified individual with a disability or a disabled veteran and require support throughout the application and/or recruitment process as a result of your disability, you have the right to request a reasonable accommodation. You can submit your request to AccessibilitySupport@nbcuni.com."
