"ID","Title","Link","Company","Location","Remote","Experience","EmploymentType","DatePosted","RoleDescription"
3648921,"Accountant - Fandango","https://jobs.smartrecruiters.com/NBCUniversal3/744000083345175-accountant-fandango","universal","Universal City","Yes",1,"Full time","2025-09-23T20:25:24.732994Z","VERSANT, Comcast Corporations (NASDAQ: CMCSA) planned spin-off, will be a leading independent publicly traded media company comprised of most of NBCUniversals cable television networks, including USA Network, CNBC, MSNBC, Oxygen, E!, SYFY and Golf Channel along with complementary digital assets Fandango, Rotten Tomatoes, GolfNow, GolfPass, and SportsEngine. The well-capitalized company will have significant scale as a pure-play set of assets anchored by leading news, sports and entertainment content. The spin-off is expected to be completed during 2025, subject to the satisfaction of customary conditions.Responsibilities:Primary focus on billing for 3rd party customers:Weekly/Monthly/Annual Billings across all Fandango businesses: Generate invoices in SAP, and manage invoice distribution to customers' accounts payable systemsProcess account adjustments, credit memos, and customer refunds as neededCollections of all Accounts Receivable, tracking of A/R Aging  partner with internal departments and customersCash Application for paymentsServe as point of contact for all customers for set-up, payment inquiries: New Customer setup and maintenance in SAPOrganize and maintain monthly accounting records for Accounts Receivables: Post daily bank deposits to customer accounts in SAP.  Research and resolve any customer invoice and payment discrepanciesBad Debt Reserve Analysis: track bad debt on a quarterly basisResponsible for the month-end close process for A/R, including preparing and posting journal entriesSupport the month-end close process for Promo business, including preparing and posting journal entries. Complete ad-hoc analysis as directed by Promo Controller and Manager.Complete month-end account reconciliations, preparation and review, on a timely basisResponsible for data requests from various departments, including FP&amp;A, Promo OperationsProvide testing documents and other requests for external and internal audits as requiredAbility to multi-task and work in a fast-paced environmentComplete ongoing accounting projects to build efficiencies and automationOther various special projects and analysis, as assigned Qualifications:Preferred 1+ years of prior accounting experience, with strong analytical skillsIntermediate MS Excel and Word skills are requiredStrong interpersonal skillsAbility to prioritize, multi-task and work in a fast-paced environmentSupportive teamwork attitudeAbility to work independentlyProject management experienceUnderstanding of general ledger functionalityMust be available and willing to work extended hours as occasionally needed (during crunch times!) per day or per week, to meet business needsRemote positionAdditional Information:This position is eligible for company sponsored benefits, including medical, dental and vision insurance, 401(k), paid leave, tuition reimbursement, and a variety of other benefits and perks. Learn more about the benefits offered by NBCUniversal by visiting the Benefits page of the Careers website. Salary database: $65,000- 80,000As part of our selection process, external candidates may be required to attend an in-person interview with an NBCUniversal employee at one of our locations prior to a hiring decision. NBCUniversal's policy is to provide equal employment opportunities to all applicants and employees without regard to race, color, religion, creed, gender, gender identity or expression, age, national origin or ancestry, citizenship, disability, sexual orientation, marital status, pregnancy, veteran status, membership in the uniformed services, genetic information, or any other basis protected by applicable law.  If you are a qualified individual with a disability or a disabled veteran, you have the right to request a reasonable accommodation if you are unable or limited in your ability to use or access nbcunicareers.com as a result of your disability. You can request reasonable accommodations by emailing AccessibilitySupport@nbcuni.com.Although you'll be hired as an NBCU employee, your employment and the responsibilities associated with this job likely will transition to Versant in the future. By joining at this pivotal time, you'll be a part of this exciting company as it takes shape.For LA County and City Residents Only:  NBCUniversal will consider for employment  qualified applicants with criminal histories, or arrest or conviction records, in a manner  consistent with relevant legal requirements, including the City of Los Angeles' Fair Chance Initiative For Hiring Ordinance, the Los Angeles County Fair Chance Ordinance for Employers, and the California Fair Chance Act, where applicable."
3648920,"Senior Accountant - Fandango","https://jobs.smartrecruiters.com/NBCUniversal3/744000083345167-senior-accountant-fandango","universal","Universal City","Yes",1,"Full time","2025-09-23T20:25:24.733107Z","VERSANT, Comcast Corporations (NASDAQ: CMCSA) planned spin-off, will be a leading independent publicly traded media company comprised of most of NBCUniversals cable television networks, including USA Network, CNBC, MSNBC, Oxygen, E!, SYFY and Golf Channel along with complementary digital assets Fandango, Rotten Tomatoes, GolfNow, GolfPass, and SportsEngine. The well-capitalized company will have significant scale as a pure-play set of assets anchored by leading news, sports and entertainment content. The spin-off is expected to be completed during 2025, subject to the satisfaction of customary conditions.Responsibilities:Complete the month-end close for the Fandango at Home entity (A/P, A/R, journals, and Blackline monthly reconciliations)Compute and process monthly and quarterly studio royalty paymentsWork with Accounting manager to review studio agreements to verify Fandango is recognizing revenue by GAAP accounting standards and compliant with contractual obligations with third partiesCommunicate with studios on reporting variances and announcements; work closely with Fandango at Home operations team to maintain studio relationshipsWork closely with BI to ensure data integrity on reports - Help validate data input from various sources and ensure data integrity (e.g. subsystem reconciliation, bank and point-of-sale tie-outs)Set up new studios for SFTP data/reporting transferCompute, report, and review monthly sales tax reports to KPMG and Vertex (review sales tax posting on Day +1, review variance trending on the 15th of every month)Collaborate with the FP&amp;A team to review monthly P&amp;L variances between actuals and budget/forecastAssist with yearly external audits, internal control documentation, accounting policies, and proceduresComplete ongoing accounting projects to build efficiencies and automationAbility to multi-task and work in a fast-paced environmentSupport long-term Global Controllership initiatives for automation and standardization  Support Sr. Director, Sr. Manager, and Manager to maintain and enhance strong controllership environmentOther various special projects and analysis as assignedQualifications:Minimum of 1+ years of prior accounting experience, with strong analytical skillsIntermediate to expert level MS Excel and Word skills are requiredStrong interpersonal skillsAbility to prioritize, multi-task and work in a fast-paced environmentSupportive teamwork attitudeAbility to work independentlyProject management experiencePrior experience with SAP preferredUnderstanding of general ledger functionalityMust be available and willing to work extended hours as occasionally needed (during crunch times!) per day or per week, including weekends and holidays, to meet business needsRemote positionAdditional Information:This position is eligible for company sponsored benefits, including medical, dental and vision insurance, 401(k), paid leave, tuition reimbursement, and a variety of other benefits and perks. Learn more about the benefits offered by NBCUniversal by visiting the Benefits page of the Careers website. Salary Range- $80,000 - $95,000As part of our selection process, external candidates may be required to attend an in-person interview with an NBCUniversal employee at one of our locations prior to a hiring decision. NBCUniversal's policy is to provide equal employment opportunities to all applicants and employees without regard to race, color, religion, creed, gender, gender identity or expression, age, national origin or ancestry, citizenship, disability, sexual orientation, marital status, pregnancy, veteran status, membership in the uniformed services, genetic information, or any other basis protected by applicable law.  If you are a qualified individual with a disability or a disabled veteran, you have the right to request a reasonable accommodation if you are unable or limited in your ability to use or access nbcunicareers.com as a result of your disability. You can request reasonable accommodations by emailing AccessibilitySupport@nbcuni.com.Although you'll be hired as an NBCU employee, your employment and the responsibilities associated with this job likely will transition to Versant in the future. By joining at this pivotal time, you'll be a part of this exciting company as it takes shape.For LA County and City Residents Only:  NBCUniversal will consider for employment  qualified applicants with criminal histories, or arrest or conviction records, in a manner  consistent with relevant legal requirements, including the City of Los Angeles' Fair Chance Initiative For Hiring Ordinance, the Los Angeles County Fair Chance Ordinance for Employers, and the California Fair Chance Act, where applicable."
3648919,"Associate Manager A&E Design","https://jobs.smartrecruiters.com/NBCUniversal3/744000083366989-associate-manager-a-e-design","universal","Universal City","No",3,"Full time","2025-09-23T20:25:24.733140Z","The Associate Manager Architecture and Design works in partnership with the Facility Design Manager to oversee the project A&amp;E vendor and coordinate the show ride systems facility impact reports and review/ redline all disciplines design packages.  Assists with coordinating Construction administration effort relative to reviewing RFIs and field work assessments.Responsibilities:Attends weekly project meetings. Assists the coordination between Architecture and Engineering and the other vendors.Monitors construction in the field including identifying and resolving discrepancies between the construction and drawings and/or design intent. Participates in the organization and response to the various requests for information. Evaluates the Architecture and Engineering vendors responses to requests for information and the preparation of modification documents.Reviews Show documentation to ensure creative design intent is maintained during the preparation of design documents by the Architecture and Engineering vendors and other outside parties.Supports the design strategy to achieve quality deliverables. Assists with reviewing the drawings and specifications to insure that they meet the design intent, the creative appearance and are complete and accurate for construction. Assists with the coordination between the Architecture and Engineering vendors and the ride / show vendors including the development of all final facility impacts.Assists with the development of the Architecture and Engineering scope of work / request for proposal documents, the selection and pre-qualification of potential Architecture and Engineering vendors, the response to questions / clarification during the proposal process and the analysis of the proposals.Assists with development of the Architecture/Engineering schedule for facility design. Coordinates and logs that the Architecture and Engineering vendors maintain the required schedule and meet their milestone delivery dates in a timely manner.Assist in managing the Architecture and Engineering vendors contractual obligations including the evaluation of any requests for additional services, the preparation of any directives, the negotiation of all changes and the incorporation of any agreed upon changes into the vendors agreement.Keeps project folder up to date for all facility drawings, RFIs and submittals. Maintain an up to date PDF drawings in Blue Beam for reference during construction, slip sheeting the most current sheets and hyperlinking to RFI responses.Understands and actively participate in Environmental, Health &amp; Safety responsibilities by following established USH policy, procedures, training and team member involvement activities.Oversees A&amp;E document closeout and posting of electronic plans into the department archives  performs other duties as assignedBachelors degree from a college or university in: Architecture, Engineering or Construction.3-5 Years: experience, within the entertainment/theme park industry or equivalent combination of education and experience.Computer drafting skills required. Experience with AUTOCAD, Blue Beam or similar program required. Knowledge of Sketch Up, Revit and Adobe Photoshop is preferred.Interest in learning local building codes and plan check, permitting and inspection processes.Strong written and verbal communication skills.Excellent analytical and organizational skills.Self-Motivated and a team player.Required On-Site: This position is required to be performed full-time from an NBCUniversal-designated worksite.Desired Characteristics:Self-Motivated and a team player who can lead by exampleStrong verbal and written communication skillsExperience with multi-level corporate management structure.This position is eligible for company sponsored benefits, including medical, dental and vision insurance, 401(k), paid leave, tuition reimbursement, and a variety of other discounts and perks. Learn more about the benefits offered by NBCUniversal by visiting the Benefits page of the Careers website. Salary range: $70,000 - $85,000As part of our selection process, external candidates may be required to attend an in-person interview with an NBCUniversal employee at one of our locations prior to a hiring decision. NBCUniversal's policy is to provide equal employment opportunities to all applicants and employees without regard to race, color, religion, creed, gender, gender identity or expression, age, national origin or ancestry, citizenship, disability, sexual orientation, marital status, pregnancy, veteran status, membership in the uniformed services, genetic information, or any other basis protected by applicable law.NBCUniversal will consider for employment qualified applicants with criminal histories, or arrest or conviction records, in a manner consistent with relevant legal requirements, including the City of Los Angeles' Fair Chance Initiative For Hiring Ordinance, the Los Angeles County Fair Chance Ordinance for Employers, and the California Fair Chance Act, where applicable.If you are a qualified individual with a disability or a disabled veteran and require support throughout the application and/or recruitment process as a result of your disability, you have the right to request a reasonable accommodation. You can submit your request to AccessibilitySupport@nbcuni.com."
3648918,"Technical Product Manager","https://jobs.smartrecruiters.com/NBCUniversal3/744000083372946-technical-product-manager","universal","Englewood","No",3,"Full time","2025-09-23T20:25:24.733167Z","Versant Medias Content and Operations group is seeking a Technical Product Manager to join our teams. This role will report to the Manager of Technical Product and support the delivery of best-in-class tools and platforms that power the accurate, timely, and compliant ingest, fulfillment, scheduling, and distribution of our content across platforms and endpoints.  Youll serve as a core member of a cross-functional squad, driving solutions that unify asset readiness, scheduling coordination, compliance validation, and multi-platform delivery. Whether streamlining file ingest, supporting real-time schedule updates, or embedding metadata into downstream pipelines, your work will directly enhance the speed, accuracy, and scalability of Versants content supply chain.This role is ideal for product thinkers with hands-on experience in media workflows, a systems mindset, and a drive to reduce operational friction through technology.Key ResponsibilitiesBacklog Ownership: Define, refine, and prioritize product backlog items in alignment with strategic goals and operational needs.Workflow Enablement: Gather requirements from ingest, QC, packaging, scheduling, traffic, playout, and partner management stakeholders; translate needs into actionable user stories that improve orchestration, and delivery.Delivery Execution: Collaborate daily with engineers, designers, and QA to drive sprint planning, review, and execution.Operational Support: Ensure enhancements support real-world content operations, including SLA monitoring, compliance checks, scheduling accuracy, and delivery-status visibility.System Modernization: Contribute to the transformation from legacy tools to scalable, cloud-native solutions; help decompose monoliths into modular services.Automation &amp; Intelligence: Help embed intelligent automation into toolingsuch as predictive schedule and fulfillment readiness, intelligent QC, metadata validations, and anomaly detection.Documentation &amp; Training: Maintain clear product documentation and support rollout of new features to operational users.Cross-Team Collaboration: Interface with Product Managers, Analysts, and other Product Owners to coordinate dependencies and support seamless end-to-end workflow integration.Basic Qualifications3+ years in product ownership, product management, or technical project managementideally in a media or broadcast operations environment.Familiarity with content ingest, scheduling, playout, metadata packaging, or distribution tooling.Strong backlog management skills, including user story writing, prioritization, and refinement.Comfort with agile development tools like Jira, Confluence, and delivery planning frameworks.Ability to translate complex operational needs into clear technical requirements.Excellent communication and stakeholder facilitation skills.Preferred QualificationsHands-on experience with tools and workflows across the content supply chainsuch as ingest and packaging systems, scheduling and traffic platforms, metadata management tools, playout readiness solutions, or distribution orchestration frameworks.Experience leveraging AI-powered tools (e.g., LLMs, copilots) to enhance product workflowssuch as drafting user stories, enriching metadata, generating test cases, or identifying product insights.Technical fluency sufficient to discuss implementation tradeoffs with engineering teams.Product certifications (CSPO, SAFe POPM, etc.) are a plus.Work Style &amp; CultureYoull thrive in this role if you:Are energized by operational systems and real-world constraints.Excel at collaborative delivery with engineers and business partners.Are relentlessly curious and eager to simplify complexity.Care deeply about the reliability of what you ship and how it supports critical workflows.Additional Requirements:On-site Requirement: This position has been designated needing to be in the office 2 - 4 times per month depending on business needs.This role will require quarterly on-site collaboration weeks in New York City (NY) and Englewood Cliffs (NJ). Limited travel (&lt;10%) to broadcast, vendor, or operations centers may be required.This position is eligible for company sponsored benefits, including medical, dental and vision insurance, 401(k), paid leave, tuition reimbursement, and a variety of other discounts and perks. Learn more about the benefits offered by NBCUniversal by visiting the Benefits page of the Careers website. Salary range: $120,000 - $160,000 (bonus eligible)We are accepting applications for this position on an ongoing basis.As part of our selection process, external candidates may be required to attend an in-person interview with an NBCUniversal employee at one of our locations prior to a hiring decision. NBCUniversal's policy is to provide equal employment opportunities to all applicants and employees without regard to race, color, religion, creed, gender, gender identity or expression, age, national origin or ancestry, citizenship, disability, sexual orientation, marital status, pregnancy, veteran status, membership in the uniformed services, genetic information, or any other basis protected by applicable law.If you are a qualified individual with a disability or a disabled veteran and require support throughout the application and/or recruitment process as a result of your disability, you have the right to request a reasonable accommodation. You can submit your request to AccessibilitySupport@nbcuni.com.Although you'll be hired as an NBCU employee, your employment and the responsibilities associated with this job likely will transition to Versant in the future. By joining at this pivotal time, you'll be a part of this exciting company as it takes shape."
