"ID","Title","Link","Company","Location","Remote","Experience","EmploymentType","DatePosted","RoleDescription"
3648913,"Marketing Intern - Hayu","https://jobs.smartrecruiters.com/NBCUniversal3/744000083429955-marketing-intern-hayu","universal","Sydney","No","Not specified","Internship","2025-09-23T20:25:24.733301Z","Know your Real Housewives from the Below Deck crew? This is quite possibly the MOST EXCITING role for any reality TV superfan completing a marketing degree. From NBCUniversal, Hayu serves up the sass, with over 300 reality TV shows and loads of episodes streaming ad-free on the same day as the USA. The Sydney-based Asia-Pacific team is searching for a super-star Marketing Intern to join their team in 2026. Reporting into the Marketing Manager Asia Pacific, youll be working across all things media, social media, PR, events, partners... and loads more! A fantastic, rounded work experience opportunity for the right candidate.KEY RESPONSIBILITIESNo two day will be the same in this fun and busy team! Here are some examples of what you could be supporting on...Premiere screenings &amp; eventsMonthly partner assetsCoordinating &amp; dispatch of media materialSocial media influencer campaignsActivity presentationsResearch and media monitoringBrand merchandisePR and gifting activationsGeneral admin and team supportBasic RequirementsProficient in Google suite, including Slides and SheetsHighly detail oriented and organised, with exceptional prioritisation skillsAbility to think and work fastAbility to take initiative and work independentlyExcellent communicationReady to learn and motivated by this exciting industryThis part time role requires a 9-month commitment, from February 2026 - November 2026You also MUST include a cover letter stating the month and year you graduate, why you would like to work for NBCUniversal, and what you feel you can bring to the role.  This is an integral of the application processDesired CharacteristicsCompleted a Degree in Marketing, Communications, PR or similarA creative thinker with a sense of fun!You are a reality TV super fan!Australian Citizen or Permanent ResidentVisa sponsorship is not available for this positionPlease note that future visa sponsorship at NBCUniversal is rarely available for post-graduate employment opportunities.As part of our selection process, external candidates may be required to attend an in-person interview with an NBCUniversal employee at one of our locations prior to a hiring decision. NBCUniversal's policy is to provide equal employment opportunities to all applicants and employees without regard to race, color, religion, creed, gender, gender identity or expression, age, national origin or ancestry, citizenship, disability, sexual orientation, marital status, pregnancy, veteran status, membership in the uniformed services, genetic information, or any other basis protected by applicable law.If you are a qualified individual with a disability or a disabled veteran and require support throughout the application and/or recruitment process as a result of your disability, you have the right to request a reasonable accommodation. You can submit your request to AccessibilitySupport@nbcuni.com."
3648911,"Universal Pictures Marketing Intern","https://jobs.smartrecruiters.com/NBCUniversal3/744000083430125-universal-pictures-marketing-intern","universal","Sydney","No","Not specified","Internship","2025-09-23T20:25:24.733327Z","NBCUniversal is a leader in providing entertainment programming to the US and international marketplaces. The Universal Pictures Home Entertainment division is responsible for the global distribution of NBCUs film and TV content across various home entertainment platforms. Within the Global Distribution division, UPHE team is responsible for growing transactional digital (Electronic Sell-through and Transactional Video on Demand) business, with a focus on strategising and executing consumer marketing campaigns that maximise revenue and impact, as well as managing ongoing customer relationships with top-tier digital platforms including Amazon Prime Video, Apple TV, Google, and Foxtel.To provide general administrative support to Senior Marketing Manager, Marketing Manager and VP of Marketing  Assisting to develop and deploy marketing campaigns for movies and TV series. In addition to this you will support the business key clients via. promotional efforts and supply of marketing materials.Duties will include general administrative support to Marketing team such as:Update and distribute schedules and reports as requiredAssist and contribute to agency briefs and internal brainstorming sessions for films to ensure that each film is uniquely nurtured and developed.Assist in the coordination of best-in-class client facing presentations in conjunction with Marketing Manager(s)Asset collation and distribution of marketing materials (i.e. artwork and trailers) to marketing teams and external stakeholders and agencies.Manage all aspects of campaign set-up with Marketing Manager(s)Support Manager(s) and VP Marketing in light of absence, travel, holiday or illness.Supporting Marketing Manager(s) with finance tasks including raising purchase orders.Perform other marketing duties and/or projects as needed.Basic RequirementsPassion for movies and/or TV showsEnthusiasm for learning a growing businessCreativity either in design or creative approaches to projects Collaboration - A strong team work ethicBasic skill levels in PowerPoint, Outlook, Teams and ExcelThis part time role requires a 9-month commitment, from February 2026 - November 2026You also MUST include a cover letter stating the month and year you graduate, why you would like to work for NBCUniversal, and what you feel you can bring to the role.  This is an integral of the application processDesired CharacteristicsCompleting a degree in Marketing, Communications or similarAustralian Citizen or Permanent ResidentVisa sponsorship is not available for this positionPlease note that future visa sponsorship at NBCUniversal is rarely available for post-graduate employment opportunities.As part of our selection process, external candidates may be required to attend an in-person interview with an NBCUniversal employee at one of our locations prior to a hiring decision. NBCUniversal's policy is to provide equal employment opportunities to all applicants and employees without regard to race, color, religion, creed, gender, gender identity or expression, age, national origin or ancestry, citizenship, disability, sexual orientation, marital status, pregnancy, veteran status, membership in the uniformed services, genetic information, or any other basis protected by applicable law.If you are a qualified individual with a disability or a disabled veteran and require support throughout the application and/or recruitment process as a result of your disability, you have the right to request a reasonable accommodation. You can submit your request to AccessibilitySupport@nbcuni.com."
3648910,"Finance Intern","https://jobs.smartrecruiters.com/NBCUniversal3/744000083430335-finance-intern","universal","Sydney","No","Not specified","Internship","2025-09-23T20:25:24.733353Z","Set-up of new vendors and customers via NBCU support central system and APEXPreparation of Bank Reconciliations  preparing journals, cash receipting and manual payment entriesAudit support from Mar-MayAssistance with Marketing open POs and liaising with AU and NZ team and AP team on older titlesSupporting with intercompany rechargesAssist U660/U661 with new Lease (KLT) system. Do the training online and prepare notes on how to operate the new systemReconciliation of credit card statementsData entry for third party reportingMonthly accounting journal preparationPreparation of monthly and quarterly BAS ReturnsEntering of vendor invoicesOther adhoc administration and finance tasks as requestedBasic RequirementsGeneral understanding and interest in the finance functionAbility to work independently and to enter data quickly and accuratelyIntermediate level Excel Excellent communication skills and attention to detailAn organised and methodical approach to workingHappy to work to instruction but pro-active in seeking process improvements.Positive 'can do' attitudeThis part time role requires a 9-month commitment, from February 2026 - November 2026You also MUST include a cover letter stating the month and year you graduate, why you would like to work for NBCUniversal, and what you feel you can bring to the role.  This is an integral of the application processDesired CharacteristicsWorking towards university degree or college diploma in Accounting, Commerce or BusinessAustralian Citizen or Permanent ResidentVisa sponsorship is not available for this positionPlease note that future visa sponsorship at NBCUniversal is rarely available for post-graduate employment opportunities.As part of our selection process, external candidates may be required to attend an in-person interview with an NBCUniversal employee at one of our locations prior to a hiring decision. NBCUniversal's policy is to provide equal employment opportunities to all applicants and employees without regard to race, color, religion, creed, gender, gender identity or expression, age, national origin or ancestry, citizenship, disability, sexual orientation, marital status, pregnancy, veteran status, membership in the uniformed services, genetic information, or any other basis protected by applicable law.If you are a qualified individual with a disability or a disabled veteran and require support throughout the application and/or recruitment process as a result of your disability, you have the right to request a reasonable accommodation. You can submit your request to AccessibilitySupport@nbcuni.com."
3648909,"Publicity Intern - VIC","https://jobs.smartrecruiters.com/NBCUniversal3/744000083430243-publicity-intern-vic","universal","Windsor","No","Not specified","Internship","2025-09-23T20:25:24.733378Z","Regular Weekly Duties:Attend weekly Marketing and Publicity team WIPsSign up to and review daily Social Diary EDM for new database contacts and for new product launches,  publicity opportunities, updated contacts and report key headlines weekly.Creation of publicity post screening event reportsCollate review links for global reports on opening dayCollate screening reactions for global reports and pull quotes for opening day review reportsCentral Diary booking managementGeneral Administrative assistance as requiredUpdating Media examples databasePitching of targeted  grassroots promotions for film releasesDatabase Management:Continually update the Publicity Database  including media/influencers/reviewersResearch:Research potential partners for film specific promotions e.g.: competitor activity, media monitoring and browsing (online, event pages, genre press outlets and community pages) along with influencer reachResearch major sporting, seasonal and music events with a view to potential publicity tie in with our film propertiesSourcing leads by gathering market intel on media outlets/ influencers to refine pitch lists to Publicity teamMerchandisePrize fulfillment, sending out merchandise and prizing to winnersSending out in-season passes to partnersEvents / ScreeningsGeneral administrative and event support at screenings and premiere eventsAttending &amp; signing in reviewer screeningsAssisting with guest lists for screenings &amp; eventsCreation of Cheat sheets for premiere eventsSending out screening invitations &amp; set up of ticketing system SPLASHBasic RequirementsProficient in MS PowerPoint, Work, Outlook and ExcelExcellent attention to detailWell organized with great prioritization skillsAbility to take initiative and work independentlyExcellent communication and a great team playerAvailable to assist with evening screening eventsThis part time role requires a 9-month commitment, from February 2026 - November 2026You also MUST include a cover letter stating the month and year you graduate, why you would like to work for NBCUniversal, and what you feel you can bring to the role.  This is an integral of the application processDesired CharacteristicsCurrently undertaking university study in communications or marketing-based disciplinePassionate about the film industryAustralian Citizen or Permanent ResidentVisa sponsorship is not available for this positionPlease note that future visa sponsorship at NBCUniversal is rarely available for post-graduate employment opportunities.As part of our selection process, external candidates may be required to attend an in-person interview with an NBCUniversal employee at one of our locations prior to a hiring decision. NBCUniversal's policy is to provide equal employment opportunities to all applicants and employees without regard to race, color, religion, creed, gender, gender identity or expression, age, national origin or ancestry, citizenship, disability, sexual orientation, marital status, pregnancy, veteran status, membership in the uniformed services, genetic information, or any other basis protected by applicable law.If you are a qualified individual with a disability or a disabled veteran and require support throughout the application and/or recruitment process as a result of your disability, you have the right to request a reasonable accommodation. You can submit your request to AccessibilitySupport@nbcuni.com."
3648908,"Audience, Research, & Analysis Intern","https://jobs.smartrecruiters.com/NBCUniversal3/744000083428343-audience-research-analysis-intern","universal","Sydney","No","Not specified","Internship","2025-09-23T20:25:24.733403Z","The Audience Research &amp; Analysis department is responsible for supporting NBCUs international channels (Networks), content licensing (TVD) and production (Studios) businesses with audience based quantitative and qualitative reporting, insight and strategic analysis in all international territories across all content platforms.KEY RESPONSIBILITIESResearch:Be responsible for producing regular TV rating reports &amp; VOD streaming reportsWork with the programming team on the performance of key titles in AustraliaAssistance in working on project work, covering both Australia and New ZealandAbility to interpret dataProgram performanceWriting of internal reportsBasic RequirementsProficient in MS PowerPoint, Word, Outlook and Excel (knowledge of Pivot Tables &amp; Macros is desirable but not definitive)Excellent attention to detailWell organized with great prioritization skillsBe a good communicator with an analytical mind and a desire to learnUnderstanding of the Australian &amp; American media landscapes, particularly TVPython/JavaScript skills desirable but by no means essential and training can be providedThis part time role requires a 9-month commitment, from February 2026 - November 2026You also MUST include a cover letter stating the month and year you graduate, why you would like to work for NBCUniversal, and what you feel you can bring to the role.  This is an integral of the application processDesired RequirementsAustralian citizen or permanent residentActively completing a business, economics or data science degree in 2026Visa sponsorship is not available for this positionPlease note that future visa sponsorship at NBCUniversal is rarely available for post-graduate employment opportunities.As part of our selection process, external candidates may be required to attend an in-person interview with an NBCUniversal employee at one of our locations prior to a hiring decision. NBCUniversal's policy is to provide equal employment opportunities to all applicants and employees without regard to race, color, religion, creed, gender, gender identity or expression, age, national origin or ancestry, citizenship, disability, sexual orientation, marital status, pregnancy, veteran status, membership in the uniformed services, genetic information, or any other basis protected by applicable law.If you are a qualified individual with a disability or a disabled veteran and require support throughout the application and/or recruitment process as a result of your disability, you have the right to request a reasonable accommodation. You can submit your request to AccessibilitySupport@nbcuni.com."
3648907,"Consumer Products Finance Intern","https://jobs.smartrecruiters.com/NBCUniversal3/744000083431365-consumer-products-finance-intern","universal","Sydney","No","Not specified","Internship","2025-09-23T20:25:24.733428Z","Universal Product &amp; Experiences is a division that creates and extends quality entertainment that positively impacts audiences through universally engaging stories, play and experiences.The Finance Intern position is a key member of the APAC Consumer Product Finance team. Their primary role is to be the support function for the Finance team with the various finance processes and other ad hoc tasks, especially during the forecasting cycles.For the intern, this role will provide a wide exposure across different responsibilities within the finance team, and will be a vital member to ensure the team can continue to provide the assistance and business partnering requirements necessary to all territory teams across APAC

Essential Responsibilities:Key contributor supporting all financial cycles: Annual Budget, Quarterly Forecasts / Pacings, Long Range Planning and Quarterly Close. This includes assisting in data uploads, helping with the preparation of data tables and presentation slidesAssisting with the various ongoing financial processes in UP&amp;E, which includes the checking of data to assist with deliverables submissions, preparation and updating of reports, PO checking process, and various other tasksSupporting the finance team with other various ad hoc analysis and tasks for the wider territory teams across the APAC business, which includes pulling together data to assist in financial analysis, building slides and graphs, and downloading contract information for analysisBasic Qualifications: Intermediate Microsoft Excel, PowerPoint and Word proficiencyAbility to interact with various teams across UP&amp;EGeneral accounting knowledge requiredAbility to multi-task and prioritize work assignments and work well under pressureThis part time role requires a 9-month commitment, from February 2026 - November 2026You also MUST include a cover letter stating the month and year you graduate, why you would like to work for NBCUniversal, and what you feel you can bring to the role.  This is an integral of the application processDesired Qualifications:Currently completing a Bachelor of Accounting, Commerce or Business equivalent degree with a background in accounting, ideally in their second last or final year of their degreeExcellent communication skills, both verbal and writtenMust be a team player and be able to work with a variety of personalities and stakeholdersHighly organized with great attention to detailSelf starter and has a proactive approach to problem solvingStrong work ethic and follow throughAustralian Citizen or Permanent ResidentVisa sponsorship is not available for this positionPlease note that future visa sponsorship at NBCUniversal is rarely available for post-graduate employment opportunities.As part of our selection process, external candidates may be required to attend an in-person interview with an NBCUniversal employee at one of our locations prior to a hiring decision. NBCUniversal's policy is to provide equal employment opportunities to all applicants and employees without regard to race, color, religion, creed, gender, gender identity or expression, age, national origin or ancestry, citizenship, disability, sexual orientation, marital status, pregnancy, veteran status, membership in the uniformed services, genetic information, or any other basis protected by applicable law.If you are a qualified individual with a disability or a disabled veteran and require support throughout the application and/or recruitment process as a result of your disability, you have the right to request a reasonable accommodation. You can submit your request to AccessibilitySupport@nbcuni.com."
3648906,"Business and Legal Affairs Intern","https://jobs.smartrecruiters.com/NBCUniversal3/744000083431705-business-and-legal-affairs-intern","universal","Sydney","No","Not specified","Internship","2025-09-23T20:25:24.733453Z","Matchbox Pictures is recruiting an intern to be based in either its Sydney or Melbourne office, to support the work of its Business &amp; Legal Affairs (BALA) team. Matchboxs BALA team is involved in a wide variety of legal and business affairs matters relating to the development, production and financing of television programs on the slate of Matchbox Pictures and Tony Ayres Productions.Assisting in the management of the companys Screenrights registrations and related issues.Assisting in the management and data entry for BALA team deal trackers.Assisting with the drafting and execution of chain of title documentation (agreements relating to the development of television projects) and other agreements and related third party correspondence, eg, talent and literary agencies, broadcaster personnel.Assisting with production-related clearances as necessary (with the supervision and guidance of the Matchbox BALA team).Assisting with the maintenance and updating of company template agreements.Conducting legal research on behalf of the Matchbox BALA team, as may be required.Assisting on matters relating to the promotion and distribution of content, including rights information enquiries in relation to the Matchbox library catalogue.Such other tasks and day to day support as may be reasonably required by the Matchbox BALA team in connection with the business of Matchbox and Tony Ayres ProductionsBasic RequirementsProficient in Microsoft Office suite.A strong interest in pursuing a career in legal and business affairs in the television industry.Support oriented, organised, with strong critical-thinking skills and exceptional attention to detail.Able to work under pressure and with tight deadlines, with strong time management skills.Ability to prioritize and effectively communicate to manage expectations around output.Ability to take initiative and work independently.Excellent communication skills and a great team player.This part time role requires a 9-month commitment, from February 2026 - November 2026You also MUST include a cover letter stating the month and year you graduate, why you would like to work for NBCUniversal, and what you feel you can bring to the role.  This is an integral of the application processDesired CharacteristicsAustralian citizen or permanent resident.Completing a final year of tertiary studies in Law, during 2026.Ideal candidates should have a strong interest in a career in business &amp; legal affairs in the television industry.Visa sponsorship is not available for this positionPlease note that future visa sponsorship at NBCUniversal is rarely available for post-graduate employment opportunities.As part of our selection process, external candidates may be required to attend an in-person interview with an NBCUniversal employee at one of our locations prior to a hiring decision. NBCUniversal's policy is to provide equal employment opportunities to all applicants and employees without regard to race, color, religion, creed, gender, gender identity or expression, age, national origin or ancestry, citizenship, disability, sexual orientation, marital status, pregnancy, veteran status, membership in the uniformed services, genetic information, or any other basis protected by applicable law.If you are a qualified individual with a disability or a disabled veteran and require support throughout the application and/or recruitment process as a result of your disability, you have the right to request a reasonable accommodation. You can submit your request to AccessibilitySupport@nbcuni.com."
