"ID","Title","Link","Company","Location","Remote","Experience","EmploymentType","DatePosted","RoleDescription"
3632041,"Category Associate, EU","https://www.wayfair.com/careers/jobs/8175199002?gh_jid=8175199002","Wayfair","Shanghai","No",2,"Full time","2025-09-23T20:25:27.372424Z","About Wayfair
Wayfair is reinventing the way people shop for their homes and our team is tasked with building a best-in-class eCommerce business across our Asia market. In this Category Specialist role, you will work with external partners, our suppliers, and internal cross-functional teams to advance your categorys business agenda and drive strategic business decisions. Category Specialists have ownership of one of multiple of our categories, and of key supplier relationships and make a direct impact on the category and Wayfairs bottom line. You will be expected to define overarching goals and strategy for your category, problem-solve, articulate and execute against tactical plans, and manage key business metrics.
What You'll Do: 

Build strong relationships with existing suppliers and execute negotiations to secure best pricing and promotional support
Analyze data to strategize revenue and profit growth opportunities for the category and for specific supplier partners
Advance catalog expansion, develop relationships with target suppliers
Identify sales, merchandising, and operational opportunities for the category and collaborate with internal teams to drive change (Opeations, Merchandising Advertising, PR, Finance, Customer Service, Business Intelligence)
Analyze and anticipate competitor marketing, selection, and pricing strategy
Attend trade shows and/or travel to meet key suppliers

What You'll Need:

A Bachelors Degree in Business or a related field
2+ years experience in either ecommerce, sourcing, or supply-side sales is preferred 
Good level of English, reading/writing English fluency is required, high verbal fluency is preferred but not required   
Excellent Excel and PowerPoint expertise; readiness to work with data using Excel, SQL, Tableau and other tools
Articulate and persuasive communication skills, both written and verbal
A track record of successful negotiation and relationship management skills
Innovative problem-solving skills; a demonstrated ability to dissect and determine root causes of problems and implement solutions
A structured, proactive  approach to your work, eager to progress professionally and motivated to drive business growth
Proven ability to thrive as part of a team and also to work autonomously
Demonstrated ability to work within a fast-paced and rapidly changing environment

 About Wayfair Inc.
Wayfair is one of the worlds largest online destinations for the home. Whether you work in our global headquarters in Boston, or in our warehouses or offices throughout the world, were reinventing the way people shop for their homes. Through our commitment to industry-leading technology and creative problem-solving, we are confident that Wayfair will be home to the most rewarding work of your career. If youre looking for rapid growth, constant learning, and dynamic challenges, then youll find that amazing career opportunities are knocking.
No matter who you are, Wayfair is a place you can call home. Were a community of innovators, risk-takers, and trailblazers who celebrate our differences, and know that our unique perspectives make us stronger, smarter, and well-positioned for success. We value and rely on the collective voices of our employees, customers, community, and suppliers to help guide us as we build a better Wayfair  and world  for all. Every voice, every perspective matters. Thats why were proud to be an equal opportunity employer. We do not discriminate on the basis of race, color, ethnicity, ancestry, religion, sex, national origin, sexual orientation, age, citizenship status, marital status, disability, gender identity, gender expression, veteran status, genetic information, or any other legally protected characteristic.
Your personal data is processed in accordance with our Candidate Privacy Notice (https://www.wayfair.com/careers/privacy). If you have any questions or wish to exercise your rights under applicable privacy and data protection laws, please contact us at dataprotectionofficer@wayfair.com."
3626821,"Strategy & Execution Manager","https://www.wayfair.com/careers/jobs/8175223002?gh_jid=8175223002","Wayfair","Boston","No",5,"Full time","2025-09-23T20:25:27.372438Z","The salary range for this position is $99,000 - $110,000 per year. The base salary offered may vary depending on location, job-related knowledge, skills, and experience. Restricted stock units will be provided as part of the compensation package.Must be onsite in Boston, MA (Monday-Thursday)Wayfair is seeking a highly motivated manager to lead Physical Retail Strategy &amp; Execution for our Specialty Retail Brands. This role will be instrumental in shaping the future of how customers engage with our Speciality Retail Brands and offering. You'll be responsible for developing and executing on a comprehensive roadmap, spearheading innovative projects, and partnering with teams like store leadership, tech, and analytics to improve the customer and store associate experience. This role comes with the potential to build the team out more as the business grows. 
What You'll Do

Strategic Roadmapping: Develop and execute a roadmap of actionable, data-backed initiatives to grow store top line, identifying key opportunities for growth, market differentiation, and customer experience enhancements. This includes defining new service offerings, technology requirements, and operational efficiencies. 
Cross-Functional Collaboration: Partner closely with various teams, including merchants, planning &amp; assortment, analytics, and marketing to ensure seamless execution of strategic initiatives. You'll be the central point of contact for all growth initiatives, driving alignment and accountability across departments.
Field Support: Support associates and managers in the field by developing a deep understanding of store processes and pain points, clearing roadblocks, and providing feedback on store performance. Business Performance Management: Monitor and analyze key performance indicators (KPIs) to assess the health and growth of each store. You'll identify trends, pinpoint areas for improvement, and implement data-driven strategies to optimize performance.
Market &amp; Customer Insights: Stay abreast of industry trends, competitive landscapes, and evolving customer needs in the home furnishing and physical retail space. Translate these insights into actionable strategies to grow our retail business.

What You'll Need

5+ years of experience in business development, strategy, operations, or a related field, with a proven track record of driving growth in a fast-paced environment.
Prior experience with physical retail a plus
Demonstrated ability to develop and execute strategic roadmaps, with a strong understanding of how to translate vision into actionable plans.
Exceptional cross-functional collaboration skills, with the ability to influence and align diverse stakeholders.
Strong analytical and problem-solving abilities, with a data-driven approach to decision-making.
Excellent communication and presentation skills, with the ability to articulate complex ideas clearly and concisely to all levels of the organization.

An Important Note about Wayfair's In-Office Policy: All Boston-based interns, Co-ops, and corporate employees will be in office in a hybrid capacity. Employees will work in the office on designated days, Monday - Thursday, and work remotely Friday.
Massachusetts Applicants: I understand that it is unlawful in Massachusetts to require or administer a lie detector test as a condition of employment or continued employment. An employer who violates this law shall be subject to criminal penalties and civil liability.
At this time, Wayfair will not sponsor applicants for employment authorization for this position for the following work visas: F1-OPT, STEM OPT EAD, H-1B, H-1B1, E-3, O-1, J-1, or TN.About Wayfair Inc.
Wayfair is one of the worlds largest online destinations for the home. Whether you work in our global headquarters in Boston, or in our warehouses or offices throughout the world, were reinventing the way people shop for their homes. Through our commitment to industry-leading technology and creative problem-solving, we are confident that Wayfair will be home to the most rewarding work of your career. If youre looking for rapid growth, constant learning, and dynamic challenges, then youll find that amazing career opportunities are knocking.
No matter who you are, Wayfair is a place you can call home. Were a community of innovators, risk-takers, and trailblazers who celebrate our differences, and know that our unique perspectives make us stronger, smarter, and well-positioned for success. We value and rely on the collective voices of our employees, customers, community, and suppliers to help guide us as we build a better Wayfair  and world  for all. Every voice, every perspective matters. Thats why were proud to be an equal opportunity employer. We do not discriminate on the basis of race, color, ethnicity, ancestry, religion, sex, national origin, sexual orientation, age, citizenship status, marital status, disability, gender identity, gender expression, veteran status, genetic information, or any other legally protected characteristic.
Your personal data is processed in accordance with our Candidate Privacy Notice (https://www.wayfair.com/careers/privacy). If you have any questions or wish to exercise your rights under applicable privacy and data protection laws, please contact us at dataprotectionofficer@wayfair.com."
3626820,"Senior Associate of Retail Sales Strategy","https://www.wayfair.com/careers/jobs/8175178002?gh_jid=8175178002","Wayfair","Boston","No",3,"Full time","2025-09-23T20:25:27.372451Z","Senior Associate of Retail Sales Strategy
""This role is based in Boston, MA""
The base pay for this position is $83,500 - $92,500 per year. The base pay offered may vary depending on location, job-related knowledge, skills, and experience. 
 
Wayfairs Physical Retail Team is seeking a Senior Associate of Retail Sales Strategy to support Wayfairs physical retail growth and long term support. The Senior Associate of Retail Sales Strategy will be a part of the Store Operations team that will help craft the Wayfair customer experience playbook to stand up and scale stores across North America.
The Senior Associate of Retail Sales Strategy will work with their leadership team to support in store selling behaviors and activations that lead to increased revenue for both our large format stores and smaller specialty brands locations.
This role will work cross-functionally across the organization both with home office partners, store field support, and store teams to create executable strategies, provide coaching and maintain ongoing communication with the stores teams for the supported programs.
This role is based in Boston and reports to the Senior Manager of Front of House Operations, who is seeking a highly motivated, forward thinking, detail oriented collaborator who will drive execution and delivery of the customer and associate experience. As the retail portfolio grows you should expect to support an increasing number of physical retail stores and offerings.
What youll do:Drive the business by identifying and coaching to selling behaviors within the portfolio of physical retail storesDevelop &amp; maintain effective training with the learning and development team that enhances the customer experience and positively impacts sales growth and operational skills.  Support project initiatives by building materials, creating a rollout timeline, following up on adoption and tracking milestones. Gather best practices from competitor analysis to improve our in store offeringsShare insights from the field to support the development of long term business strategiesWork cross functionally in partnership with internal partners of sales channels to effectively align on the ideal customer in store experience, particular focus on specialized sales categoriesMaintain store KPIs for sales floor experience touch points (ie YoY sales, customer acquisition, conversion, etc)Support attachment service business like protection plan, rewards programs, and financing to drive additional revenue Develop long term replicable playbooks to drive sales during promotional activations and high velocity selling. Collaborate with our B2B partners and Design Services teams to ensure a seamless in store experience for customers and associates.   
What youll need:3+ years physical retail experience required, with strong retail operations and selling knowledge preferred. Experience with coaching and training to drive salesPreferred experience with an omni channel sales processExcellent communication skills, with demonstrated ability to launch initiativesAbility to motivate and educate store leaders in order to drive results by building and maintaining strong relationshipsAbility to execute strategy and provide feedback to bring best in class experience to lifeThrives in a high-growth, ambiguous environment with competing prioritiesAbout Wayfair Inc.
Wayfair is one of the worlds largest online destinations for the home. Whether you work in our global headquarters in Boston, or in our warehouses or offices throughout the world, were reinventing the way people shop for their homes. Through our commitment to industry-leading technology and creative problem-solving, we are confident that Wayfair will be home to the most rewarding work of your career. If youre looking for rapid growth, constant learning, and dynamic challenges, then youll find that amazing career opportunities are knocking.
No matter who you are, Wayfair is a place you can call home. Were a community of innovators, risk-takers, and trailblazers who celebrate our differences, and know that our unique perspectives make us stronger, smarter, and well-positioned for success. We value and rely on the collective voices of our employees, customers, community, and suppliers to help guide us as we build a better Wayfair  and world  for all. Every voice, every perspective matters. Thats why were proud to be an equal opportunity employer. We do not discriminate on the basis of race, color, ethnicity, ancestry, religion, sex, national origin, sexual orientation, age, citizenship status, marital status, disability, gender identity, gender expression, veteran status, genetic information, or any other legally protected characteristic.
Your personal data is processed in accordance with our Candidate Privacy Notice (https://www.wayfair.com/careers/privacy). If you have any questions or wish to exercise your rights under applicable privacy and data protection laws, please contact us at dataprotectionofficer@wayfair.com."
3626819,"Senior Analyst, Global Delivery Performance Management","https://www.wayfair.com/careers/jobs/8175147002?gh_jid=8175147002","Wayfair","Boston","No",3,"Full time","2025-09-23T20:25:27.372464Z","The base salary for this position is $104,500 - 118,250 per year. The base salary offered may vary depending on location, job-related knowledge, skills, and experience.
At this time, Wayfair does not provide sponsorship for employment authorization for this position.
The Global Performance Management team is looking for advanced analytical, action-oriented, and collaborative individuals that can translate business problems to actionable insights and data driven solutions to influence operational results. Successful individuals in this role excel at both qualitative and quantitative analysis while also being eager to communicate upward and outward to tell a concise story.  
The Global Performance Management team within Transportation &amp; Delivery (T&amp;D) is responsible for improving all areas of business with accurate and dependable reporting. To do so, we leverage an end-to-end view of the supply chain and use data to identify key opportunity areas, build business cases, and work with partners in operations on implementation. We also manage the data infrastructure for the T&amp;D team and partner with upstream teams to maintain sources of truths and metric definitions. 
What You'll Do

Perform analysis across large data sets to develop performance insights and highlight operational opportunities. 
Develop key metrics and reporting to measure how initiatives are improving Wayfairs performance and enabling our team to easily identify trends, root causes and develop targeted action plans.
Leverage a deep understanding of Supply Chain principles to design new initiatives aimed at improving the speed and/or capabilities of Wayfairs delivery network.
Leverage critical thinking and data handling to examine and challenge existing practices, identify opportunities for improvement, and gain buy-in from stakeholders on proposals.
Collaborate with cross-functional partners in Operations and Tech to support the rollout of new operational initiatives and/or tech capabilities. 
Ensure that there is strong alignment between Wayfairs business objectives and our data-driven strategies.
Conduct thorough ad-hoc analysis.
Build dashboards to translate large data sets into driving insights and action.
Monitor KPIs and assess how were making progress against business objectives and occasionally present findings to senior leadership.

What You'll Need 

Master's with 1-2 years of experience or Bachelors degree with 3-4 years of experience.
Advanced experience with Microsoft Excel or Google Sheets, SQL or GBQ, and data visualization tools such as Google Data Studio (Looker, Tableau, or PowerBI).
Experience in Supply Chain and/or E-Commerce is a plus.
Excellent communication, both written and verbally.
Collaborative mindset that thrives as part of a team.
Data and process-oriented, demonstrated ability to continuously learn new tools.
High attention to detail and thorough attention to data integrity to deliver trusted insights.
Proven ability to manage multiple, competing priorities simultaneously.
Ability to navigate an environment of continuous improvement working through ambiguity in an evolving organization.

An Important Note about Wayfair's In-Office Policy:

All Boston-based interns, Co-ops, and corporate employees will be in office in a hybrid capacity. Employees will work in the office on designated days, Monday - Thursday, and work remotely Friday.

Massachusetts Applicants: 

I understand that it is unlawful in Massachusetts to require or administer a lie detector test as a condition of employment or continued employment. An employer who violates this law shall be subject to criminal penalties and civil liability.
About Wayfair Inc.
Wayfair is one of the worlds largest online destinations for the home. Whether you work in our global headquarters in Boston, or in our warehouses or offices throughout the world, were reinventing the way people shop for their homes. Through our commitment to industry-leading technology and creative problem-solving, we are confident that Wayfair will be home to the most rewarding work of your career. If youre looking for rapid growth, constant learning, and dynamic challenges, then youll find that amazing career opportunities are knocking.
No matter who you are, Wayfair is a place you can call home. Were a community of innovators, risk-takers, and trailblazers who celebrate our differences, and know that our unique perspectives make us stronger, smarter, and well-positioned for success. We value and rely on the collective voices of our employees, customers, community, and suppliers to help guide us as we build a better Wayfair  and world  for all. Every voice, every perspective matters. Thats why were proud to be an equal opportunity employer. We do not discriminate on the basis of race, color, ethnicity, ancestry, religion, sex, national origin, sexual orientation, age, citizenship status, marital status, disability, gender identity, gender expression, veteran status, genetic information, or any other legally protected characteristic.
Your personal data is processed in accordance with our Candidate Privacy Notice (https://www.wayfair.com/careers/privacy). If you have any questions or wish to exercise your rights under applicable privacy and data protection laws, please contact us at dataprotectionofficer@wayfair.com."
