"ID","Title","Link","Company","Location","Remote","Experience","EmploymentType","DatePosted","RoleDescription"
3635183,"Talent Associate Intern - Summer 2026","https://www.wayfair.com/careers/jobs/8160473002?gh_jid=8160473002","Wayfair","Boston","No","Not specified","Internship","2025-09-23T20:25:27.372168Z","Talent Associate Intern - Summer 2026
Program Dates: June 1 - August 7, 2026 OR June 1 - August 21, 2026
The base pay for this position is $25 per hour
This is a Boston based opportunity with a 4 day in office expectation (Monday - Thursday) with 1 day remote (Friday)
At this time, Wayfair will not sponsor applicants for employment authorization for this position for the following work visas: STEM OPT EAD, H-1B, H-1B1, E-3, O-1, J-1, or TN
 
Who We Are: 
Wayfair believes that our people are our greatest asset and biggest differentiator. As Wayfair grows, so too does the need to ensure our talent strategy and approach is best in class.  Wayfairs Talent organization is critical to the companys overall success. Our teams include Talent Acquisition, Talent Management, Talent Relations, Culture and Inclusion, and Learning &amp; Development, all of which work together to drive the strategic roadmap for how Wayfair attracts, develops, engages, and retains our workforce. Whether recruiting our newest Wayfairians, creating a best-in-class employee experience and culture, or building core training and talent development programs, youll have the opportunity to have a direct impact on Wayfairs most important asset: its people. 
By applying for this role, you may be considered for placement within the following teams: Talent Acquisition, Talent Management, Talent Relations, Culture and Inclusion, and Learning &amp; Development. Placement will be determined through the application and interview process and is dependent on a combination of interest, skills, and experience.
What Youll Do:

Collaborate effectively with cross-functional stakeholders on challenges related to the hiring, development, and engagement of Wayfair's workforce
Use creative skills to innovate &amp; improve approaches to recruiting, learning, and performance management that work toward building the best team
Use data and good judgment to inform decisions around hiring, learning offerings, and/or people policies and procedures
Communicate effectively with key partners and stakeholders such as business leaders, new hires, and hiring managers
Exercise strong organizational and prioritization skills to deliver results and solutions to human capital challenges

What Youll Need: 
Basic Qualifications: 

Currently pursuing a Bachelors or higher with the expectation that degree will be obtained between December 2026 and Summer 2027 with a 3.0 GPA minimum.
Must be returning to the course of study following completion of the internship.
Ability to commit to working 40 hours/week (9am-5pm, Monday-Friday) from June 1  - August 7, 2026  in our Boston office.
You must be authorized to work in the United States without visa sponsorship by Wayfair now or in the future. 

Preferred Qualifications:

A desire to win and drive collaboration cross functionally
Analytical and process-oriented, comfortable learning data analysis tools
Ability to hit the ground running - a confident self-starter
Excellent communication skills, both written and verbal
Superior and innovative problem-solving skills
Proven ability to thrive as part of a team or individually
An entrepreneurial spirit and mindset
Comfortable in a fast-paced, dynamic environment
Positive and energetic attitude
Strong comfort level and appetite to use AI in daily workflow
Willingness to be flexible and take responsibility for multiple and changing tasks as necessary

Possible Team Placements Include:
Corporate Communications: Our Corporate Communications team focuses on driving one cohesive company narrative that positively positions Wayfair to external and internal audiences by developing, sharing and amplifying company stories to build trust with target audiences.
Employee Resource Center (ERC): The ERC is a global centralized services team that assists employees for a variety of reasons ranging from leave of absence or accommodation requests, questions related to benefits, I-9 completion, Workday issues, Wayferrals, internal mobility, etc. The ERC also partners closely with stakeholders for processes such as terminations, unemployment, interview scheduling and HRIS reorganizations.
Talent for Technology: The Tech Talent Team is the strategic partner to Wayfairs entire technology organization. We empower our tech teams by designing and scaling programs that attract, grow, and retain the innovative minds who build the future of Wayfair. As architects of the tech employee experience, we ensure our peopleour greatest assetcan build impactful careers and solve our customers' most complex challenges.
Commercial &amp; Operations, and Enterprise Talent: The Commercial &amp; Operations, and Enterprise Talent team helps our business leaders with aligning their people strategy to their goals. We work to understand their unique talent needs, from hiring and training to creating a supportive work environment, all to help our Commercial &amp; Operations, and Enterprise teams succeed. We focus on finding candidates who meet a high bar for performance, potential, and cultural fit
Why Youll Love Wayfair:
Wayfair was selected as a top 100 Internship program for 2025 by Yello &amp; WayUp! We take pride in delivering a best in-class experience! Our 10-week summer internship program is designed to give you a feel for what it would be like to work at Wayfair as a full-time employee. Youll be assigned real projects and contribute directly to your teams goals and objectives.
Throughout the Internship Program, we provide interns with the opportunity to engage in social and community building activities including:

A calendar of intern events including social networking, professional development and a leadership dialogue series
Formalized mentorship program along with an assigned reporting manager for impactful professional development and feedback
Skills-based training
Dialogue events with senior leaders to provide a holistic view of all functions at Wayfair
Coffee chat opportunities for interns to get to know one another 
Volunteer opportunities
Intern-wide innovation project designed to teach interns skills for handling ambiguous business problems
Intern Appreciation Day celebration
Events throughout Boston which allow interns to explore what the city has to offer including a Red Sox game, and Boston Harbor boat cruise.

Purpose &amp; Inclusion at Wayfair:At Wayfair, we pride ourselves on fostering an environment where every individual experiences a fair and equitable employee journey. We are committed to developing targeted resources that raise awareness around inclusion and eliminate barriers, ensuring Wayfair provides a fair and inclusive workplace experience for everyone.Social Impact &amp; Responsibility:At Wayfair, we focus on helping people on their journey to home - specifically those who have lost their way from home. We do this by leveraging our best assets, such as collaborating with leading nonprofit organizations, coordinating in-kind product donations, empowering our employees to get involved through paid volunteer time off programs, and encouraging our customers to donate. This multi-faceted approach allows us to support communities in need in authentic ways that align with Wayfair's broader mission of helping everyone, anywhere create their sense of home.About Wayfair Inc.
Wayfair is one of the worlds largest online destinations for the home. Whether you work in our global headquarters in Boston, or in our warehouses or offices throughout the world, were reinventing the way people shop for their homes. Through our commitment to industry-leading technology and creative problem-solving, we are confident that Wayfair will be home to the most rewarding work of your career. If youre looking for rapid growth, constant learning, and dynamic challenges, then youll find that amazing career opportunities are knocking.
No matter who you are, Wayfair is a place you can call home. Were a community of innovators, risk-takers, and trailblazers who celebrate our differences, and know that our unique perspectives make us stronger, smarter, and well-positioned for success. We value and rely on the collective voices of our employees, customers, community, and suppliers to help guide us as we build a better Wayfair  and world  for all. Every voice, every perspective matters. Thats why were proud to be an equal opportunity employer. We do not discriminate on the basis of race, color, ethnicity, ancestry, religion, sex, national origin, sexual orientation, age, citizenship status, marital status, disability, gender identity, gender expression, veteran status, genetic information, or any other legally protected characteristic.
Your personal data is processed in accordance with our Candidate Privacy Notice (https://www.wayfair.com/careers/privacy). If you have any questions or wish to exercise your rights under applicable privacy and data protection laws, please contact us at dataprotectionofficer@wayfair.com."
3635182,"Talent Associate Co-op - January 2026 ","https://www.wayfair.com/careers/jobs/8160527002?gh_jid=8160527002","Wayfair","Boston","No","Not specified","Internship","2025-09-23T20:25:27.372182Z","Program Dates: January 5, 2026 - June 19, 2026
The base pay for this position is $23 per hour
This is a Boston based opportunity with a 4 day in office expectation (Monday - Thursday) with 1 day remote (Friday)
At this time, Wayfair will not sponsor applicants for employment authorization for this position for the following work visas: STEM OPT EAD, H-1B, H-1B1, E-3, O-1, J-1, or TN
 
Who We Are:
Wayfair's Talent team comprises several areas (see potential team placement options below) which collaborate to support how we attract, develop, and retain Wayfair's workforce of 10,000+ global employees. Everyday, the Talent team works with key stakeholders across the organization to accelerate Wayfairs success by enabling our people to deliver their best work everyday. As a Co-op in this department, you will have the opportunity to add value by driving projects, working with a diverse group of people and diving into complex problems. 
What Youll Do:

Collaborate effectively with cross-functional stakeholders on challenges related to the hiring, development, and/or engagement of Wayfair's workforce
Use creative skills to innovate &amp; improve approaches to recruiting, learning, and/or performance management to build the best team
Use data and good judgment to inform decisions around hiring, learning offerings, and/or people policies and procedures
Communicate effectively with key partners and stakeholders such as business leaders, new hires, and managers
Exercise strong organizational and prioritization skills to deliver results and solutions to human capital challenges

What Youll Need:
Basic Qualifications:

A student pursuing an undergraduate degree graduating between December 2026 - May 2029 with a 3.0 GPA minimum. 
Must be returning to the course of study following completion of the Co-op
Ability to commit to working 40 hours/week (9am-5pm, Monday-Friday) from January 5 to June 19, 2026 in our Boston office 
Authorization to work in the United States without visa sponsorship by Wayfair now or in the future. Visa sponsorship includes the following work visas: STEM OPT EAD, H-1B, H-1B1, E-3, O-1, J-1, or TN.

Preferred Qualifications:

A desire to win and drive collaboration cross functionally
Analytical and process-oriented, comfortable learning data analysis tools
Ability to hit the ground running - a confident self-starter
Excellent communication skills, both written and verbal
Superior and innovative problem-solving skills
Proven ability to thrive as part of a team and individually
An entrepreneurial spirit and mindset
Comfortable in a fast-paced, dynamic environment
Strong comfort level and appetite to use AI in daily workflow
Willingness to be flexible and take responsibility for multiple and changing tasks as necessary

Possible Team Placements Include:
Corporate Communications: Our Corporate Communications team focuses on driving one cohesive company narrative that positively positions Wayfair to external and internal audiences by developing, sharing and amplifying company stories to build trust with target audiences.
Corporate Travel: The Corporate Travel team is a high touch customer facing team that will allow you to foster relationships with both internal &amp; external partners. You will be able to own projects and help build processes to support colleagues within the corporate travel and community experience programs.
Campus &amp; Early Careers Recruiting: The Wayfair Campus and Early Careers team is crucial to the company's success and ongoing growth. Our recruiters are strategic business partners, dedicated to attracting and hiring exceptional entry-level talent for every department. We focus on finding candidates who meet a high bar for performance, potential, and cultural fit.
Purpose &amp; Inclusion: Our Purpose &amp; Inclusion team is here to enable a Wayfair culture where every employee, future and present, is seen, valued, and invited to contribute to a thriving global community centered around the creation of home. This team engages with leaders to grow their commitment and collaboration, develops education programs and awareness, and builds the right infrastructure to support our work.
Why Youll Love Wayfair:
Throughout the Co-op Program, we provide co-ops with the opportunity to engage in social and community building activities including:

A calendar of events including social networking, professional development, and dialogue events with senior leaders
Formalized mentorship program along with an assigned reporting manager for impactful professional development and feedback
Skills-based training
Coffee chat opportunities for co-ops to get to know one another 

Purpose &amp; Inclusion at Wayfair:At Wayfair, we pride ourselves on fostering an environment where every individual experiences a fair and equitable employee journey. We are committed to developing targeted resources that raise awareness around inclusion and eliminate barriers, ensuring Wayfair provides a fair and inclusive workplace experience for everyone.Social Impact &amp; Responsibility:At Wayfair, we focus on helping people on their journey to home - specifically those who have lost their way from home. We do this by leveraging our best assets, such as collaborating with leading nonprofit organizations, coordinating in-kind product donations, empowering our employees to get involved through paid volunteer time off programs, and encouraging our customers to donate. This multi-faceted approach allows us to support communities in need in authentic ways that align with Wayfair's broader mission of helping everyone, anywhere create their sense of home.About Wayfair Inc.
Wayfair is one of the worlds largest online destinations for the home. Whether you work in our global headquarters in Boston, or in our warehouses or offices throughout the world, were reinventing the way people shop for their homes. Through our commitment to industry-leading technology and creative problem-solving, we are confident that Wayfair will be home to the most rewarding work of your career. If youre looking for rapid growth, constant learning, and dynamic challenges, then youll find that amazing career opportunities are knocking.
No matter who you are, Wayfair is a place you can call home. Were a community of innovators, risk-takers, and trailblazers who celebrate our differences, and know that our unique perspectives make us stronger, smarter, and well-positioned for success. We value and rely on the collective voices of our employees, customers, community, and suppliers to help guide us as we build a better Wayfair  and world  for all. Every voice, every perspective matters. Thats why were proud to be an equal opportunity employer. We do not discriminate on the basis of race, color, ethnicity, ancestry, religion, sex, national origin, sexual orientation, age, citizenship status, marital status, disability, gender identity, gender expression, veteran status, genetic information, or any other legally protected characteristic.
Your personal data is processed in accordance with our Candidate Privacy Notice (https://www.wayfair.com/careers/privacy). If you have any questions or wish to exercise your rights under applicable privacy and data protection laws, please contact us at dataprotectionofficer@wayfair.com."
3635181,"Senior Product Manager, Promotions & Pricing","https://www.wayfair.com/careers/jobs/8177219002?gh_jid=8177219002","Wayfair","Boston","No",6,"Full time","2025-09-23T20:25:27.372195Z","An Important Note about Wayfair's In-Office Policy and Salary: 
Please note that this is a hybrid role based in Boston, and will require you to work in the office on Tuesdays, Wednesdays, and Thursdays.
The salary range for this position is $161,000 - $172,500 per year. The base salary offered may vary depending on location, job-related knowledge, skills, and experience. Restricted stock units will be provided as part of the compensation package.
Who We Are
Wayfair believes everyone deserves a home they love, and that furnishing your home should be a source of fun, not anxiety. Our Product team plays a crucial role in making this vision a reality for millions of people around the world. Partnering with Engineering, Analytics, Design, and business leaders across Wayfair, our Product team ensures were building technology that solves important customer problems in elegant, scalable, measurable ways.
Were tackling a wide array of fascinating, incredibly difficult problems  like helping a massive, rapidly growing global customer base efficiently find the perfect products from our catalog of &gt;10M items. We have a modern tech stack including sophisticated capabilities around AI, data science, multivariate testing and personalization. And were a highly collaborative, supportive team that values learning, psychological safety and intentional career development.
The Promotions &amp; Pricing team owns the platform and front-end experiences that power Wayfairs promotional events &amp; on-site pricing experience. We are responsible for building the tools, services and customer-facing features that make events like Way Day, Black Friday/Cyber Monday, and monthly sale events possible. Our mission is to create scalable platforms that empower internal stakeholders to run world-class promotions while ensuring our customers enjoy compelling, intuitive, and value-driven shopping experiences.
What Youll Do

Define &amp; Drive Roadmaps: Partner closely with business stakeholders to create roadmaps that balance platform scalability with delightful customer experiences.
Build for Both Internal Users &amp; Our Customers: Translate the needs of both Wayfair customers and internal teams into requirements that improve workflows &amp; on-site experiences.
Product Requirements &amp; Delivery: Author PRDs &amp; collaborate with design and engineering to deliver new features, enhancements, and platform capabilities that support promotions &amp; pricing.
Own Promotion &amp; Offer Enablement: Support &amp; optimize the tools, systems and processes that enable Wayfairs biggest promotional events, ensuring reliable execution by the business and continuous improvement.
Data-Driven Problem Solving: Leverage qualitative &amp; quantitative insights to identify opportunities, break down complex problems, and measure the impact of product initiatives.
Full-Stack Product Leadership: Operate across platform &amp; front-end product domains  from backend systems that power promotions to customer-facing experiences that drive engagement.
Cross-Functional Leadership: Work with engineering, design, analytics, and commercial partners to align on priorities, deliver results, and advocate for the promotions &amp; pricing experience within the broader Wayfair ecosystem.

Were A Match Because You Have

6+ years of product management experience, ideally in e-commerce or platform products.
Proven track record of building &amp; scaling impactful platform &amp; customer-facing products.
Strong analytical skills with the ability to use data (SQL, Looker, BigQuery) to drive decisions.
Experience balancing backend platform development with intuitive front-end experiences.
Familiarity with A/B testing, experimentation, and agile development practices.
Excellent communication &amp; stakeholder management skills, with the ability to influence cross-functional teams &amp; business leadership, and translate complex technical concepts to non-technical audiences.
Customer-first mindset &amp; empathy for both customers &amp; internal stakeholders.
Bachelors degree in Computer Science, Engineering, Business, or related field (advanced degree preferred).

Why Youll Love Wayfair:

Time Off:

Paid Holidays
Paid Time Off (PTO)

Health &amp; Wellness:

Full Health Benefits (Medical, Dental, Vision, HSA/FSA)
Life Insurance
Disability Protection (Short Term &amp; Long Term Disability) 
Global Wellbeing: Gym/Fitness discounts (including US Peloton, Global ClassPass, and various regional gym memberships)
Mental Health Support (Global Mental Health, Global Wayhealthy Recordings)
Caregiver Services

Financial Growth &amp; Security:

401K Matching (Employee Matching Program)
Tuition Reimbursement 
Financial Health Education (Knowledge of Financial Education - KOFE)
Tax Advantaged Accounts

Family Support:

Family Planning Support
Parental Leave
Global Surrogacy &amp; Adoption Policy

Professional Development &amp; Recognition:

Rewards &amp; Recognition 
Global Employee Anniversary Awards 
Paid Volunteer Work 

Unique Perks:

Employee Discount 
U.S. Bluebikes Membership
Global Pod Outings

Work/Life Balance:

Emphasizing a supportive &amp; flexible work environment that encourages a balance between personal and professional commitments 


We are looking forward to your application!About Wayfair Inc.
Wayfair is one of the worlds largest online destinations for the home. Whether you work in our global headquarters in Boston, or in our warehouses or offices throughout the world, were reinventing the way people shop for their homes. Through our commitment to industry-leading technology and creative problem-solving, we are confident that Wayfair will be home to the most rewarding work of your career. If youre looking for rapid growth, constant learning, and dynamic challenges, then youll find that amazing career opportunities are knocking.
No matter who you are, Wayfair is a place you can call home. Were a community of innovators, risk-takers, and trailblazers who celebrate our differences, and know that our unique perspectives make us stronger, smarter, and well-positioned for success. We value and rely on the collective voices of our employees, customers, community, and suppliers to help guide us as we build a better Wayfair  and world  for all. Every voice, every perspective matters. Thats why were proud to be an equal opportunity employer. We do not discriminate on the basis of race, color, ethnicity, ancestry, religion, sex, national origin, sexual orientation, age, citizenship status, marital status, disability, gender identity, gender expression, veteran status, genetic information, or any other legally protected characteristic.
Your personal data is processed in accordance with our Candidate Privacy Notice (https://www.wayfair.com/careers/privacy). If you have any questions or wish to exercise your rights under applicable privacy and data protection laws, please contact us at dataprotectionofficer@wayfair.com."
