"ID","Title","Link","Company","Location","Remote","Experience","EmploymentType","DatePosted","RoleDescription"
3648163,"Manager, Key Account Management","https://www.wayfair.com/careers/jobs/8179084002?gh_jid=8179084002","Wayfair","Shanghai","No","Not specified","Full time","2025-09-23T20:25:27.371818Z","Who We Are
CastleGate Forwarding (CGF) is a rapidly growing full-service Non-Vessel Operating Common Carrier (NVOCC) offering scalable solutions for businesses of all sizes. With a global network and a commitment to excellence, we provide comprehensive services to streamline your shipping process, reduce costs, and enhance customer satisfaction
This role is a suppliers facing role and owns the suppliers relationship with CastleGate Forwarding. 
 
What Youll Do
As a key account manager, you will be primarily responsible for:

Lead a key WGS category of suppliers and partner with category leaders through regular meetings to share logistics insights.
Manage the performance and growth of a set portfolio of suppliers at a vertical and category level
Develop and leverage Account Management tools such as scorecards, dashboards, KPI reports to encourage continued improvement and strengthen partnership
Own the supplier experience and drive improvements to NPS (i.e. supplier satisfaction) across the supplier portfolio through strong operational partnerships
Able to design a sales plan to manage suppliers within the categories, execute it effectively, and deliver results.
Identify opportunities and collaborate with various cross functional teams for internal process improvements based on supplier feedback and bottlenecks
Support operational strategy and innovation to drive business goals for revenue, operational performance, and profitability.
Demonstrates good judgment in taking the right actions to support supplier needs while protecting CGFs interests
Has strong commercial acumen and effective sales pitch skills to promote the full range of CG package products

What Youll Need

Bachelors degree required  and a minimum of 7 years in transportation customer service, account management and/or customer success, operations, logistics or a supply chain environment. 
Significant experience in key account management ideally in the logistics/transportation industry with a strong operational background
Excellent written and verbal communication skills  confident, concise, and ability to influence internal/external partners as well as leadership
Experience in building strong customer relationships and engaging in high-level discussions with management teams
Collaborative self-starter who is able to work in a fast-paced environment with a certain level of ambiguity
Ability to lead through influence and work effectively with people in a cross-functional environment
People management experience preferred, with the ability to lead a team, drive overall performance, and conduct regular coaching sessions.
About Wayfair Inc.
Wayfair is one of the worlds largest online destinations for the home. Whether you work in our global headquarters in Boston, or in our warehouses or offices throughout the world, were reinventing the way people shop for their homes. Through our commitment to industry-leading technology and creative problem-solving, we are confident that Wayfair will be home to the most rewarding work of your career. If youre looking for rapid growth, constant learning, and dynamic challenges, then youll find that amazing career opportunities are knocking.
No matter who you are, Wayfair is a place you can call home. Were a community of innovators, risk-takers, and trailblazers who celebrate our differences, and know that our unique perspectives make us stronger, smarter, and well-positioned for success. We value and rely on the collective voices of our employees, customers, community, and suppliers to help guide us as we build a better Wayfair  and world  for all. Every voice, every perspective matters. Thats why were proud to be an equal opportunity employer. We do not discriminate on the basis of race, color, ethnicity, ancestry, religion, sex, national origin, sexual orientation, age, citizenship status, marital status, disability, gender identity, gender expression, veteran status, genetic information, or any other legally protected characteristic.
Your personal data is processed in accordance with our Candidate Privacy Notice (https://www.wayfair.com/careers/privacy). If you have any questions or wish to exercise your rights under applicable privacy and data protection laws, please contact us at dataprotectionofficer@wayfair.com."
3648162,"Manager, Freight Sales","https://www.wayfair.com/careers/jobs/8181540002?gh_jid=8181540002","Wayfair","Shanghai","No",2,"Full time","2025-09-23T20:25:27.371891Z","Wayfair is seeking a highly motivated and results-oriented Sales Agent to drive the adoption and growth of end to end Integrated Logistics using Castle Gate, including Freight Forwarding, drayage Multichannel and 3PL offerings. In this role, you will be responsible for identifying and engaging with potential customers, articulating the value proposition of our services, closing new business and building the relationship with stakeholders. You will play a critical role in expanding Wayfair's presence in the logistics space and contributing to the success of our CastleGate Fulfillment program.
Responsibilities:

Sales Execution:

Conduct outbound sales efforts to generate new leads and identify potential customers for the entire E2E logistics service, Castle Gate, Multichannel and 3PL services, ocean freight, drayage etc.
Manage a pipeline of prospective customers, from initial contact to deal closure.
Present Wayfair's E2E Logistics service package to enable more Multichannel and 3PL offerings, highlighting competitive advantages such as speed, service levels, and cost-effectiveness.
Work with customers to understand their current logistics challenges and demonstrate how Wayfair's solutions can address their needs.
Negotiate and close contracts for Multichannel and 3PL services.
Drive volume commitments from customers to meet and exceed sales targets.

Supplier Engagement &amp; Support:

Gather and relay supplier feedback on rate cards, service levels, and competitive offerings to internal teams.
Address supplier questions and concerns regarding tracking, packing slips, and other operational aspects.
Collaborate with the CastleGate Product team to identify and resolve supplier-surfaced gaps in the offerings.
Educate customers on the benefits of our ""all-in"" rates compared to base rates quoted by 3PLs.
Emphasize Wayfair's higher level of shipping service compared to competitive 3PLs.

Market Intelligence:

Stay informed about competitive responses from other major retailers (e.g., Amazon, Walmart) in the fulfillment space.
Collect and vet competitive rate cards to inform pricing strategies and identify sweet spots for Wayfair's offerings.

Internal Collaboration:

Work closely with the Supplier Integration and Management (SIM) team, CastleGate Fulfillment, and other internal stakeholders to align on sales strategies and ensure seamless supplier onboarding.
Utilize Salesforce to track leads and manage the sales process.
Contribute to ongoing refinements of our product offerings and pricing


Qualifications:

Proven sales experience 2-3 years, preferably in logistics, supply chain, or e-commerce.
Team management experience 2-3 years.
Strong understanding of 3rd Party Logistics (3PL) and fulfillment operations.
Excellent communication, presentation, and negotiation skills.
Ability to articulate complex value propositions clearly and concisely.
Demonstrated ability to build and maintain strong relationships with customers.
Results-oriented with a track record of achieving and exceeding sales targets.
Familiarity with Salesforce or similar CRM systems is a plus.
Knowledge of Multichannel/3PL fulfillment processes is highly desirable.

About Wayfair Inc.
Wayfair is one of the worlds largest online destinations for the home. Whether you work in our global headquarters in Boston, or in our warehouses or offices throughout the world, were reinventing the way people shop for their homes. Through our commitment to industry-leading technology and creative problem-solving, we are confident that Wayfair will be home to the most rewarding work of your career. If youre looking for rapid growth, constant learning, and dynamic challenges, then youll find that amazing career opportunities are knocking.
No matter who you are, Wayfair is a place you can call home. Were a community of innovators, risk-takers, and trailblazers who celebrate our differences, and know that our unique perspectives make us stronger, smarter, and well-positioned for success. We value and rely on the collective voices of our employees, customers, community, and suppliers to help guide us as we build a better Wayfair  and world  for all. Every voice, every perspective matters. Thats why were proud to be an equal opportunity employer. We do not discriminate on the basis of race, color, ethnicity, ancestry, religion, sex, national origin, sexual orientation, age, citizenship status, marital status, disability, gender identity, gender expression, veteran status, genetic information, or any other legally protected characteristic.
Your personal data is processed in accordance with our Candidate Privacy Notice (https://www.wayfair.com/careers/privacy). If you have any questions or wish to exercise your rights under applicable privacy and data protection laws, please contact us at dataprotectionofficer@wayfair.com."
1898787,"Commercial Analyst - Early Careers (Summer 2025 Start)","https://www.wayfair.com/careers/jobs/7728738002?gh_jid=7728738002","Wayfair","Boston","No",1,"Internship","2025-09-23T20:25:27.371927Z","Summer 2025 Start
Location: Boston, Massachusetts
Additional Details:

This is a Boston based opportunity with a 4 day in office expectation (Monday - Thursday) with 1 day remote (Friday).
At this time, Wayfair will not sponsor applicants for employment authorization for this position for the following work visas: STEM OPT EAD, H-1B, H-1B1, E-3, O-1, J-1, or TN.
The salary range for this position is $80,000 - $84,000 per year. The base salary offered may vary depending on location, job-related knowledge, skills, and experience.

Who We Are: 
Wayfair is continuing to expand our commitment to hiring and supporting talent early in their careers, focusing on filling opportunities with experienced graduates who have 1-3 years of experience.
Wayfairs Commercial organization delivers on Wayfairs promise to help everyone anywhere create their feeling of home through building an unparalleled selection, driving tangible value, and ensuring a seamless customer experience. This team builds strong relationships with suppliers to provide true partnership in helping customers create a space that reflects who they are and what they need. They attract, grow, and retain Wayfairs customer base through innovative marketing strategies. This team curates and refines product collections to enhance and optimize the shopping journey. The Commercial team also offers outstanding support to meet customers where they are through home services, financing options, and direct sales interactions.
 
What Youll Do: As a Commercial Analyst at Wayfair, you will collaborate with cross-functional teams to shape strategies that deliver value to our customers and strengthen supplier partnerships. Your responsibilities will involve diving into data, identifying key trends, and using your insights to support decision-making across various areas of the business. Specific duties include:

Data Analysis &amp; Reporting: Work with large datasets to identify trends, perform analyses, and develop reports to drive business decisions across different Commercial functions.
Strategic Execution: Contribute to the development and execution of key initiatives across marketing, pricing, product curation, and competitive analysis that align with Wayfairs growth strategies.
Supplier Partnership Optimization: Partner with suppliers to optimize product offerings, refine selection, and enhance the shopping experience by using data to guide decisions.
Customer Experience Enhancement: Use insights from customer behavior and feedback to continuously refine and enhance the shopping experience across Wayfair platforms.
Problem-Solving: Tackle ambiguous challenges by leveraging your analytical skills to generate actionable solutions that deliver measurable improvements in profitability, customer satisfaction, and operational efficiency.
Technology Utilization: Use advanced analytical tools and techniques (Excel, SQL, R, Python) to build data-driven insights and recommend improvements to business processes and outcomes.

 
What Youll Need: 
Basic Qualifications: 

1-3 years of transferable experience in a corporate environment, including internship and co-op experience.
Experience with Microsoft Excel or Google Sheets, SQL or GBQ, and data visualization tools such as Google Data Studio (Looker, Tableau, or PowerBI)
Authorization to work in the United States without visa sponsorship by Wayfair now or in the future. Visa sponsorship includes the following work visas: STEM OPT EAD, H-1B, H-1B1, E-3, O-1, J-1, or TN.

Preferred Qualifications: 

Bachelor's degree in a quantitative field
Familiarity with any programming language (R, Python) is a plus, including motivation to learn and develop the skill-set
Strong consultative skills: ability to work effectively and persuasively with a highly cross- functional group of business partners 
Strong business acumen: ability to understand how various parts of the business interact; can identify and approach problems from a customer or supplier perspective 
Exceptional analytical and quantitative skills: excited about working with and synthesizing big data into actionable insights; comfortable using data software to conduct analyses and synthesize findings 
Exceptional problem-solving and execution skills: ability to make decisions, reprioritize tasks, and draw conclusions in the face of ambiguity 
Excellent written and verbal communication skills 
Proficient with Microsoft Excel
Familiarity with any programming language is a plus, including motivation to learn and develop the skill-set (Google BigQuery/SQL, R, Python)

Possible Team Placements: 

Analyst, Global Credit Card Programs: The Fintech &amp; Loyalty (F&amp;L) organization builds and manages the foundational systems, financial products, and fraud detection and prevention services that provide customers with a secure, seamless, and rewarding payment experience. F&amp;L partners with 30+ organizations worldwide to provide a robust selection of gifting, paying, and financing options, to securely process $12B+ in annual transaction volume, and to detect, prevent, and mitigate fraud.
North America/Europe Retail Tech Analytics: The North America/Europe Retail Tech Analytics Team empowers stakeholders across the Global Supplier Organization, including teams to grow their businesses through data-driven analytics, scalable tools, and streamlined processes.
Global Marketing: The Marketing team drives growth for Wayfair on every major advertising platform, owning the strategy, analytics, and operations for our portfolio of cutting-edge digital and offline marketing channels.
Profit Management: The Profit Management team drives the pricing strategy, execution, and ultimately the gross margin profitability across all Wayfair brands, including Wayfair.com, Canada, Perigold, Specialty Retail Brands and Wayfair Professional.Competitive Intelligence: The Competitive Intelligence team is responsible for gathering data on Wayfairs competitors, and leveraging it to meet business goals by evaluating market share, optimizing our competitor web page crawling, and testing novel ways to seek out new competitor data. Business Trends: The Business Trends team works with Wayfairs most senior leadership and all business functions in identifying, monitoring, and intervening on metric trends which drive revenue and long-term customer lifetime value (CLV). Curation, Brands, &amp; Stores Analytics: The Curation, Brands, &amp; Stores Analytics team is the centralized analytics group covering all brands and channels with the goal of giving our curation teams the tools, reporting, and insights to drive excellent customer outcomes, to put the best items in front of customers, and to merchandise those items perfectly.
Catalog Merchandising: The Catalog Merchandising team at Wayfair plays a crucial role within the broader commercial organization by ensuring Wayfair is an easy, intuitive, and stable place for suppliers to sell their products. Product addition is seamless and each item is well curated (ex. has Imagery, complete and accurate attributes, has reviews, fast shipping, etc.). This curation helps customers discover the item thats right for them, with confidence and satisfaction. As part of this team, you might work on 3 parts of the product lifecycle - Product Addition, Product Curation/Health &amp; Product Presentation.
Global Sales: The Global Sales team at Wayfair is responsible for driving revenue growth across all of Wayfair's marketplaces and channels worldwide. This team develops and executes strategies to attract, engage, and retain customers globally, leveraging a deep understanding of international markets and consumer behavior. They collaborate closely with various internal teams to optimize the customer journey and ensure a seamless shopping experience, ultimately maximizing sales and market share on a global scale.
Promotions: This role provides a distinct opportunity to influence decisions that have significant impact across many major business functions at Wayfair. Promotions Analysts constantly use data to drive profitable top line revenue, while working cross-functionally to affect product selection, merchandising, operations, and marketing initiatives. Our Analysts play a key role in building cutting edge Big Data and leveraging these unique, proprietary, and massive datasets, coupled with a constant flow of experimentation on consumer response, to answer thorny questions that guide our go-to-market strategy.

Wayfair's In-Office Policy:
All Boston-based corporate employees will be in office in a hybrid capacity. Employees will work in the office on designated days, Monday, Tuesday, Wednesday, and Thursday, and work remotely the other 1 day of the week.
Why Youll Love Wayfair:

Time Off:

Paid Holidays
Paid Time Off (PTO)

Health &amp; Wellness:

Full Health Benefits (Medical, Dental, Vision, HSA/FSA)
Life Insurance
Disability Protection (Short Term &amp; Long Term Disability) 
Global Wellbeing: Gym/Fitness discounts (including US Peloton, Global ClassPass, and various regional gym memberships)
Mental Health Support (Global Mental Health, Global Wayhealthy Recordings)
Caregiver Services

Financial Growth &amp; Security:

401K Matching (Employee Matching Program)
Tuition Reimbursement 
Financial Health Education (Knowledge of Financial Education - KOFE)
Tax Advantaged Accounts

Family Support:

Family Planning Support
Parental Leave
Global Surrogacy &amp; Adoption Policy

Professional Development &amp; Recognition:

Rewards &amp; Recognition 
Global Employee Anniversary Awards 
Paid Volunteer Work 

Unique Perks:

Employee Discount 
U.S. Bluebikes Membership
Global Pod Outings

Work/Life Balance:

Emphasizing a supportive &amp; flexible work environment that encourages a balance between personal and professional commitments 


Purpose &amp; Inclusion at Wayfair:At Wayfair, we pride ourselves on fostering an environment where every individual experiences a fair and equitable employee journey. We are committed to developing targeted resources that raise awareness around inclusion and eliminate barriers, ensuring Wayfair provides a fair and inclusive workplace experience for everyone.
Social Impact &amp; Responsibility:At Wayfair, we focus on helping people on their journey to home - specifically those who have lost their way from home. We do this by leveraging our best assets, such as collaborating with leading nonprofit organizations, coordinating in-kind product donations, empowering our employees to get involved through paid volunteer time off programs, and encouraging our customers to donate. This multi-faceted approach allows us to support communities in need in authentic ways that align with Wayfair's broader mission of helping everyone, anywhere create their sense of home.
Assistance for Individuals with Disabilities
Wayfair is fully committed to providing equal opportunities for all individuals, including individuals with disabilities. As part of this commitment, Wayfair will make reasonable accommodations to the known physical or mental limitations of qualified individuals with disabilities, unless doing so would impose an undue hardship on business operations. If you require a reasonable accommodation to participate in the job application or interview process, please let us know by completing our Accommodations for Applicants form.
Need Assistance?
For more information about applying for a career at Wayfair, visit our FAQ page here.Massachusetts Applicants: I understand that it is unlawful in Massachusetts to require or administer a lie detector test as a condition of employment or continued employment. An employer who violates this law shall be subject to criminal penalties and civil liability.
At this time, Wayfair does not provide sponsorship for employment authorization for this position.About Wayfair Inc.
Wayfair is one of the worlds largest online destinations for the home. Whether you work in our global headquarters in Boston, or in our warehouses or offices throughout the world, were reinventing the way people shop for their homes. Through our commitment to industry-leading technology and creative problem-solving, we are confident that Wayfair will be home to the most rewarding work of your career. If youre looking for rapid growth, constant learning, and dynamic challenges, then youll find that amazing career opportunities are knocking.
No matter who you are, Wayfair is a place you can call home. Were a community of innovators, risk-takers, and trailblazers who celebrate our differences, and know that our unique perspectives make us stronger, smarter, and well-positioned for success. We value and rely on the collective voices of our employees, customers, community, and suppliers to help guide us as we build a better Wayfair  and world  for all. Every voice, every perspective matters. Thats why were proud to be an equal opportunity employer. We do not discriminate on the basis of race, color, ethnicity, ancestry, religion, sex, national origin, sexual orientation, age, citizenship status, marital status, disability, gender identity, gender expression, veteran status, genetic information, or any other legally protected characteristic.
Your personal data is processed in accordance with our Candidate Privacy Notice (https://www.wayfair.com/careers/privacy). If you have any questions or wish to exercise your rights under applicable privacy and data protection laws, please contact us at dataprotectionofficer@wayfair.com."
